question,choices,answer
"A sinusoidal current source, 10 cos 1000t, is in parallel both with a 20-ohm resistor and the series combination of a 10-ohm resistor and a 10-mH inductor. Find the equation of the voltage across the 10 -ohm resistor.","[""63.25 cos (1000t \u2013 18.43\u00b0)"",""61.32 cos (1000t \u2013 20.34\u00b0)"",""59.36 cos (1000t \u2013 17.45\u00b0)"",""60.12 cos (1000t \u2013 19.38\u00b0)""]",0
"A 1-hp, 220 V, 60 Hz capacitor-start motor has main and auxiliary winding impedance at starting of 3.5 + j2.5 ohms and 8.6 + j2.5 ohms, respectively. Determine the value of the starting capacitance that will place the main and auxiliary winding currents 90 apart at starting,","[""186.75 \u03bcF"",""174.35 \u03bcF"",""182.43 \u03bcF"",""170.67 \u03bcF""]",2
"Two impedances A and B are connected in parallel across a 120 V ac supply. The total current and the current in each impedance is adjusted to 20 A. The power drawn by A is doubled that of B and the power factor is lagging. Determine the power factor of A.","[""0.650 lagging"",""0.704 lagging"",""0.841 lagging"",""0.677 lagging""]",0
"A coil of 50-ohm resistance and of 150-mH inductance is connected in parallel with a 50-μF capacitor. If the source voltage is 100 sin (ωt + 30°), what is the equation of the line current?","[""1.91 sin (\u03c9t + 52.5\u00b0)"",""1.25 sin (\u03c9t + 75.5\u00b0)"",""1.82 sin (\u03c9t \u2013 62\u00b0)"",""1.32 sin (\u03c9t \u2013 75.5\u00b0)""]",1
"A resistor R is connected in parallel with a 10-ohm inductive reactance. The combination is then connected in series with a 4-ohm capacitive reactance. The whole combination is connected across a 100-volt, 60 Hz supply, How much is R if the angle between the supply voltage and the total current is 45 degrees?","[""12 ohms"",""25 ohms"",""16 ohms"",""20 ohms""]",3
"Three impedances Z<sub>1</sub> = 1 – j4 ohms, Z<sub>2</sub> = – j6 ohms and Z<sub>3</sub> = 4 + j3 ohms are connected in series-parallel. Z<sub>1</sub> is connected in series with the parallel combination of Z<sub>2</sub> and Z<sub>3</sub>. Determine the equivalent impedance of the combination.","[""4.32 \u2013 j1.21 ohms"",""2.23 \u2013 j3.32 ohms"",""6.76 \u2013 j5.68 ohms"",""5.42 \u2013 j7.21 ohms""]",2
"A 5-ohm resistor is connected in parallel with a 10-ohm inductive reactance. The combination is then connected in series with a 4-ohm capacitive reactance. The whole combination is connected across a 100-volt, 60 Hz supply. How much is the total current drawn by the circuit?","[""22.36 A"",""20.45 A"",""23.16 A"",""19.89 A""]",0
"A non-inductive resistor R is connected in parallel with an inductive reactance of 10 ohms. The combination is then connected in series with a capacitive reactance of 5 ohms. The whole combination is connected across a 100-volt, 60 Hz ac source. If R is equal to 5 ohms, solve for the voltage across the parallel combination.","[""87.53 V"",""88.34 V"",""89.44 V"",""91.87 V""]",2
"Three impedances Z<sub>1</sub> = 1 – j4 ohms, Z<sub>2</sub> = – j6 ohms and Z<sub>3</sub> = 4 + j3 ohms respectively are connected in series-parallel. Z<sub>1</sub> is connected in series with the parallel combination of Z<sub>2</sub> and Z<sub>3</sub>. If this circuit is connected across a 230 V, 60 Hz source, determine the voltage across the parallel combination of Z<sub>2</sub> and Z<sub>3</sub>.","[""156.3 V"",""146.8 V"",""135.7 V"",""163.2 V""]",0
"Given three impedances: Z<sub>1</sub> = 10 + j0 ohms, Z<sub>2</sub> = 3 + j4 ohms and Z<sub>3</sub> = 8 – j6 ohms. Impedance Z<sub>2</sub> and Z<sub>3</sub> are connected in parallel and the combination is connected in series with impedance Z<sub>1</sub> across a 120 V single-phase 60 Hz source. Find the total power drawn by the impedance.","[""1008 W"",""1204 W"",""1038 W"",""1103 W""]",0
"If admittance Y = 0.06 – j0.08 mho, then conductance G equals","[""-0.06"",""0.06"",""0.08"",""-0.08""]",1
"A parallel circuit consists of a resistor having a conductance of 4 mhos, an inductive reactor having a susceptance of 8 mhos and a capacitive reactor having a susceptance of 5 mhos. What is the impedance of the circuit?","[""0.11 + j0.13 ohms"",""0.13 + j0.11 ohms"",""0.12 + j0.16 ohms"",""0.16 + j0.12 ohms""]",3
"A capacitor branch having a ratio of X<sub>C</sub> to R of 5 is paralleled with impedance consisting of a 4 Ω resistance and a 3 Ω inductive reactance. The power factor of the resulting circuit is 0.8 leading. Find the size of the capacitor in μF if the frequency is 60 Hz.","[""879.9 \u03bcF"",""1078.9 \u03bcF"",""978.9 \u03bcF"",""778.9 \u03bcF""]",3
"A parallel-LC circuit can store energy fed to it power source and produces an output which is a continuous A.C. wave. It is often called a ____.","[""Tank circuit"",""Store circuit"",""Storage circuit"",""Power circuit""]",0
"What is the impedance relationship between the output of one circuit and the input of another circuit will provide maximum power transfer?","[""very low impedance"",""higher impedance"",""lower impedance"",""equal impedance""]",3
"The series circuit of R = 30 Ω &amp; X = 4 Ω and a parallel circuit of R’ and X’ have the same impedance and power factor. Calculate the value of R’ and X’.","[""8.33 \u03a9 and 6.25 \u03a9"",""2.56 \u03a9 and, 3.83 \u03a9"",""7.47 \u03a9 and 7.51 \u03a9"",""5.62 \u03a9 and 9.84 \u03a9""]",0
"A 25 Ω resistor, 2 mH inductor and 30 μF capacitor are connected in parallel across 100 sin (5000t + 45°) V source. Calculate the total current taken by the circuit.","[""4 sin (5000t + 45\u00b0) + 5 cos (5000t + 45\u00b0)"",""14 sin (5000t) + 15 sin (5000t + 45\u00b0)"",""40 sin (5000t + 30\u00b0) + 50 cos (5000t + 45\u00b0)"",""4 cos (5000t + 45\u00b0) + 5 cos (5000t + 45\u00b0)""]",0
"A parallel circuit with one branch of R = 5 Ω and a single unknown element in the other branch has the following applied voltage and total current e = 10 cos (50t + 60°) V and i = 5.38 cos (50t – 8.23°) A. The unknown element is ______.","[""L = 0.04 H"",""L = 0.02 H"",""C = 10 \u03bcF"",""C = 5 \u03bcF""]",0
"An impedance of 3 – j3 Ω is connected in parallel with 5 + j2 Ω. The voltmeter connected across 3 Ω resistance measures 45 V. Calculate the total current of the circuit.","[""22.4 A"",""41.3 A"",""13.4 A"",""7.91 A""]",0
"Two impedances Z<sub>A</sub> = 4 + j6 Ω and Z<sub>B</sub> are connected in parallel. The apparent power for the impedance B is 1490 VA. Determine the total apparent power.","[""4250 VA"",""3290 VA"",""2652 VA"",""8031 VA""]",0
"A feeder supplies two loads, one at 50 amperes at 50% power factor, the other 150 amperes at unity power factor. The total current supplied by the feeder is approximately ____.","[""180 A"",""200 A"",""175 A"",""150 A""]",0
"A fluorescent lamp and its inductive ballast draw a 1.0 A current at 50% lagging power factor from a 120-V, 60-Hz source. What is the over-all power factor when a 26.5 μF capacitor is connected across the fixture?","[""0.832 lagging"",""0.832 leading"",""0.5 leading"",""0.5 lagging""]",1
"Ten impedances connected in parallel draw the following individual current: 5∠0°, 5∠5°, 5∠10°, 5∠15°, 5∠20°, 5∠25°, 5∠30°, 5∠35°, 5∠40°, 5∠45°. What is the effective value of the total current?","[""48.444 A"",""34.255 A"",""25.345 A"",""84.389 A""]",0
"Ten impedances connected in parallel draw the following individual current: 5∠0°, 5∠5°, 5∠10°, 5∠15°, 5∠20°, 5∠25°, 5∠30°, 5∠35°, 5∠40°, 5∠45°. What is the equivalent impedance that could replace the impedances if the source voltage is 100 sin 150t V?","[""1.325\u2220-30\u00b0 \u03a9"",""6.026\u2220-2.5\u00b0 \u03a9"",""32.51\u222050\u00b0 \u03a9"",""1.46\u2220-22,5\u00b0 \u03a9""]",3
"Ten impedances connected in parallel draw the following individual current:5∠0°, 5∠5°, 5∠10°, 5∠15°, 5∠20°, 5∠25°, 5∠30°, 5∠35°, 5∠40°, 5∠45°. What is the equivalent power factor of the circuit?","[""0.924"",""0.866"",""0.707"",""0.876""]",0
"Ten impedances connected in parallel draw the following individual current: 5∠0°, 5∠5°, 5∠10°, 5∠15°, 5∠20°, 5∠25°, 5∠30°, 5∠35°, 5∠40°, 5∠45°. What element should be connected across the circuit so that the current would be in phase with the source?","[""54 mH"",""25.4 mH"",""13 mH"",""31 mH""]",1
"A small single-phase, 240 V induction motor is tested in parallel with 160 Ω resistor. The motor takes 2 amperes and the total current is 3 amperes. What is the power of the whole circuit?","[""800 W"",""360 W"",""220 W"",""580 W""]",0
"A capacitor is placed in parallel with two inductive loads, one of 20 A at 30° lagging and another of 40 A at 60° lagging. What current in amperes should flow in the capacitor so that the circuit will have a unity power factor?","[""35.8 A"",""44.6 A"",""28.8 A"",""50.2 A""]",1
"A coil of 10 Ω resistance and 0.1 H inductance is connected in parallel with a capacitor of unknown capacitance. If the total impedance of the combination is 100 Ω, determine the value of the capacitance.","[""50 \u03bcF"",""100 \u03bcF"",""150 \u03bcF"",""200 \u03bcF""]",0
"An impedance equal to 4.44∠60° Ω is connected across a 220 V source. What should be the value of the second impedance in parallel with the first, if the total power delivered to the circuit is to be 16.5 kW and the overall power factor is to be unity?","[""2.21\u222030.1\u00b0 \u03a9"",""3.33\u2220-40.9\u00b0 \u03a9"",""5.63\u222030\u00b0 \u03a9"",""6.543\u2220-45\u00b0 \u03a9""]",1
"An inductive reactance of 8 ohms is connected in parallel with a capacitive reactance of 18 ohms. This combination is then connected in series with a variable resistance. For what value of resistance will the power factor be 0.5?","[""8.314 \u03a9"",""3.318 \u03a9"",""13.81 \u03a9"",""1.381 \u03a9""]",0
"Two impedances Z<sub>1</sub> = 3 + j4 and Z<sub>2</sub> = 5 – j8.66 ohms respectively are connected in parallel. If the combination is connected across a 240 V AC source, how much is the total current?","[""44.4 A"",""42.1 A"",""40.6 A"",""39.9 A""]",0
"A resistance of 20 ohms and an unknown capacitance are connected in parallel across a 110 V, variable frequency AC source. When the frequency is 60 Hz, the current drawn by the circuit is 6 A. At what frequency will the current drawn fall to 5.8 A?","[""42. 33 Hz"",""50.12 Hz"",""46.02 Hz"",""44.18 Hz""]",2
"Two parallel branches have admittances 0.3 + j0.4 and 0.2 – j0.25 S, respectively. If the current in the first branch is 10 A, determine the total current supplied to the parallel combination.","[""10.44 A"",""12.10 A"",""15.32 A"",""11.24 A""]",0
"An inductive reactance of 3 ohms is connected in parallel with a capacitive reactance of 4 ohms. If the combination is connected in series with a 4 ohm resistance, solve for the power factor of the whole combination.","[""0.333"",""0.409"",""0.567"",""0.316""]",3
"An R-L circuit has Z = (6 + j8) ohm. Its susceptance is ____ siemens.","[""0.06"",""0.08"",""0.1"",""-0.08""]",3
"The impedances of two parallel branches of a circuit are (10 + j10) and (10 – j10) respectively. The impedance of the parallel combination is","[""20 + j0"",""10 + j0"",""5 \u2013 j5"",""0 \u2013 j20""]",2
"Domestic appliances are connected in parallel across ac mains because","[""it is a simple arrangement"",""operation of each appliance becomes independent of each other"",""appliances have same current ratings"",""this arrangement occupies less space""]",1
"When a parallel ac circuit contains a number of branches, then it is convenient to solve the circuit by","[""phasor diagram"",""phasor algebra"",""equivalent impedance method"",""none of the above""]",1
"If the admittance of a parallel ac circuit is increased, the circuit current","[""remains constant"",""is decreased"",""is increased"",""none of these""]",2
"The conductance and susceptance components of admittance are","[""series elements"",""parallel elements"",""series-parallel elements"",""none of these""]",1
"The impedance of a circuit is 10 ohms. If the inductive susceptance is 1 siemen, then inductive reactance of the circuit is","[""10 ohms"",""1 ohm"",""100 ohms"",""none of these""]",2
"The conductance and inductive susceptance of a circuit have the same magnitude. The power factor of the circuit is","[""1"",""0.5"",""0.707"",""0.866""]",2
"The admittance of a circuit is (0.1 + j0.8) S. The circuit is","[""resistive"",""capacitive"",""inductive"",""none of these""]",1
"In a parallel ac circuit, power loss is due to","[""conductance alone"",""susceptance alone"",""both conductance and susceptance"",""none of these""]",0
"The admittance of a parallel circuit is 0.12∠-30° S. The circuit is","[""inductive"",""capacitive"",""resistive"",""none of these""]",0
"A circuit have an impedance of (1 – j2) ohms. The susceptance of the circuit is","[""0.1 S"",""0.2 S"",""0.4 S"",""none of these""]",2
"A circuit has admittance of 0.1 S and conductance of 0.08 S. The power factor of the circuit is","[""0.1"",""0.8"",""0.08"",""none of these""]",1
"When an sinusoidal voltage is applied across R-L parallel circuit so that R = X<sub>L</sub> the phase angle will be","[""45\u00b0 lagging"",""45\u00b0 leading"",""90\u00b0 lagging"",""90\u00b0 leading""]",0
"In a parallel R-L circuit if IR is the current in resistor and IL is the current in the inductor, then","[""I<sub>R<\/sub> lags I<sub>L<\/sub> by 90\u00b0"",""I<sub>R<\/sub> leads I<sub>L<\/sub> by 270\u00b0"",""I<sub>L<\/sub> leads I<sub>R<\/sub> by 270\u00b0"",""I<sub>L<\/sub> lags I<sub>R<\/sub> by 90\u00b0""]",3
"In a parallel RC circuit,","[""I<sub>C<\/sub> lags I<sub>R<\/sub> by 90\u00b0"",""I<sub>R<\/sub> and I<sub>C<\/sub> are in phase"",""I<sub>C<\/sub> leads I<sub>R<\/sub> by 90\u00b0"",""I<sub>R<\/sub> leads I<sub>C<\/sub> by 90\u00b0""]",2
"In a parallel RC circuit,","[""V<sub>C<\/sub> and I<sub>R<\/sub> are in phase"",""V<sub>C<\/sub> and I<sub>C<\/sub> are in phase"",""I<sub>C<\/sub> and I<sub>R<\/sub> are in phase"",""V<sub>C<\/sub> and I<sub>R<\/sub> are 90\u00b0 out of phase""]",0
"When the frequency of the applied voltage increases in a parallel RC circuit","[""the phase angle, \u03b8<sub>T<\/sub>, increases"",""Z<sub>EQ<\/sub> increases"",""Z<sub>EQ<\/sub> decreases"",""both A and C""]",3
"In a parallel RL circuit,","[""i<sub>L<\/sub> lags i<sub>R<\/sub> by 90\u00b0"",""i<sub>L<\/sub> leads i<sub>R<\/sub> by 90\u00b0"",""i<sub>L<\/sub> and i<sub>R<\/sub> are in phase"",""i<sub>R<\/sub> lags i<sub>L<\/sub> by 90\u00b0""]",0
"In a parallel RL circuit,","[""V<sub>T<\/sub> and I<sub>L<\/sub> are in phase"",""I<sub>L<\/sub> and I<sub>R<\/sub> are in phase"",""V<sub>T<\/sub> and I<sub>R<\/sub> are in phase"",""V<sub>T<\/sub> and I<sub>R<\/sub> are 90\u00b0 out of phase""]",2
"When the frequency of the applied voltage decreases in a parallel RL circuit","[""the phase angle, \u03b8<sub>I<\/sub>, becomes less negative"",""Z<sub>EQ<\/sub> increases"",""Z<sub>EQ<\/sub> decreases"",""both A and B""]",2
"When the frequency of the applied voltage increases in a parallel RL circuit","[""\u03b8<sub>Z<\/sub> increases"",""Z<sub>T<\/sub> decreases"",""Z<sub>T<\/sub> increases"",""both A and C""]",3
"In an ac circuit with only parallel inductors","[""I<sub>T<\/sub> lags V<sub>T<\/sub> by 90\u00b0"",""V<sub>T<\/sub> lags I<sub>T<\/sub> by 90\u00b0"",""V<sub>T<\/sub> and I<sub>T<\/sub> are in phase"",""none of these""]",0
"In a parallel ac circuit with X<sub>L</sub> and X<sub>C</sub>","[""I<sub>L<\/sub> and I<sub>C<\/sub> are 90\u00b0 out of phase"",""I<sub>L<\/sub> and I<sub>C<\/sub> are in phase"",""I<sub>L<\/sub> and I<sub>C<\/sub> are 180\u00b0 out of phase"",""X<sub>L<\/sub> and X<sub>C<\/sub> are 90\u00b0 out of phase""]",2
"A series circuit consists of a 20-ohm resistance, a 150 mH inductance and an unknown capacitance. The circuit is supplied with a voltage v = 100 sin 377t. Find the value of capacitance at resonance.","[""42 \u03bcF"",""47 \u03bcF"",""34.65 \u03bcF"",""72.57 \u03bcF""]",1
"A 5 mH pure inductance is connected in parallel with one microfarad capacitor. What frequency will the circuit be antiresonance?","[""250 Hz"",""2250 Hz"",""60 Hz"",""100 Hz""]",1
