question,choices,answer
"A series circuit consisting of a 66.2 μF capacitor and a variable resistor. For what two values of resistance will the power taken by the circuit be 172.8 watts, if the impressed 60-cycle emf is 120 volts?","[""85.33 &amp; 3.33 ohms"",""53.33 &amp; 30 ohms"",""5.33 &amp; 3.0 ohms"",""83.33 &amp; 5.33 ohms""]",1
"A series circuit composed of 0.2 H inductor and a 74 μF capacitor is connected to a 60 V variable frequency source. At what frequency will the current be 4 A with lagging power factor?","[""47.767 Hz"",""74.68 Hz"",""60 Hz"",""50 Hz""]",0
"A 30 ohm resistor is connected in parallel with an inductor of inductive reactance X<sub>L</sub>. The combination is then connected in series with a capacitor of reactance X<sub>C</sub>. What is the value of X<sub>L</sub> and X<sub>C</sub> if the total impedance is 1.92 ohms?","[""7.84 and 7.34"",""47.4 and 47.3"",""44.8 and 84.21"",""84.7 and 34.7""]",0
"An impedance of 100 Ω resistance and an unknown inductance is connected across the capacitor. The resulting impedance is a pure resistance of 500 Ω if ω = 10<sup>5</sup> rad/sec. Calculate the values of inductor and capacitor.","[""1 \u03bcF &amp; 2 mH"",""5 \u03bcF &amp; 1 mH"",""7 \u03bcF &amp; 3 mH"",""0.04 \u03bcF &amp; 2 mH""]",3
"The voltage across the resistor, inductor and capacitor in series is 60 V, 90 V and 10 V respectively. What is the voltage across this circuit?","[""160 V"",""140 V"",""100 V"",""50 V""]",2
"The open circuit voltage of an alternator is 127 V and its internal impedance is 10∠10° Ω. Find the voltage across a load of 30∠-30° Ω.","[""100\u2220-9.7\u00b0 V"",""97\u2220-10\u00b0 V"",""79\u2220-10\u00b0 V"",""100\u2220-7.9\u00b0 V""]",0
"The maximum values of alternating voltage and current are 400 V and 20 A, respectively. In a circuit connected to 50 Hz supply and these quantities are sinusoidal. The instantaneous values of voltage and current are 283 V and 10 A respectively at t = 0 both increasing positively. What is power factor of the circuit?","[""0.707"",""0.83"",""0.85"",""0.965""]",3
"The potential difference measured across a coil is 4.5 V, when it carries a direct current of 9 A. The same coil when carries an alternating current of 9 A at 25 Hz, the potential difference is 24 V. Find the power when it is supplied by 50 V, 50 Hz supply.","[""45 W"",""54 W"",""63 W"",""30 W""]",0
"Two coils A and B are connected in series across a 240 V, 50 Hz supply. The resistance of A is 5 Ω and the inductance of B is 0.015 H. If the input from the supply is 3 kW and 2 kVAR, find the inductance of A and resistance of B.","[""0.0132 H &amp; 8.3 \u03a9"",""0.215 H &amp; 3.8 \u03a9"",""0.026 H &amp; 12 \u03a9"",""0.031 H &amp; 5.3 \u03a9""]",0
"A current of 5 A flows through a non-inductive resistance in series with a choking coil when supplied at 250 V, 50 Hz. If the voltage across the resistance is 120 V and across the coil is 200 V, calculate the power absorbed by the coil in watts.","[""168.75 W"",""137.5 W"",""51.37 W"",""75.31 W""]",0
"A single phase, 7.46 kW motor is supplied from a 400 V, 50 Hz AC mains. If its efficiency is 85% and the power factor is 0.8 lagging, find the reactive component of the input current.","[""16.46 A"",""21.95 A"",""27.43 A"",""21 A""]",0
"A series RLC circuit consists of 20 ohms resistance, 0.2 H inductance and an unknown capacitance. What is the value of the capacitance if the circuit has a leading angle of 45° at 60 Hz?","[""35.18 \u03bcF"",""47.9 \u03bcF"",""27.8 \u03bcF"",""30.7 \u03bcF""]",2
"A 3 HP, 120 V, 60 Hz induction motor operating at 80% efficiency and 0.866 lagging power factor is to be used temporarily with 240 V, 60 Hz source. What resistance in series with the motor will be required for the motor to have 120 V across its terminals at full load?","[""6.68 \u03a9"",""4.77 \u03a9"",""13.76 \u03a9"",""9.54 \u03a9""]",1
"A resistor and a coil are connected in series with a voltage source. If the voltage across the coil is 10 sin (866t + 70°) V and the current flowing through the resistor is 2 cos (866t – 80°) A, what is the resistance of the coil?","[""4.92 \u03a9"",""2.5 \u03a9"",""5 \u03a9"",""4.33 \u03a9""]",1
"A coil has a resistance of 6 ohms and an inductance of 0.02 H. When a noninductive resistor is connected in series with the coil, the current drawn when connected to 220 V DC source is equal to the current drawn by the coil alone across a 220 V, 60 Hz source. Determine the resistance of the non-inductive resistor.","[""3.63 \u03a9"",""6.39 \u03a9"",""3.69 \u03a9"",""3.96 \u03a9""]",0
"A series RL circuit has L = 0.02 H and an impedance of 17.85 Ω. When a sinusoidal voltage is applied, the current lags the voltage by 63.5°. What is the value of the angular frequency?","[""400 rad\/sec"",""500 rad\/sec"",""600 rad\/sec"",""800 rad\/sec""]",3
"A 50 Ω resistance is connected in series with a coil having 25 Ω resistance and 150 mH inductance. The circuit is connected to a voltage source of 200 sin ωt. Calculate the instantaneous current.","[""2.9 sin \u03c9t"",""1.7 sin (\u03c9t + 37\u00b0)"",""2.1 sin (\u03c9t \u2013 37\u00b0)"",""5.11 sin (\u03c9t \u2013 37\u00b0)""]",2
"A coil having a resistance of 25 Ω and an inductance of 150 mH is connected in series with a 80 μF capacitor across a voltage source of 200 sin 377t. What is its instantaneous current?","[""5.84 cos (377t \u2013 43\u00b0)"",""5.84 sin 377t"",""5.84 sin (377t + 43\u00b0)"",""5.84 sin (377t \u2013 43\u00b0)""]",3
"A coil with a 15 Ω resistance is connected in series with a capacitor. At 60 Hz source, the impedance is measured at 15 + j11.27 Ω while in 30 Hz source it is measured as 15 – j7.24 Ω. Calculate the inductance of the coil.","[""52.7 mH"",""65.8 mH"",""41.2 mH"",""11.27 mH""]",0
"An impedance coil has a resistance and inductance of 20 ohms and 0.05 H respectively. What value of dc voltage can be applied to the coil in order that it will take the same power from a 220 V 60 Hz mains?","[""188 V"",""220 V"",""160 V"",""120 V""]",2
"A ½ HP, 110 V, 60 Hz, single-phase induction motor has an efficiency of 88% and a power factor of 0.707 lagging at rated load. This motor is to be connected temporarily on a 220 V, 60 Hz line. Determine the resistance required to be placed in series with the motor in order to prevent the machine from experiencing overcurrent?","[""25.2 ohms"",""23.5 ohms"",""19.5 ohms"",""27.6 ohms""]",1
"Two coils A and B known to have the same resistance are connected in series across a 110 V, 60 cycle line. The current and power delivered by the source are respectively 4.1 A and 300 W. If the voltage across coil A is twice that across coil B, calculate the inductance of coil B.","[""8.63 mH"",""7.36 mH"",""9.02 mH"",""4.49 mH""]",0
"The total voltage in a series RL circuit ____ the current by an angle ____.","[""lags, of 90\u00b0"",""lags, between 0\u00b0 and 90\u00b0"",""leads, between 0\u00b0 and 90\u00b0"",""leads, between 90\u00b0 and 180\u00b0""]",2
"In a series RL circuit, the inductor current ____ the resistor current.","[""lags"",""is equal"",""leads"",""is negative""]",0
"The impedance triangle is similar to the ____ triangle with the resistance phasor in place of the ____.","[""current, resistor current"",""current, resistor voltage"",""voltage, impedance"",""voltage, resistor voltage""]",2
"In the impedance triangle the inductive reactance and impedance phasor are analogous to the ____ and ____ phasor respectively in the voltage triangle.","[""inductive voltage, total voltage"",""inductive current, total current"",""inductive voltage, resistive current"",""inductive current, resistive current""]",0
"In a series RL circuit, phasor diagram, total voltage may be represented by the ____ phasor and the resistor voltage may be represented by the ____ voltage.","[""current, voltage"",""impedance, resistance"",""current, resistance"",""impedance, inductance""]",1
"The phase angle of a series RL circuit is the angle between the ____ phasor and the ____ phasor.","[""resistance, inductive reactance"",""resistance, impedance"",""inductive reactance, impedance"",""none of the above""]",1
"The phase angle of a series RL circuit may be computed ____ as ____ or ____.","[""cos<sup>-1<\/sup> R\/X<sub>L<\/sub>, sin<sup>-1<\/sup> X<sub>L<\/sub>\/R, tan<sup>-1<\/sup> R\/Z"",""cos<sup>-1<\/sup> R\/Z, sin<sup>-1<\/sup> X<sub>L\/<\/sub>R, tan<sup>-1<\/sup> R\/XL"",""cos<sup>-1<\/sup> Z\/X<sub>L<\/sub>, sin<sup>-1<\/sup> R\/Z, tan<sup>-1<\/sup> X<sub>L<\/sub>\/R"",""cos<sup>-1<\/sup> R\/Z, sin<sup>-1<\/sup> X<sub>L<\/sub>\/Z, tan<sup>-1<\/sup> X<sub>L<\/sub>\/R""]",3
"A(n) ____ stores and returns energy to a circuit while a(n) ____ dissipates energy.","[""resistor, impedance"",""resistor, inductor"",""inductor, resistor"",""inductor, reactance""]",2
"For an RL circuit, the power factor cannot be less than ____ or greater than ____.","[""0, 1"",""1, 0"",""0, -1"",""\u20131, 0""]",0
"The voltage across a capacitor ____ the current through it by ____.","[""lags, 45\u00b0"",""lags, 90\u00b0"",""leads, 0\u00b0"",""leads, 90\u00b0""]",1
"If the resistance in a series RC circuit is increased the magnitude of the phase angle","[""increases"",""remains the same"",""decreases"",""changes to an indeterminate manner""]",2
"In a series RC circuit, the current ____ the total voltage by an angle.","[""lags, of 45\u00b0"",""lags of 0\u00b0"",""leads, between 0\u00b0 and 90\u00b0"",""leads, of 90\u00b0""]",2
"The resistance phasor for a series RC circuit points to the right. The capacitive reactance phasor points ____ while the diagonal of the rectangle having there two phasors as sides represents the ____.","[""up, impedance"",""left, current"",""down, impedance"",""up, total voltage""]",2
"The phase angle for a series RC circuit is defined as the angle between the ____ and the ____ phasors.","[""current, resistance voltage"",""current, total voltage"",""resistance voltage, capacitor voltage"",""R, X<sub>C<\/sub>""]",1
"The phase angle for a series RC circuit may be computed as the angle between the ____ and the ____ phasors.","[""resistance, impedance"",""resistance, reactance"",""resistance, impedance"",""none of these""]",0
"If a series RC circuit with 10 ohms and X<sub>C</sub> = 10 ohms carries a current of 1 ampere effective value the resistor voltage is ____ volts effective and the capacitor voltage is ____ volts effective.","[""10\/\u221a2 , 10\/\u221a2"",""10, 10"",""10\u221a2 , 10\u221a2"",""5, 10""]",1
"The power dissipated in a series RL circuit with R =10 ohms and X<sub>C</sub> = 10 ohms carrying an effective current of 3 amps is ____ watts.","[""30"",""30\u221a2"",""90"",""90\u221a2""]",2
"The magnitude of the power factor of an RC circuit with R = 10 ohms, X<sub>C</sub> = 10 ohms. I = 2 amp effective is ____.","[""1"",""0.5"",""0.707"",""0.02""]",2
"The net reactance in an RLC circuit is","[""X<sub>L<\/sub>"",""X<sub>C<\/sub> \u2013 X<sub>L <\/sub>"",""X<sub>C<\/sub>"",""X<sub>L<\/sub> \u2013 X<sub>C<\/sub>""]",3
"The impedance of a series RLC circuit is ____.","[""\u221a(R<sup>2<\/sup> + X<sub>L<\/sub><sup>2<\/sup> + X<sub>C<\/sub><sup>2<\/sup>)"",""\u221a(R<sup>2<\/sup> + X<sub>L<\/sub><sup>2<\/sup> \u2013 X<sub>C<\/sub><sup>2<\/sup>)"",""\u221a(R<sup>2<\/sup> + (X<sub>L<\/sub>+ X<sub>C<\/sub>)<sup>2<\/sup>)"",""\u221a(R<sup>2<\/sup> + (X<sub>L<\/sub>\u2013 X<sub>C<\/sub>)2)""]",3
"In a series RC circuit, the voltage across the capacitor and the resistor are 60 V and 80 V respectively. The input voltage should be","[""70\u222045\u00b0 V"",""100\u2220-37\u00b0 V"",""105\u2220-42\u00b0 V"",""108\u2220-60\u00b0 V""]",1
"The transient current are due to","[""voltage applied to circuit"",""resistance of the circuit"",""impedance of the circuit"",""changes in stored energy in inductance and capacitance""]",3
"To a highly inductive circuit, a small capacitance is added in series. The angle between voltage and current will","[""increase"",""decrease"",""remain nearly the same"",""become indeterminant""]",1
"In a series R-L circuit. V<sub>L</sub> ____ V<sub>R</sub> by ____ degrees.","[""lags, 45"",""lags, 90"",""leads, 90"",""leads, 45""]",2
"The voltage applied across an R-L circuit is equal to _____ of V<sub>R</sub> and V<sub>L</sub>.","[""arithmetic sum"",""algebraic sum"",""phasor sum"",""sum of the squares""]",2
"The power in an a.c. circuit is given by","[""VI cos \u03c6"",""VI sin \u03c6"",""I\u00b2 Z"",""I\u00b2 X<sub>L<\/sub>""]",0
"The p.f. of an R-C circuit is","[""often zero"",""between zero and 1"",""always unity"",""between zero and -1.0""]",1
"In an R-L-C circuit, v(t) = 20 sin (314t + 5π/6) and i(t) = 10 sin (314t + 2π/3). The p.f. of the circuit is ____ and power drawn is ____ watt.","[""0.5 lead, 200"",""0.886 lag, 186.6"",""0.866 lead, 173.2"",""0.5 lag, 50""]",1
"The input of an a.c. circuit having p.f. of 0.8 lagging is 20 kVA. The power drawn by the circuit is ____ kW.","[""12"",""20"",""16"",""8""]",2
"The power factor of an a.c. circuit is given by","[""cosine of the phase angle"",""tangent of the phase angle"",""the ratio R\/X<sub>L<\/sub>"",""the ratio X<sub>L<\/sub>\/Z""]",0
"In series R-L-C circuit, R = 100 Ω, X<sub>L</sub> = 300 Ω and X<sub>C</sub> = 200 Ω. The phase angle Φ of the circuit is _____ degrees.","[""0"",""90"",""45"",""-45""]",2
"The phase angle of a series R-L-C circuit is leading if","[""X<sub>L<\/sub> = 0"",""R = 0"",""X<sub>C<\/sub> &gt; X<sub>L<\/sub>"",""X<sub>C<\/sub> &lt; X<sub>L<\/sub>""]",2
"In an a.c. circuit, the ratio of kW/kVA represents","[""power factor"",""load factor"",""form factor"",""diversity factor""]",0
"If p.f. of a circuit is unity, its reactive power is","[""a maximum"",""equal to I\u00b2R"",""zero"",""a negative quantity""]",2
"An R-L-C circuit has R = 10 Ω, X<sub>L</sub> = 20 Ω and X<sub>C</sub> = 30 Ω. The impedance of the circuit is given by the expression.","[""Z = 10 + j20"",""Z = 10 + j50"",""Z = 10 \u2013 j20"",""Z = -10 + j20""]",2
"An alternating voltage e = 200 sin 314t is applied to a device which offers an ohmic resistance of 20 Ω to the flow of current in one direction while entirely preventing the flow in the opposite direction. The average value of current will be","[""5 A"",""3.18 A"",""1.57 A"",""1.10 A""]",1
"A 10 mH inductor carries a sinusoidal current of 1 A rms at a frequency of 50 Hz. The average power dissipated by the inductor is","[""0 W"",""0.25 W"",""0.5 W"",""1.0 W""]",0
"Power loss in an electrical circuit can take place in","[""inductance only"",""capacitance only"",""inductance and resistance"",""resistance only""]",3
"A circuit of zero lagging power factor behaves as","[""an inductive circuit"",""a capacitive circuit"",""R-L circuit"",""R-C circuit""]",0
"In an R-L series circuit the power factor is","[""leading"",""lagging"",""zero"",""unity""]",1
"When a sinusoidal voltage is applied across an R-L series circuit having R = X<sub>L</sub>, the phase angle will be","[""90\u00b0"",""45\u00b0 lagging"",""45\u00b0 leading"",""90\u00b0 leading""]",1
"An ac source having voltage e = 110 sin (ωt + π/3) is connected in an ac circuit. If the current drawn from the circuit varies as i = 5 sin (ωt – π/3) the impedance of the circuit will be","[""22 \u03a9"",""16 \u03a9"",""30.8 \u03a9"",""none of these""]",0
"An ac source of 200 Vrms supplies active power of 600 W and reactive power of 800 VAR. The rms current drawn from the source is","[""10 A"",""5 A"",""3.75 A"",""2.5 A""]",1
"A square wave is fed to an R-C circuit. Then","[""voltage across R is square and across C is not square"",""voltage across C is square and across R is not square"",""voltage across both R and C is square"",""voltage across both R and C is not square""]",3
"The voltage phasor of a circuit is 10∠15° V and the current phasor is 2∠-45° A. The active and reactive powers in the circuit are","[""10 W and 17.32 VAR"",""5 W and 8.66 VAR"",""20 W and 60 VAR"",""20\u221a2 W and 10\u221a2 VAR""]",0
"In a two-element series circuit, the applied voltage and resultant current are respectively, v(t) = 50 + 50 sin (5 x 10<sup>3</sup> t) and i(t) = 11.2 sin (5 x 10<sup>3</sup> t + 63.4°). The nature of the elements would be","[""R-L"",""R-C"",""L-C"",""neither R, nor L, nor C""]",1
"A series circuit passive elements has the following current and applied voltage: v = 200 sin (2,000t + 50°), i = 4 cos (2,000t + 13.2°). The circuit elements","[""must be resistance and capacitance"",""must be resistance and inductance"",""must be inductance, capacitance and resistance"",""could be either resistance and capacitance or resistance, inductance and capacitance""]",3
"A two terminal black box contains one of the R-L-C elements. The black box is connected to a 220 V ac supply. The current through the source is I. When a capacitance of 0.1 F is inserted in series between the source and the box, the current through the source is 2I. The element is","[""a resistance"",""an inductance"",""a capacitance"",""it is not possible to determine the element""]",1
"In an RL circuit, supplied from an ac source, the reactive power is proportional to the","[""the average energy stored in the electric field"",""the average energy stored in the magnetic field"",""sum of the average energy stored in the electric field and that stored in the magnetic field"",""difference of the average energy stored in the electric field and that stored in the magnetic field""]",3
"If a series RLC circuit excited by a voltage e = E sin ωt when LC &lt; 1/ω<sup>2</sup>","[""current lags behind the applied voltage"",""current leads the applied voltage"",""current is in phase with the applied voltage"",""voltage across L and C are equal""]",1
"Which of these statements is correct?","[""1 and 3"",""2 and 3"",""1 and 2"",""1, 2 and 3""]",0
"In an ac circuit if voltage V = (a + jb) and current I = (c + jd), then the power is given by","[""ac + ad"",""ac + bd"",""bc \u2013 ad"",""bc + ad""]",1
"A series R-L-C circuit, consisting of R = 10 Ω, X<sub>L</sub> = 20 Ω, X<sub>C</sub> = 20 Ω is connected across an ac supply of 100 V (rms). The magnitude and phase angle (with reference to supply voltage) of the voltage across the inductive coil are respectively","[""100 V, 90\u00b0"",""100 V, -90\u00b0"",""200 V, -90\u00b0"",""200 V, 90\u00b0""]",3
"For a capacitor in a sine wave ac circuit","[""v<sub>C<\/sub> lags i<sub>C<\/sub> by 90\u00b0"",""i<sub>C<\/sub> leads v<sub>C<\/sub> by 90\u00b0"",""i<sub>C<\/sub> and v<sub>C<\/sub> have the same frequency"",""all of these""]",3
"In a series RC circuit,","[""V<sub>C<\/sub> leads V<sub>R<\/sub> by 90\u00b0"",""V<sub>C<\/sub> and I are in phase"",""V<sub>C<\/sub> lags V<sub>R<\/sub> by 90\u00b0"",""both B and C""]",2
"In a series RC circuit,","[""V<sub>C<\/sub> and V<sub>R<\/sub> are in phase"",""V<sub>T<\/sub> and I are always in phase"",""V<sub>R<\/sub> and I are in phase"",""V<sub>R<\/sub> leads I by 90\u00b0""]",2
"When the frequency of the applied voltage increases in a series RC circuit","[""the phase angle, \u03b8<sub>T<\/sub>, becomes more negative"",""Z<sub>T<\/sub> increases"",""Z<sub>T<\/sub> decreases"",""both A and B""]",2
"Inductive reactance, X<sub>L</sub>","[""applies only to non-sinusoidal waveforms or dc"",""applies only to sine waves"",""applies to either sinusoidal or non-sinusoidal waveforms"",""is inversely proportional to frequency""]",1
"For an inductor in a sine wave ac circuit","[""V<sub>T<\/sub> leads i<sub>L<\/sub> by 90\u00b0"",""V<sub>T<\/sub> lags i<sub>L<\/sub> by 90\u00b0"",""V<sub>T<\/sub> and i<sub>L<\/sub> are in phase"",""none of these""]",0
"In a series RL circuit,","[""V<sub>T<\/sub> lags V<sub>R<\/sub> by 90\u00b0"",""V<sub>T<\/sub> leads V<sub>R<\/sub> by 90\u00b0"",""V<sub>R<\/sub> and I are in phase"",""both B and C""]",3
"In a series RL circuit where X<sub>L</sub> = R, the phase angle, θ<sub>Z</sub>, is","[""-45\u00b0"",""0\u00b0"",""90\u00b0"",""45\u00b0""]",3
"In an ac circuit with only series resistances","[""V<sub>T<\/sub> and I are in phase"",""R<sub>T<\/sub> =R1 + R2 + R3 + \u2026 + etc."",""each voltage drop is in phase with the series current"",""all of these""]",3
"The unit of apparent power is the","[""volt-ampere (VA)"",""watt (W)"",""volt-ampere-reactive (VAR)"",""joule (J)""]",0
"In an ac circuit with only series capacitors","[""V<sub>T<\/sub> leads I by 90\u00b0"",""V<sub>T<\/sub> lags I by 90\u00b0"",""each capacitor voltage drop leads I by 90\u00b0"",""both A and C""]",1
"The unit of real power is the","[""watt (W)"",""volt-ampere (VA)"",""joule (J)"",""volt-ampere-reactive (VAR)""]",0
"In a series RLC circuit","[""X<sub>L<\/sub> and X<sub>C<\/sub> are 180\u00b0 out of phase"",""I<sub>L<\/sub> and I<sub>C<\/sub> are 180\u00b0 out of phase"",""X<sub>L<\/sub> and X<sub>C<\/sub> are 90\u00b0 out of phase"",""X<sub>L<\/sub> and X<sub>C<\/sub> are in phase""]",0
"The power factor of an ordinary electric bulb is","[""zero"",""unity"",""slightly more than unity"",""slightly less than unity""]",1
"The power factor of an ac circuit is equal to","[""cosine of the phase angle"",""sine of the phase angle"",""unity for a resistive circuit"",""unity for a reactive circuit""]",0
"If f(t) = sin t + sin √2 t is passing through R = 1 ohm, what is the power dissipated in 1 ohm resistor?","[""1 W"",""2 W"",""since f(t) in non-periodic, not possible to find power"",""none of these""]",0
"A circuit consists of X<sub>L</sub> = j5 ohms, X<sub>C</sub> = -j5 ohms and R = 5 ohms all are connected in parallel. Find the equivalent impedance.","[""5.5 \u03a9"",""5.0 \u03a9"",""4.8 \u03a9"",""5.2 \u03a9""]",1
"Given: Z<sub>1</sub> = -j2.5 ohms; Z<sub>2</sub> = j4 ohms; Z<sub>3</sub> = 5 ohms; Z<sub>4</sub> = 1 + j5 ohms. If the four impedances are connected in parallel, find the equivalent impedance in ohms.","[""4.1 + j0.72"",""4.3 + j0.45"",""4.2 + j0.35"",""4.0 + j0.97""]",0
"Three impedances Z<sub>a</sub> = 3 + j4 ohms, Z<sub>b</sub> = 4 – j4 ohms and Z<sub>c</sub> = j3 ohms are connected in parallel. Solve for the pf of the combination.","[""0.653 leading"",""0.554 lagging"",""0.503 leading"",""0.620 lagging""]",1
"A pure capacitance of 530.515 x 10<sup>-6</sup> farad and an inductance of 530.515 x 10<sup>-4</sup> Henry are connected in parallel across an ac power source. Solve for the resultant impedance assuming that the frequency is 30 Hz.","[""10 \u03a9"",""infinite"",""zero"",""undefined""]",1
"A coil of a 50-ohm resistance and of 150 mH inductance is connected in parallel with a 50 μF capacitor. What is the power factor of the circuit?","[""80%"",""50%"",""70%"",""60%""]",2
"Three impedances Za, Zb and Zc are connected in parallel. If at 60 Hz, Z<sub>a</sub> = j8, Z<sub>b</sub> = -j2 and Z<sub>c</sub> = 5 ohms. Solve for the resultant power factor.","[""0.471 lagging"",""0.471 leading"",""0.573 lagging"",""0.573 leading""]",1
"A resistor of 50 ohms and an impedance of 100 + j50 ohms are connected in parallel across a 220 volts supply. What is the power factor of the load?","[""96%"",""99%"",""98%"",""95%""]",1
"A capacitor of 3.18 microfarads is connected in parallel with a resistance of 2,000 ohms. The combination is further connected in series with an inductance of 795 mH and resistance of 100 ohms across a supply given by e = 400 sin wt + 80 sin (3wt + 60°). Assume w = 314 radians/sec. Determine the power dissipated.","[""74.66 W"",""78.05 W"",""80.28 W"",""75.66 W""]",0
"A capacitor of 3.18 microfarads is connected in parallel with a resistance of 2,000 ohms. The combination is further connected in series with an inductance of 795 mH and resistance of 100 ohms across a supply given by e = 400 sin wt + 80 sin (3wt + 60°). Assume w = 314 radians/sec. Determine the circuit power factor.","[""0.702"",""0.650"",""0.633"",""0.612""]",1
"A bank of capacitors is connected in parallel each rated at 10 kVAR, 380 volts. If one unit is shorted out, what would be the net capacitance of the bank?","[""330 \u03bcF"",""440 \u03bcF"",""220 \u03bcF"",""110 \u03bcF""]",1
"A capacitor of 3.18 microfarads is connected in parallel with a resistance of 2,000 ohms. The combination is further connected in series with an inductance of 795 mH and resistance of 100 ohms across a supply given by e = 400 sin ωt + 80 sin (3ωt + 60°). Assume w = 314 radians/sec. Determine the rms value of the total current.","[""0.40 A"",""0.33 A"",""0.56 A"",""0.45 A""]",0
"Three loads, units A, B and C are connected in parallel and take currents that are respectively 12, 10 and 15 A respectively. Assuming I<sub>a</sub> to be the reference phasor. I<sub>b</sub> leads Ia by 30° and Ic lags behind Ia by 65°, calculate the total (resultant) current.","[""28.33 A"",""30.21 A"",""26.46 A"",""32.10 A""]",0
"A 250 V, 30 Hz generator supplies power to a parallel circuit consisting of a 20 HP motor whose efficiency is 90% at 0.80 pf lagging and a second load that draws an apparent power of 7 kVA at unity pf. Determine the system power factor.","[""0.828 lagging"",""0.831 lagging"",""0.802 lagging"",""0.884 lagging""]",3
"A resistance of 5 ohms is connected in series with a capacitor of 442.1 μF. The combination is then connected in parallel with an inductance of 21.22 mH. Solve for the resultant current if the circuit is connected across a 120 V, 60 Hz ac source.","[""9.44 A"",""10.68 A"",""11.29 A"",""10.34 A""]",3
"An inductor L<sub>1</sub> is connected in series with a parallel combination of inductor L<sub>2</sub> and capacitor C. The impedance of the circuit w = 400 rad/sec is j100 ohms. The circuit is to yield infinite impedance at w = 1,000 rad/sec and zero impedance at w = 2,000 rad/sec. Determine the value of C.","[""1.28 \u03bcF"",""1.67 \u03bcF"",""2.06 \u03bcF"",""1.32 \u03bcF""]",3
