question,choices,answer
"Three parallel circuits take the following currents: i<sub>1</sub> = 5 sin 314t, i<sub>2</sub> = 30 sin (314t + π/2) and i<sub>3</sub> = 25 sin (314t – π/2). The expression for the resultant current is ______.","[""25 sin (314t + \u03c0\/3)"",""5 sin (314t + \u03c0\/2)"",""10 sin (314t \u2013 \u03c0\/6)"",""5\u221a2 sin (314t + \u03c0\/4)""]",3
"e<sub>1</sub> = 10 sin ωt e<sub>2</sub> = 10 cos ωt","[""10"",""20 sin \u03c9t"",""14.14 cos \u03c9t"",""14.14 sin (\u03c9t + \u03c0\/4)""]",3
"In a pure resistive a.c. circuit, the frequency of power curve is ____ that of the circuit frequency.","[""half"",""twice"",""thrice"",""same as""]",1
"The peak power in the circuit is","[""1250 W"",""25 W"",""2500 W"",""250 W""]",2
"The average power in the circuit is","[""2500 W"",""250 W"",""25 W"",""1250 W""]",3
"An alternating voltage v = V<sub>m</sub> sin θ is applied to a pure inductive circuit. The current equation will be","[""i = I<sub>m<\/sub> sin \u03b8"",""i = I<sub>m<\/sub> sin(\u03b8\u2013 \u03c0\/2 )"",""i = I<sub>m<\/sub> sin(\u03b8+ \u03c0\/2 )"",""i = I<sub>m<\/sub> sin(\u03b8+ \u03c0\/4 )""]",1
"The inductive reactance of a circuit is ____ frequency.","[""directly proportional to"",""inversely proportional"",""independent of"",""none of these""]",0
"Power absorbed in a pure inductive circuit is zero because","[""reactive component of current is zero"",""active component of current is maximum"",""power factor of the circuit is zero"",""reactive and active component of current cancel out""]",2
"An alternating voltagev = V<sub>m</sub> sin θ is applied to a pure capacitive circuit. The current equation will be","[""i = I<sub>m<\/sub> sin \u03b8"",""i = I<sub>m<\/sub> sin(\u03b8\u2013 \u03c0\/2 )"",""i = I<sub>m<\/sub> sin(\u03b8+ \u03c0\/4 )"",""i = I<sub>m<\/sub> sin(\u03b8+ \u03c0\/2 )""]",3
"The capacitive reactance of a circuit is ____ frequency.","[""independent of"",""inversely proportional to"",""directly proportional to"",""none of the above""]",1
"An a.c. current given by i = 14.14 sin (ωt + π/6) has an rms value of ____ amperes and a phase of ____ degrees.","[""10, 30"",""14.14, 180"",""1.96 ,\u201330"",""7.07, 210""]",0
"If e<sub>1</sub> = A sin ωt and e<sub>2</sub> = B sin (ωt – φ), then","[""e<sub>1<\/sub> legs e<sub>2<\/sub>, by \u03b8"",""e<sub>2<\/sub> lags e<sub>1<\/sub> by \u03b8"",""e<sub>2<\/sub> leads e<sub>1<\/sub>, by \u03b8"",""e<sub>1<\/sub> is in phase with e<sub>2<\/sub>""]",0
"From the two voltage equations e<sub>A</sub> = E<sub>m</sub> sin 100πt and e<sub>B</sub> = E<sub>m</sub> sin (100πt + π/6), it is obvious that","[""e<sub>A<\/sub> leads e<sub>B<\/sub> 30\u00b0"",""e<sub>B<\/sub> achieves its maximum value 1\/600 second before e<sub>A<\/sub> does"",""e<sub>B<\/sub> lags behind e<sub>A<\/sub>"",""e<sub>A<\/sub> achieves its zero value 1\/ 600 before e<sub>B<\/sub>""]",1
"The r.m.s. value a half-wave rectified current is 10 A, its value for full wave rectification would be ____ amperes.","[""20"",""14.14"",""20\/\u03c0"",""40\/\u03c0""]",1
"A resultant current is made of two components: a 10 A d.c. components and a sinusoidal component of maximum value 14.14 A. The average value of the resultant current is ____ amperes and r.m.s. value is ____ amperes.","[""0, 10"",""24, 24.14"",""10, 14.14"",""4.14, 100""]",2
"The r.m.s. value of sinusoidal ac current is equal to its value at an angle of ____ degree.","[""60"",""45"",""30"",""90""]",1
"Two sinusoidal currents are given by the equations: i1 = 10 sin (ωt + π/3) and i2 = 15 sin (ωt– π/4). The phase difference between them is ____ degrees.","[""105"",""75"",""15"",""60""]",0
"A sine wave has a frequency of 50 Hz. Its angular frequency is ____ radian/second.","[""50\/\u03c0"",""50\/2\u03c0"",""50\u03c0"",""100\u03c0""]",3
"The reactance offered by a capacitor to alternating current of frequency 50 Hz is 10Ω. If frequency is increased to 100 Hz reactance becomes ____ ohm.","[""20"",""5"",""2.5"",""40""]",1
"A complex current wave is given by i = 5 + 5 sin 100πt ampere. Its average value is ____ ampere.","[""10"",""0"",""\u221a50"",""5""]",3
"A constant current of 2.8 exists in a resistor. The rms value of current is","[""2.8 A"",""about 2 A"",""1.4 A"",""undefined""]",0
"The rms value of a half-wave rectified symmetrical square wave current of 2 A is","[""\u221a2 A"",""1 A"",""1\/\u221a2 A"",""\u221a3 A""]",0
"The rms value of the voltage v(t) = 3 + 4 cos (3t) is","[""\u221a17 V"",""5 V"",""7 V"",""(3 + 2\u221a2 ) V""]",0
"The rms value of the resultant current in a wire which carries a dc current of 10 A and a sinusoidal alternating current of peak value 20 A is","[""14.1 A"",""17.3 A"",""22.4 A"",""30.0 A""]",1
"If i<sub>1</sub> = 120 cos (100πt + 30°) and i<sub>2</sub> = -0.1 cos (100πt + 100°) then i<sub>2</sub> leads i<sub>1</sub> by ____.","[""-110 degrees"",""60 degrees"",""-60 degrees"",""110 degrees""]",0
"If v<sub>1</sub> = sin (ωt + 30°) and v<sub>2</sub> = -5 sin (ωt – 15°) then v<sub>1</sub> leads v<sub>2</sub> by ____.","[""225 degrees"",""30 degrees"",""45 degrees"",""none of these""]",0
"The rms value of a rectangular wave of period T, having a value of +V for a duration, T<sub>1</sub> (&lt;T) and –V for the duration T – T<sub>1</sub> = T<sub>2</sub> equals ____.","[""V"",""(T<sub>1<\/sub> \u2013 T<sub>2<\/sub>)\/T*V"",""V\/\u221a2"",""(T<sub>1<\/sub>\/T<sub>2<\/sub>)* V""]",0
"The rms value of the voltage waveform v(t) = sin 10t + sin 20t is ____.","[""1"",""1\/2"",""1\/\u221a2"",""\u221a2""]",0
"For the voltage waveform v(t) = 2 + cos (ωt + 180°) find the ratio of V<sub>rms</sub>/V<sub>ave</sub>.","[""3\/2\u221a2"",""\u221a3\/2"",""\u03c0\/2"",""\u03c0""]",0
"The length of time between a point in one cycle to the same point of the next cycle of an AC wave is the ______.","[""frequency"",""period"",""magnitude"",""polarity""]",1
"In an experiment, a sinusoidal wave form is observed to complete 8 cycles in 25 msec. Determine the frequency of the wave form.","[""320 Hz"",""40 Hz"",""200 Hz"",""64 Hz""]",0
"If emf in a circuit is given by e = 100 sin 628t, the maximum value of voltage and frequency is ______.","[""100 V, 50 Hz"",""100 V, 100 Hz"",""50\u221a2 V, 50 Hz"",""50\u221a2 V, 100 Hz""]",1
"A sinusoidal voltage wave has an RMS value of 70.71 V and a frequency of 60 Hz. Determine the value of the voltage 0.0014 second after the wave crosses the ωt axis.","[""70.71 V"",""100 V"",""50 V"",""141.42 V""]",2
"An alternating current varying sinusoidally with frequency of 50 Hz has an RMS value of 20 A. At what time measured from the positive maximum value will the instantaneous current be 14.14 A?","[""1\/600 sec"",""1\/200 sec"",""1\/300 sec"",""1\/400 sec""]",0
"The average value of the function i = 50 sin ωt + 30 sin 3ωt is equal to ______.","[""31.8 A"",""25 A"",""38.2 A"",""51.43 A""]",2
"For 200 V<sub>rms</sub> value triangular wave, the peak value is equal to ______.","[""200 V"",""222 V"",""282 V"",""346 V""]",3
"Determine the rms value of a semi-circular current wave which has a maximum value of A.","[""0.816 A"",""0.23 A"",""0.866 A"",""0.707 A""]",0
"The rms value of a half-wave rectified current is 100 A. Its value for full-wave rectification would be ______ amperes.","[""141.4 A"",""200 A"",""200\/\u03c0 A"",""400\/\u03c0 A""]",0
"A half-wave rectified sine wave has an average value of 100 amp. What is the effective value?","[""157 A"",""444 A"",""70.71 A"",""100""]",0
"The form factor of a half-wave rectified alternating current is ______.","[""1.11"",""1.57"",""1.73"",""1.0""]",1
"Three alternating currents are given by i<sub>1</sub> = 141 sin (ωt + 45°) A; i<sub>2</sub> = 30 sin (ωt + 90°) A; i<sub>3</sub> = 20 cos (ωt – 120°) A. Find the equation of the resultant current.","[""167.4 sin (\u03c9t + 45.66\u00b0)"",""74.6 sin \u03c9t"",""143.8 sin (\u03c9t + 51.4\u00b0)"",""64.7 sin (\u03c9t \u2013 30\u00b0)""]",0
"A sinusoidal voltage source has a peak value of 150 volts. What equivalent DC voltage source would produce the same heating effect in a 1-ohm resistor?","[""15 V"",""212 V"",""95 V"",""106 V""]",3
"The effective value of v(t) = 100 + A sin ωt is known to be 103.1. The amplitude A of the sine term is ____.","[""25"",""4.85"",""35.48"",""100""]",2
"An alternating current and a direct current flow simultaneously in the same conductor. If the effective of the AC is 8 A and DC is 12 A, what will an AC ammeter read when connected in the circuit?","[""14.42 A"",""12 A"",""11.66 A"",""16.49 A""]",0
"Find the reading of an AC voltmeter connected across the series source of 100 sin (ωt – π/2) and 100 sin ωt.","[""100"",""130.65"",""170.71"",""184.78""]",0
"A voltage is given be v = 100 sin 314t. How long does it take this wave to complete one fourth of a cycle?","[""20 ms"",""10 ms"",""5 ms"",""1 ms""]",2
"When a 15 V square wave is connected across a 50 volt AC voltmeter, it will read _____.","[""21.21 V"",""10.61 V"",""15 V"",""9.55 V""]",2
"Calculate the effective value of v(t) = 100 sin 400t + 50 sin 800t + 10 cos 1200t V.","[""79.5 V"",""57.9 V"",""112.25 V"",""121. 52 V""]",0
"The magnetic field energy of an inductor changes from maximum value to minimum value in 5 ms when connected to an ac source. The frequency of the source is","[""20 Hz"",""50 Hz"",""200 Hz"",""500 Hz""]",1
"Non-sinusoidal waveforms are made up of","[""different sinusoidal waveforms"",""fundamental and even harmonics"",""fundamental and odd harmonics"",""even and odd harmonics only""]",0
"The positive and negative halves of a complex wave are symmetrical when","[""it contains even harmonics"",""phase difference between even harmonics and fundamental is 0 or \u03c0"",""it contains odd harmonics"",""phase difference between even harmonies and fundamental is either \u03c0\/2 or 3\u03c0\/2""]",2
"The r.m.s. value of the complex voltage given by v = 16√2 sin ωt + 12√2 sin 3ωt is","[""20\u221a2"",""20"",""28 \u221a2"",""192""]",1
"In a 3-phase system, ____th harmonic has negative phase sequence of RBY.","[""9"",""13"",""5"",""15""]",2
"A complex current wave is given by the equation i = 14 sin ωt + 2 sin 5ωt . The r.m.s. value of the current is ____ ampere.","[""16"",""12"",""10"",""8""]",2
"When pure inductive coil is fed by a complex voltage wave, its current wave","[""has larger harmonic content"",""is more distorted"",""is identical with voltage wave"",""shows less distortion""]",3
"A complex voltage wave is applied across a pure capacitor. As compared to the fundamental voltage, the reactance offered by the capacitor to the third harmonic voltage would be","[""nine times"",""three times"",""one-third"",""one-ninth""]",2
"Which of the following harmonic voltage components in a 3-phase system would be in phase with each other?","[""3rd, 9th, 15th etc."",""7th, 13th, 19th etc."",""5th, 11th, 17th etc."",""2nd, 4th, 6th etc.""]",0
"An alternating voltage is one that","[""varies continuously in magnitude"",""reverses periodically in polarity"",""never varies in magnitude"",""both A and B""]",3
"One complete revolution of a conductor loop through a magnetic field is called a(n)","[""octave"",""decade"",""cycle"",""alternation""]",2
"For a sine wave, one half cycle is often called a(n)","[""alternation"",""harmonic"",""octave"",""period""]",0
"For a sine wave, the number of complete cycles per second is called the","[""period"",""wavelength"",""frequency"",""phase angle""]",2
"To compare the phase angle between two waveforms, both must have","[""the same amplitude"",""the same frequency"",""different frequency"",""both A and B""]",1
"The value of alternating current or voltage that has the same heating effect as a corresponding dc value is known as the","[""peak value"",""average value"",""rms value"",""peak-to-peak value""]",2
"For an ac waveform, the period refers to","[""the number of complete cycles per second"",""the length of time required to complete one cycle"",""the time it takes for the waveform to reach its peak value"",""none of these""]",1
"The wavelength of a radio wave is","[""inversely proportional to its frequency"",""directly proportional to its frequency"",""inversely proportional to its amplitude"",""unrelated to its frequency""]",0
"Unless indicated otherwise, all sine wave ac measurements are in","[""peak-to-peak values"",""peak values"",""rms values"",""average values""]",2
"A unit step voltage is applied across an inductor. The current through the inductor will be","[""zero for all time"",""a step function"",""a ramp function"",""a delta (impulse) function""]",2
"A ramp current flowing through an initially relaxed capacitor will result in a voltage across it that","[""varies inversely with time"",""remains constant"",""varies directly with time"",""varies as the square of time""]",3
"The voltage v(t) = t u(t) volts is connected across a 1 H inductor having an initial current of -1 A. The net current will be zero at time t equal to","[""0"",""1\u221a2 seconds"",""\u221a2 seconds"",""1 second""]",2
"A voltage waveform v (t) = 12t<sup>2</sup> is applied across 1H inductor for t ≥ 0, with initial current through it being zero. The current through the inductor for t ≥ 0 is given by","[""12t"",""24t"",""12t<sup>3<\/sup>"",""4 t<sup>3<\/sup>""]",3
"It is desired to have a constant direct current i(t) through the ideal inductor L. The nature of the voltage source v(t) must","[""constant voltage"",""linearly increasing voltage"",""an ideal impulse"",""exponentially increasing voltage""]",2
"What is the rms value of a square wave with an amplitude of 10 A and frequency of 1 Hz?","[""0 A"",""10 A"",""5 A"",""7.07 A""]",1
"What is the frequency in kHz of a radio signal whose wavelength is 15 m?","[""10,000"",""20,000"",""15,000"",""20,500""]",1
"The following are in series R = 1,000 Ω, L = .100 μH and C = 20,000 pF. The voltage across the circuit is 100 V, 60 kHz. What is the total impedance expressed in ohms?","[""1882 ohms"",""1000 ohms"",""2132 ohms"",""1885 ohms""]",1
"A series circuit has an applied voltage of v = 220 sin (ωt + 30°) and draws a current of i = 10 sin (ωt – 30°). What is the average power and power factor of the circuit?","[""1,905 W, 86.6% lagging"",""1,905 W, 86.6% lagging"",""2,200 W, 100%"",""1,100 W, 50% lagging""]",3
"A coil has an impedance of 75.4 Ω when connected a across a source of 60 Hz. The same coil yields an impedance of 54.8 Ω when connected across a source having a different frequency of 30 Hz. What is the coil’s inductance?","[""245.7 mH"",""512.8 mH"",""158.6 mH"",""341.7 mH""]",2
"A circuit consists of a 4 ohms resistor and a 300 μF capacitor in series. It is connected across a 60 Hz voltage source with a 500 V peak voltage. What is the phasor form of the current?","[""I = 19.57\u222057.5\u00b0 A"",""I = 8.84\u222073.2\u00b0 A"",""I = 36.5\u222065.7\u00b0 A"",""I = 10.5\u222065.7\u00b0 A""]",2
"Find the power in a circuit if i(t) = 10 sin (ωt – 30°) and v(t) = 220 sin (ωt +30°).","[""550 watts"",""2200 watts"",""1900 watts"",""1500 watts""]",0
"A current of 2.5 A flows through a series circuit consisting of a 100 Ω resistor and an unknown capacitor across a source of 460 V, 50 Hz. What is the value of the capacitive reactance?","[""X<sub>C<\/sub> = 91.86 \u03a9"",""X<sub>C<\/sub> = 39.19 \u03a9"",""X<sub>C<\/sub> = 154.45 \u03a9"",""X<sub>C<\/sub> = 184.0 \u03a9""]",1
"In a series RC circuit the voltage across the capacitor and the resistor are 60 volts and 80 volts respectively. The total voltage is","[""70"",""100"",""140"",""none of these""]",1
"An industrial coil has a resistance of 32 ohms and reactance of 24 ohms and rated 440 volts at 60 Hz. A factory will connect the coil to a 440 V, 50 Hz supply. Solve for the value of a series resistor needed to avoid over-current condition.","[""2.07 ohms"",""2.64 ohms"",""2.44 ohms"",""2.25 ohms""]",1
"Two relays each with 20 ohms resistance and 0.16 H inductance are connected in series. What is the equivalent impedance?","[""20 + j102.2 \u03a9"",""20 + j95.32 \u03a9"",""40 + j120.63 \u03a9"",""40 + j25.32 \u03a9""]",2
"An inductive coil takes a current of 2 A and consumes 160 W when connected to a 240 V ac supply. A second coil when connected across the same supply takes 3 A and 500 W. Find the total power when the two coils are connected in series to this supply,","[""144.56 W"",""134.31 W"",""150.22 W"",""128.35 W""]",0
"A coil draws 1875 watts when connected to a 150 V dc source. It consumes 30.72 watts when use on a 240 V, 60 Hz ac source. Find the inductance of the coil.","[""0.0255 H"",""0.0341 H"",""0.0153 H"",""0.0240 H""]",3
"A current of 10 A and a power factor of 0.8 lagging is taken form a single phase 250 volt supply. The reactive power of the system is","[""1500 vars"",""2000 vars"",""2500 vars"",""none of these""]",0
"The resistor of 6 Ω and unknown impedance coil in series draws 12 A from a 120 V, 60 Hz line. If the real power taken from the line is 1152 watts, what is the coil inductance?","[""15.9 mH"",""10 mH"",""20 mH"",""1.59 mH""]",0
"Determine the power factor angle in the series circuit which consists of R = 25 Ω, L = 0.2 H, across a power supply of 200 V, 30 Hz.","[""36.4\u00b0"",""46.4\u00b0"",""52.4\u00b0"",""56.4\u00b0""]",3
"The impedance coils absorbs 250 watts when connected across 220 V, 60 Hz mains. It is then connected across 110 V, 25 Hz mains and also absorbs 250 watts. What is the inductance of the coil?","[""0.125 H"",""0.149 H"",""0.154 H"",""0.163 H""]",1
"A 10 ohms inductive resistor is connected in series with an unknown capacitance. At 60 Hz the impedance of the circuit is 10 + j11.72 ohms. At 30 Hz the impedance of the circuit is 10 – j5 ohms. What is the value of L in millihenrys?","[""50"",""500"",""100"",""250""]",0
"An impedance coil takes 10 A and absorbs 250 W when connected across a 220 V, 60 Hz source. What power will it absorb when connected across 110 V, 25 Hz mains?","[""539 W"",""239 W"",""439 W"",""339 W""]",3
"An industrial coil has a resistance of 32 ohms and a reactance of 24 ohms and rated 440 volts at 60 Hz. A factory will connect the coil to a 440 V, 50 Hz supply. How much percentage over-current will the coil suffer?","[""5%"",""10%"",""6%"",""8%""]",2
"A 25 Ω resistor connected in series with a coil of 50 Ω resistance and 150 mH inductance. What is the power factor of the circuit?","[""85%"",""80%"",""90%"",""75%""]",1
"A current of 2.5 A flows through a series circuit consisting of a 100 ohm resistor and an unknown capacitor across a source of 460 V, 50 Hz. What is the value of the capacitive reactance?","[""X<sub>C<\/sub> = 91.86 \u03a9"",""X<sub>C<\/sub> = 39.19 \u03a9"",""X<sub>C<\/sub> = 154.45 \u03a9"",""X<sub>C<\/sub> = 184 \u03a9""]",2
"The ohmic resistance of a large magnetic contactor is measured to be 20 ohms. A 230 V is impressed on the contractor and the current is taken as 3.2 A. Neglecting core loss, determine the inductance of the contractor in mH?","[""261"",""315"",""183"",""251""]",2
"A load of 20 + j35 Ω is connected across a 220 V source. Determine the power factor and the VARS.","[""49.6%, 1042 vars"",""52.2%, 1023 vars"",""85.3%, 975 vars"",""42.3%, 1087 vars""]",0
"An impedance draws a current i = 10 cos (ωt – 30°) A from a voltage, v = 220 sin (ωt + 30°) V. What is the impedance?","[""15.6 \u2013 j15.6 \u03a9"",""15.6 + j15.6 \u03a9"",""19.1 \u2013 j11.1 \u03a9"",""11.0 + j19.1 \u03a9""]",2
"A series resistance-capacitance (R-C) circuit is connected to a 230 volt 60 cycle source. If the power taken by the circuit is 4,800 watts and the voltage drop across the resistor is 115 volts, calculate the capacitance of the capacitor.","[""540 \u03bcF"",""530 \u03bcF"",""556 \u03bcF"",""503 \u03bcF""]",2
"A 50 μF and 100 μF capacitors are connected in series and across a 100 sin (ωt + 30°) voltage. Write the equation of the current.","[""1.26 sin (\u03c9t + 120\u00b0) A"",""1.26 sin (\u03c9t + 90\u00b0) A"",""5.65 sin (\u03c9t + 120\u00b0) A"",""5.56 sin (\u03c9t + 90\u00b0) A""]",0
"A 100∠0° V, 120 Hz generator and a 80∠0° V, 60 Hz generator are connected in series with a 60 V battery and a coil. The resistance and inductance of the coil are 3 Ω and 2.65 mH, respectively. Determine the rms current of the coil.","[""42.54 A"",""44.24 A"",""43.55 A"",""40.44 A""]",0
"A series circuit composed of 100-ohm resistor and a 20-microfarad capacitor connected across a 240-V, 60 Hz line. Which of the following answers is WRONG?","[""the impedance of the circuit is 167 ohms"",""angle between the current and the voltage vectors is 53.1 degrees"",""the resulting current is 0.723 ampere"",""the voltage across the resistance is 144.6 volts""]",2
"A capacitance is connected to a 115-V, 25 Hz mains and takes 5 A. What current will it take when the capacitance and the frequency are both doubled?","[""2.5 A"",""5 A"",""20 A"",""10 A""]",2
"A capacitor is rated 100 kVAR, 380 V, 50 Hz, What will its rating be at 60 Hz, 220 V?","[""50 kVAR"",""40 kVAR"",""90.9 kVAR"",""57.7 kVAR""]",1
"A resistor and a capacitor are connected in series across a supply of 250 V. When the supply frequency is 50 Hz the current in the circuit is 5 A. When the supply frequency is 60 Hz, the current is 5.8 A. Find the value of the capacitance.","[""58.3 \u03bcF"",""69.1 \u03bcF"",""60.2 \u03bcF"",""70.2 \u03bcF""]",1
"A series circuit composed of a 0.2 Henry inductor and a 74-microfarad capacitor is connected to a 60 V variable frequency source. At what frequency is the current be 4 amperes with a lagging power factor?","[""50 Hz"",""51 Hz"",""48 Hz"",""49 Hz""]",2
"The maximum instantaneous voltage and current output of an alternator are 300 V and 20 A, respectively. What is the power output in watts if the voltage leads the current by 30°?","[""2598"",""3000"",""5196"",""6000""]",0
"A 50-microfarad is connected in series with a coil having 50 ohms resistance and 150 mH inductance. The source voltage is 100 sin (ωt – 120°) V. What is the maximum power?","[""199 watts"",""147 watts"",""212 watts"",""165 watts""]",0
"An impedance draws a current i = 10 cos (ωt – 30°) A from a voltage v = 220 sin ωt. What is the maximum power?","[""2200 watts"",""1100 watts"",""190.5 watts"",""1320 watts""]",1
"An incandescent lamp load generally considered to be made up of resistors take 4.8 kW from a 120 V ac source. The instantaneous maximum value of power is","[""4800 W"",""2400 W"",""480 W"",""9600 W""]",3
"The term used for an out-of-phase, non-productive power associated with inductors and capacitors?","[""peak envelope power"",""effective power"",""true power"",""reactive power""]",3
"What is the capacitive reactance of a 33 microfarad capacitor at 6500 Hz?","[""7.4 0hms"",""96 0hms"",""0.74 ohms"",""1122 ohms""]",2
"The power dissipated across the resistance in an AC circuit.","[""true power"",""real power"",""reactive power"",""apparent power""]",1
"What is the capacitive reactance of a 33 microfarad capacitor at 500 Hz?","[""1,000,000 ohms"",""144 ohms"",""0 ohms"",""9.55 ohms""]",3
"What is the reactance of a 25 mH coil at 600 Hz?","[""0.011 ohm"",""94,000 ohms"",""785 ohms"",""94 ohms""]",3
"Ignoring capacitance effects, what is the impedance of a 250 mH coil with an internal resistance of 55 ohms at 60 Hz?","[""149.2 ohms"",""109 ohms"",""94.2 ohms"",""10,900 ohms""]",1
"Ignoring any inductive effects, what is the impedance of RC series capacitor made up of a 56 kilo ohms resistor and a 0.033 μF capacitor at a signal frequency of 450 Hz?","[""66,730 \u03a9"",""57,019 \u03a9"",""10,730 \u03a9"",""45,270 \u03a9""]",2
"Assuming an ideal capacitor, with no leakage, what is the capacitive reactance of 10 microfarad capacitance of DC (0 Hz)?","[""0 ohms"",""16000 ohms"",""1,000,000 ohms"",""infinite capacitive reactance""]",3
"The impedance in the study of electronics is represented by resistance and _____","[""Reactance"",""Capacitance"",""Inductance"",""Inductance and capacitance""]",0
"One of the following satisfies the condition of Ohm’s Law","[""Application to metals which heated up due to flow of current over them"",""Application to AC circuit having its impedance used in place of resistance"",""Application to semiconductor"",""Application to vacuum radio valves""]",1
"The effective voltage across a circuit element is (20 + j10) and the effective current through the element is 4 – j3 A. Calculate the true and reactive power taken by the element.","[""50 watts &amp; 100 vars lagging"",""50 watts &amp; 100 vars leading"",""110 watts &amp; 20 vars lagging"",""110 watts &amp; 20 vars leading""]",0
"The voltage across a given circuit is 75 + j50 V. What is the power supplied to the circuit if the current through it is (8 – j5) A?","[""850 W"",""550 W"",""750 W"",""350 W""]",3
"Find average power in a resistance R = 10 ohms if the current in series form is i = 10 sin ωt + 5 sin 3ωt + 2 sin 5ωt amperes.","[""65.4 watts"",""645 watts"",""546 watts"",""5.46 watts""]",1
"Across a 230-V, 60 Hz power supply is a 15-ohm non-inductive resistor. What is the equation of the voltage and resulting current?","[""e = 398.4 sin 60t and i = 21.6 sin 60t"",""e = 325.5 sin 377t and i = 21.6 sin 377t"",""e = 230 sin 377t and i = 15.3 sin 377t"",""e = 230 sin 120t and i = 15.3 sin 120t""]",1
"A resistor R and a capacitor C are connected in series across a 100 V, 60 cycle source. The reading of an ammeter connected in the circuit is 2 A and the reading of a voltmeter connected across the capacitor is 80 V. Calculate the values of R and C.","[""66 \u03a9 &amp; 30 \u03bcF"",""30 \u03a9 &amp; 60 \u03bcF"",""30 \u03a9 &amp; 66 \u03bcF"",""36 \u03a9 &amp; 60 \u03bcF""]",2
