question,choices,answer
"Which of the following is the main function of a battery?","[""To provide a source of steady DC voltage to fixed polarity"",""To provide a source of steady dc voltage of variable polarity"",""To provide a source of variable dc voltage of fixed polarity"",""To provide a source of variable dc voltage of variable polarity""]",0
"Volt is a unit of ____________.","[""electromotive force"",""energy"",""force"",""magneto motive force""]",0
"A transformer will work on","[""ac only"",""ac as well as dc"",""dc only"",""pulsating dc""]",0
"In a chemical cell current is the movement of","[""positive and negative ions"",""positive charges"",""positive ions only"",""negative ions only""]",0
"What is the nominal output of an automotive battery having six lead acid cells in series?","[""12 V"",""24 V"",""6 V"",""3 V""]",0
"The speed of a dc motor is","[""directly proportional to flux per pole"",""inversely proportional to flux per pole"",""inversely proportional to applied voltage"",""inversely proportional to armature current""]",1
"Low speed alternators are driven by","[""hydraulic turbines"",""steam turbines"",""steam engines"",""diesel engines""]",0
"High speed alternators are driven by","[""diesel engine"",""steam turbines"",""hydraulic turbines"",""diesel engine""]",1
"The common 9v flat battery for transistor radio has _____________ cells connected in series","[""12"",""3"",""6"",""9""]",2
"For the same rating, the size of low speed alternator is ____________ that of high speed alternator","[""about the same as"",""less than"",""more than"",""twice""]",2
"Which of the following is not a secondary cell?","[""Silver-zinc"",""Nickel-iron"",""Silver-oxide"",""Lead-acid""]",2
"Which of the following is not a primary cell?","[""Carbon-zinc"",""Zinc-chloride"",""Edison cell"",""Mercuric oxide""]",2
"The brush voltage drop in a dc machine is about","[""0.1 V"",""2 V"",""10 V"",""20 V""]",1
"Carbon brushes are used in a dc machine because","[""carbon lubricates and polishes the commutator"",""contact resistance is decreased"",""carbon is cheap"",""carbon is abundant""]",0
"Considered as the main types of battery","[""Lithium cell and alkaline"",""Carbon-zinc dry cell and lead sulphuric wet cell"",""Leclanche cell and carbon zinc"",""Voltaic cell and lithium cell""]",1
"Which of the following is the main function of a dc motor?","[""to generate power"",""to change mechanical energy to electrical energy"",""to change electrical energy to mechanical energy"",""to change chemical energy to mechanical energy""]",2
"Which motor has the best speed regulation?","[""Series"",""Shunt"",""Commutatively compounded"",""Differentially compounded""]",2
"A method of converting chemical energy into electric energy by dissolving two different conducting materials in an electrolyte","[""Battery"",""Cell"",""Voltaic cell"",""Charging""]",2
"A commutatively compounded motor does not run at dangerous speed at light loads because of the presence of","[""shunt winding"",""interpoles"",""series"",""compensating windings""]",0
"DC shunt motors are used in those applications where ___________ is required","[""high starting torque"",""high no load speed"",""practically constant speed"",""variable speed""]",2
"Galvanic cell is the other name of","[""voltaic cell"",""primary cell"",""secondary cell"",""solar cell""]",0
"For the same rating _____________ motor has the highest staring torque","[""shunt"",""differentially compounded"",""commutatively compound"",""series""]",3
"The voltage regulation of an alternator with a power factor of 0.8 lagging is ____________ at unity power factor","[""greater than"",""the same as"",""smaller than"",""100%""]",0
"Which is the most suitable for punch presses?","[""shunt motor"",""differentially compounded motor"",""series motor"",""commutatively compounded motor""]",3
"In a vacuum cleaner, ___________ motor is generally used","[""shunt"",""series"",""commutatively compounded"",""differentially compounded""]",1
"A type of secondary cell that can be recharged but with an electrolyte that cannot be refilled","[""Sealed rechargeable cell"",""Sealed secondary cell"",""Leclanche cell"",""Alkaline cell""]",0
"Silver cadmium is secondary cell with a nominal open circuit voltage of","[""1.1 V"",""1.2 V"",""1.5 V"",""1.35 V""]",0
"Which is a variable speed motor?","[""series"",""commutatively compounded"",""shunt"",""differentially compounded""]",0
"The most commonly used method of speed control of a dc motor is by varying","[""voltage applied to the motor"",""field strength"",""effective number of conductors in series"",""armature circuit resistance""]",1
"What gives the relative activity in forming ion charges for some of the chemical elements?","[""Electrochemical series"",""Electrical series"",""Electromotive series"",""Both A and C above""]",3
"The ac armature winding of an alternator is","[""always star connected"",""star delta connected"",""generally delta connected"",""pi connected""]",0
"The air gap in an alternator is __________ in an induction machine","[""much shorter than"",""about the same as"",""much longer than"",""one-half than""]",2
"Nickel-iron cells is a secondary cell with a nominal open- circuit voltage output of 1.2 and is otherwise known as","[""Leclanche cell"",""Galvanic cell"",""Voltaic cell"",""Edison cell""]",3
"A dc series motor is most suitable for","[""cranes"",""lathes"",""pump"",""punch presses""]",0
"Which of the most suitable motor fro elevator","[""Series"",""Differentially compounded"",""Shunt"",""Commutatively compounded""]",3
"The voltage output of a cell depends on","[""its elements"",""electromotive series"",""its electrodes"",""electrochemical series""]",0
"The alternators driven by ____________ do not have a tendency to hunt","[""diesel engines"",""steam engines"",""water turbines"",""prime movers""]",1
"Damper windings are used in alternators to","[""prevent hunting"",""achieve synchronism"",""reduce wind age losses"",""reduce eddy current loss""]",0
"Leclanche cell is the other name of","[""lead acid cell"",""zinc chloride"",""carbon zinc cell"",""mercuric cell""]",2
"the primary leakage flux links","[""primary winding only"",""secondary winding only"",""both primary and secondary windings"",""neither primary nor secondary windings""]",0
"Overheating of a dc motor is often due to","[""insufficient end play"",""overloads"",""loose parts"",""rough commutator""]",1
"A small 9V battery might be used to provide power to","[""an electric stove"",""an electronic calculator"",""a personal computer"",""a radio transmitter""]",1
"The frequency of the system with which several alternators are parallel can be increased by simultaneously __________ of all generators","[""increasing the field excitation"",""decreasing the field excitation"",""increasing the speed of prime movers"",""decreasing the speed of prime movers""]",2
"A transformer is an efficient device because it","[""is a static device"",""uses capacitive coupling"",""uses inductive coupling"",""uses electric coupling""]",0
"The amount of back emf of shunt motor will increase when","[""the load is increased"",""the field is strengthen"",""the field is weakened"",""the load is decreased""]",1
"Three cells connected in series from a","[""battery"",""voltage divider"",""voltage multiplier"",""hybrid""]",0
"What can be found in a transformer with open-circuit test?","[""Copper losses"",""Turns ratio"",""Total equivalent resistance"",""Total equivalent leakage resistance""]",1
"Transformers having ratings less than 5kva are generally","[""oil cooled"",""water cooled"",""natural air cooled"",""self cooled""]",2
"An example of rechargeable dc source is an/a","[""lithium battery"",""photovoltaic cell"",""optoisolator"",""lead acid battery""]",3
"The rating of an alternator is expressed in","[""kW"",""kVA"",""HP"",""KVAR""]",1
"Cumulatively compounded motors are used in applications where ____________ is required","[""variable speed"",""poor speed regulation"",""sudden heavy loads for a short duration"",""constant speed""]",2
"Which motor never use belt connected loads?","[""Series"",""Commulatively compounded"",""Shunt"",""Differentially compounded""]",0
"A standalone solar power system","[""relies on the electric utility at night"",""uses solar panels and batteries"",""requires the use of dry cells"",""need a full wave rectifier""]",1
"A transformer will have zero efficiency at","[""full load"",""half full load"",""no load"",""twice the load""]",2
"The efficiency of a transformer will be at maximum when","[""leakage reactance of the two windings are equal"",""resistance of the two windings are equal"",""copper loss is equal to constant loss"",""copper loss is zero""]",2
"The armature winding of a dc Machine is ____________ winding","[""an open circuit"",""a closed circuit"",""partly open circuit and partly closed circuit"",""lap""]",1
"The speed at which a 6 pole alternator should be drive to generate 50 cycles per second is","[""1500 rpm"",""500 rpm"",""1000 rpm"",""1200 rpm""]",2
"A 12 V battery is rated at 48 ah. If it must deliver an average of 2.0 A, how long will the battery last before it needs recharging","[""48 hrs"",""4 hrs"",""96 hrs"",""24 hrs""]",3
"Connecting batteries of equal voltage in parallel","[""multiplies the voltage available"",""increases the internal resistance"",""reduces the power available"",""multiplies the current available""]",3
"A storage battery in which the electrodes are grids of lead containing lead oxides that changes in composition during charging and discharging and the electrolyte is dilute sulfuric acid","[""Leclanche battery"",""Nickel cadmium battery"",""Lead acid battery"",""Faure storage battery""]",2
"The common dry cell, which is a primary cell having a carbon positive electrode and a zinc negative electrode in an electrolyte of sal ammoniac and a depolarizer","[""Leclanche cell"",""Faure storage cell"",""Lead acid cell"",""Lithium cell""]",0
"The maximum flux produced in the core of a transformer is","[""directly proportional to supply frequency"",""inversely proportional to supply frequency"",""inversely proportional to primary voltage"",""inversely proportional to secondary voltage""]",1
"A transformer is so designed that primary and secondary windings have","[""loose magnetic coupling"",""tight magnetic coupling"",""critical magnetic coupling"",""good electric coupling""]",1
"Four carbon zinc cell in series will provide about","[""2 Vdc"",""6 Vdc"",""9 Vdc"",""8 Vdc""]",1
"What refers to a method in which the charger and the battery are always connected to each other for supplying current to the load","[""Continuous charging"",""Float charging"",""Infinite charging"",""On line charging""]",1
"A series motor designed to operate on dc or ac","[""Shunt motor"",""Series motor"",""Universal motor"",""Compound motor""]",2
"Combination of ac motor, dc generator, and exciter to provide adjustable voltage dc power to a dc motor.","[""Ward-Leonard system"",""Half wave SCR adjustable voltage supply"",""Compound motor"",""Universal motor""]",0
"A motor takes a large current at starting because","[""the armature resistance is high"",""back emf is low"",""back emf is high"",""shunt field is producing weak field""]",1
"A series motor will over speed when","[""the load is increased"",""the armature circuit is open"",""the field id opened"",""load is removed""]",3
"When the load on an alternator is increased, the terminal voltage increases if the load power factor is","[""unity"",""leading"",""lagging"",""zero""]",1
"The efficiency of the turbo-alternator _____________ with increase in speed","[""decreases"",""remains the same"",""increases"",""becomes 100%""]",2
"What is the output of a lead acid cell?","[""2.1 V"",""1.5 V"",""1.35 V"",""1.25 V""]",0
"One of the following is a false statement","[""storage cell has a reversible chemical reaction"",""carbon zinc cell has unlimited shelf life"",""lead acid cell is rechargeable"",""primary cell is not rechargeable""]",1
"In an alternator, the effect of armature reaction is minimum at power factor of","[""0.866 lagging"",""0.5 lagging"",""0.866 leading"",""Unity""]",3
"For given number of poles (2) and armature conductors, a lap winding will carry ___________ a wave winding","[""more current than"",""same current as"",""less current than"",""half the current than""]",0
"An 8 pole duplex lap winding will have ____________ parallel paths","[""8"",""32"",""4"",""16""]",3
"To increase the voltage output, cells are connected in","[""parallel"",""series-parallel"",""parallel-series"",""series""]",3
"To increase current capacity, cells are connected in","[""parallel"",""series"",""series- parallel"",""parallel- series""]",0
"Two things which are same for primary and secondary of transformer are","[""ampere turns and voltage per turn"",""resistance and leakage reactance"",""current and inducted voltage"",""number of turns and power""]",0
"A transformer operates poorly at very low frequencies because","[""permeability of core is increased"",""magnetizing current is abnormally high"",""primary reactance is too much"",""permeability core is reduced""]",1
"In an auto transformer, the primary and secondary are ___________ coupled","[""only magnetically"",""magnetically as well as electrically"",""only electrically"",""directly""]",1
"A storage battery in which the plates consist if lead antimony supporting grids covered with a lead oxide paste immersed in weak sulfuric acid","[""Leclanche cell"",""primary battery"",""secondary battery"",""Faure storage battery""]",3
"Which of the following is a dry storage cell?","[""Leclanche cell"",""Edison cell"",""Mercury cell"",""Nickel cadmium cell""]",3
"The field structure of a dc machine uses","[""Salient pole arrangement"",""Non salient pole arrangement"",""Silicon steel"",""Cast steel""]",0
"Small Dc machines generally have __________ poles","[""4"",""2"",""6"",""8""]",1
"The armature of a dc machine is laminated in order to reduce","[""Eddy current loss"",""Copper loss"",""Hysteresis loss"",""Frictional loss""]",0
"To produce an output of 7.5v, how many carbon zinc cells are connected in series?","[""4"",""5"",""6"",""3""]",1
"The demand for a large increase in torque of a dc series motor is met by a","[""large decrease in current"",""large increase in speed"",""large decrease in speed"",""small decrease in speed""]",2
"As the load increases a, ____________ motor will speed up","[""series"",""commutatively compounded"",""shunt"",""differentially compounded""]",3
"The flux in the core of a single phase transformer is","[""purely alternating one"",""purely rotating one"",""partly alternating and partly rotating"",""constant""]",0
"When the primary of a transformer is connected to a dc supply","[""a primary draw small current"",""primary leakage reactance is increased"",""core losses are increased"",""primary may burned out""]",3
"a constant voltage source has","[""High internal resistance"",""minimum efficiency"",""minimum current capacity"",""low internal resistance""]",3
"If the excitation of an alternator operating in parallel with other alternators is increased above the normal value excitation of excitation its","[""power factor becomes more lagging"",""output current decreases"",""power factor becomes more leading"",""output kw decreases""]",0
"This synchronous reactance of an alternator is generally ____________ armature resistance","[""5 times smaller than"",""10 \u2013 100 times greater than"",""5 times greater than"",""10 times smaller than""]",1
"DC series motors are used in those applications where ____________ required","[""high starting torque"",""low no load speed"",""constant speed"",""variable speed""]",0
"A dc motor is still used in industrial applications because it","[""is cheap"",""provides fine speed control"",""is simple in construction"",""has no replacement""]",1
"The stator of n alternator is wound for ____________ on the rotor","[""a more number of poles than"",""the same number of poles as"",""less number of poles than"",""twice the number of poles""]",1
"Why are carbon brushes preferable compared to copper brushes?","[""they have longer life"",""they have lower resistance"",""they are cheaper"",""they reduce sparking""]",3
"A 4 pole dc machine has magnetic circuits","[""2"",""4"",""8"",""6""]",1
"The current in armature conductors of a dc machine is","[""pure dc"",""ac"",""pulsating dc"",""pure dc plus pulsating dc""]",1
"The ac armature winding of an alternator operates at __________ the field of winding","[""the same voltage as"",""much higher voltage than"",""much lesser voltage than"",""half the voltage than""]",1
"Why are the field poles and the armature of a dc machine laminated?","[""to reduce the weight of the machine"",""to reduce eddy current"",""to decrease the speed"",""to reduce armature reaction""]",1
"The back emf or counter emf in a dc motor","[""opposes the applied voltage"",""aids the armature current"",""aids the supplied voltage"",""opposes the armature current""]",0
"The synchronous reactance of an alternator is due to","[""leakage flux"",""armature reaction"",""dc field excitation"",""hysteresis loss""]",1
"Back emf in a dc motor is maximum at","[""no load"",""half full load"",""full load"",""three fourth full load""]",0
"The mechanical power developed in a dc motor is maximum when back emf is equal to _____ the applied voltage","[""twice"",""one third"",""one half"",""one fourth""]",2
"The core type transformer is generally suitable for","[""high voltage and small output"",""low voltage and high output"",""high voltage and high output"",""low voltage and low output""]",0
"The transformer that should never have the secondary open circuited when primary is energized is","[""power transformer"",""auto transformer"",""voltage transformer"",""current transformer""]",3
"The field winding of an armature is _________ excited","[""dc"",""ac"",""both ac and dc"",""battery""]",0
"The salient pole construction for field structure of an alternator is generally used for _________ machine","[""2 pole"",""8 pole"",""4 pole"",""6 pole""]",1
"When the speed of a dc motor increases, its armature current","[""increases"",""remains the same"",""decreases"",""becomes infinite""]",2
"The frequency of emf generated in an 8 pole alternator at 900 rpm is","[""50 hz"",""120 hz"",""60 hz"",""240 hz""]",2
"In case if a 4 pole machine, 1 mechanical degree corresponds to ________ electrical degree","[""2"",""8"",""4"",""6""]",0
"The torque developed by a dc motor is directly proportional to","[""flux per pole x armature current"",""armature resistance x applied voltage"",""armature resistance x armature current"",""flux per pole x applied voltage""]",0
"AC machine in which the torque is produced by the interaction of currents in the stator and currents induced in the motor by transformer action","[""squirrel cage motor"",""stepper motor"",""synchronous motor"",""induction motor""]",3
"Machine in which torque is produced by the interaction of ac current in the stator and dc currents in the rotor turning synchronism","[""synchronous motor"",""induction motor"",""squirrel cage motor"",""stepper motor""]",0
"The main drawback of a dc shunt generator is that","[""terminal voltage drops considerably with load"",""shunt field circuit has high resistance"",""generated voltage is small"",""it is expensive""]",0
"DC machines which are subjected to abrupt changes of load are provided with","[""interpole windings"",""compensating winding"",""equalizers"",""copper brushes""]",1
"The shaft torque in a dc motor is less than total armature torque because of _________ in the motor","[""copper losses"",""iron and friction losses"",""field losses"",""hysteresis loss""]",1
"Armature reaction in a dc motor is increased","[""When the armature current increases"",""when the armature current decreases"",""when the field current increases"",""by interpole""]",0
"An ideal transformer is one which","[""has no losses and leakage reactance"",""does not work"",""has the same number of primary and secondary turns"",""has the same primary and secondary voltage""]",0
"If a power transformer is operated at very high frequencies then","[""primary reactance is too much increased"",""primary will draw large power"",""core losses will be excessive"",""core loss is negligible""]",2
"With respect to the direction of rotation, interpoles on a dc motor must have the same polarity as the main poles","[""ahead of them"",""in parallel with them"",""behind them"",""beside them""]",2
"The open circuit test on a transformer is always made on","[""low voltage winding"",""high voltage winding"",""either low or high voltage"",""neither low or high voltage""]",0
"In the short circuit test in a transformer, __________ winding is generally short circuited","[""high voltage"",""low voltage"",""either low or high voltage"",""neither low nor high voltage""]",1
"In a dc motor, the brushes are shifted from the mechanical neutral panel in a direction opposite to the rotation to","[""decreased speed"",""reduced sparking"",""increase speed"",""produce flat characteristics""]",1
"The number of cycles generated in a 6 pole alternator in one revolution is","[""3"",""5"",""6"",""2""]",0
"If the lagging load power factor of an alternator is decreased, the demagnetizing effect of the armature reaction","[""remains the same"",""is increased"",""is decreased"",""becomes infinite""]",1
"In a very large dc motor with severe heavy duty, armature reaction effects are corrected by","[""using interpole only"",""using compensatory windings in addition to interpoles"",""shifting the brush position"",""fixing the brush position""]",1
"The amount of copper in the primary is _________ that of the secondary","[""about the same as"",""smaller than"",""greater than"",""twice""]",0
"The open circuit test on a transformer gives","[""copper losses"",""iron losses"",""friction losses"",""total losses""]",1
"The speed of a __________ motor is practically constant","[""commutatively compounded"",""differentially compounded"",""series"",""shunt""]",3
"The running speed of a dc series motor is basically determined by","[""field excitation"",""armature resistance"",""load"",""applied voltage""]",2
"If the excitation of an alternator operating in parallel with other alternators is decreased, its","[""power factor becomes more leading"",""output kW will change"",""power factor becomes more lagging"",""power factor becomes unity""]",0
"The distribution of load between two alternators operating in parallel can be changed by changing","[""phase sequence"",""field excitation of alternators"",""driving torques of prime movers"",""current direction""]",2
"After a shunt motor is up to speed the speed may be increased considerably by","[""increasing field circuit resistance"",""decreasing field circuit resistance"",""increasing the armature circuit resistance"",""reducing the load""]",1
"When the secondary of a transformer is short circuited, the primary inductance","[""is decreased"",""remains the same"",""is increased"",""becomes zero""]",0
"For the same rating __________ motor has the least starting torque","[""commulatively compounded"",""shunt"",""series"",""differentially compounded""]",1
"The deciding factor in the selection of a dc motor for a particular application is its _____ characteristics","[""speed torque"",""torque armature current"",""speed armature current"",""speed""]",0
"The rotor of a turbo alternator is made cylindrical in order to reduce","[""eddy current loss"",""wind age loss"",""hysteresis loss"",""copper loss""]",1
"The disadvantage of a short pitched coil is that","[""harmonics are introduced"",""waveform becomes non-sinusoidal"",""voltage round the coil is reduced"",""voltage round coil is increases""]",2
"The demand for a large increase in torque of a dc shunt motor is met by a","[""large decreased in speed"",""large increased in current"",""large increased in speed"",""small increased in current""]",1
"For 20% increase in current, the motor that will give the greatest increase in torque is _________ motor","[""shunt"",""series"",""differentially compounded"",""commulatively compounded""]",1
"What cell is used to detect infrared radiation, either its generated voltage or its change of résistance may be used as a measure of the intensity of the radiation?","[""lead sulfide cell"",""Faure storage cell"",""infrared cell"",""Leclanche cell""]",0
"A galvanic cell resulting from difference in potential between adjacent on the surface of a metal immersed in an electrolyte","[""NiCd cell"",""lead acid cell"",""local cell"",""lithium cell""]",2
"Which motor is used to start heavy loads?","[""series"",""differentially compounded"",""shunt"",""commulatively compounded""]",0
"When load is removed, the motor that will run at the highest speed is the _________ motor","[""shunt"",""commulatively compounded"",""series"",""differentially compounded""]",2
"If a transformer core has air gaps then","[""reluctance of magnetic path is decreased"",""hysteresis loss is decreased"",""magnetizing current is greatly increased"",""eddy current is increased""]",2
"The effect of leakage flux in a transformer is to","[""increase copper losses"",""decrease copper losses"",""cause voltage drop in the windings"",""reduce eddy current losses""]",2
"The iron losses in a dc motor depend upon","[""flux only"",""speed only"",""both flux and speed"",""temperature""]",2
"The greatest percentage of power loss in a dc motor is due to","[""wind age loss"",""core loss"",""copper loss"",""friction loss""]",2
"Excessive sparking at the brushes may caused due to","[""dirt on the commutator"",""misalignment of machine"",""loose coupling"",""worn bearings""]",0
"The temperature rise of a transformer is directly proportional to","[""apparent power"",""leakage reactance"",""reactive power"",""true power""]",0
