question,choices,answer
"A graphical relation between the generated emf and the field current of a machine","[""current generation curve"",""voltage generation curve"",""voltage current curve"",""magnetization curve""]",3
"Majority of alternators in use have","[""revolving ac armature winding"",""stationary field type construction"",""revolving field type construction"",""stationary ac armature winding""]",2
"The stator of an alternator is identical to that of a","[""dc generator"",""1 phase induction motor"",""3 phase induction motor"",""Rosenberg generator""]",2
"Excessive motor vibration is caused by","[""too much brush tension"",""open armature coil"",""worn bearings"",""bent shaft""]",2
"Hot bearings of a dc motor may be caused by","[""poor ventilation"",""loose coupling"",""incorrect voltage"",""lack of dirty lubricant""]",3
"Intermittent sparking at the brushes of dc motor may be caused due to","[""an open armature coil"",""loose coupling"",""intermittent load"",""incorrect voltage""]",0
"When the load on a transformer is increased, the eddy current loss","[""is decreased"",""remains the same"",""is increased"",""becomes zero""]",1
"The yoke of a dc machine is made of","[""silicon steel"",""aluminum"",""soft iron"",""cast steel""]",0
"The armature of a dc machine is made of","[""silicon steel"",""cast steel"",""wrought iron"",""soft iron""]",2
"The voltage per turn of the primary of a transformer is _________ the voltage per turn of the secondary","[""more than"",""the same as"",""less than"",""twice""]",1
"The winding of the transformer with greater number of turns will be","[""high voltage winding"",""low voltage winding"",""either high or low voltage winding"",""high power""]",0
"The coupling field between electrical and the mechanical systems of a dc machine is","[""electric field"",""both electric and magnetic fields"",""magnetic field"",""electromagnetic field""]",2
"The real working Part of a dc machine is the","[""commutator"",""armature winding"",""field winding"",""stator""]",1
"Which DC machines are the most common?","[""2 pole"",""6 pole"",""4 pole"",""8 pole""]",2
"The core type transformer provides","[""much longer magnetic pattern"",""lesser average length per turn"",""shorter magnetic path"",""longer magnetic path""]",2
"A machine with field excitation by both shunt and series windings","[""complex machine"",""compound machine"",""universal machine"",""shunt\/ series machine""]",1
"The armature winding of a dc machine is placed on the rotor to","[""save iron"",""facilitate commutation"",""reduce losses"",""reduce armature reaction""]",1
"The yoke of a dc machine carries _____ poke flux","[""one third of"",""two times of"",""one half of"",""one fourth of""]",2
"The greatest eddy current loss occurs in the __________ of a dc machine","[""field poles"",""commutating process"",""yoke"",""armature""]",3
"The commutator pitch for a simplex lap winding is equal to","[""number of poles of the machines"",""1"",""poles pairs"",""2""]",1
"In a simplex wave winding, the number of parallel paths is equal to","[""number of poles in the machine"",""2"",""number of pair poles"",""1""]",1
"In a practical transformer, copper losses account for how many percent of the total losses?","[""75%"",""25%"",""85%"",""95%""]",2
"By laminating the core of a transformer, __________ decreases","[""leakage reactance"",""eddy current loss"",""hysteresis loss"",""copper loss""]",1
"The number of parallel paths in a simplex lap winding is equal to","[""2"",""number of poles"",""number of pair poles"",""1""]",1
"In a dc machine the number of commutator segments is equal to","[""number of conductors"",""number of coils"",""twice the number of poles"",""twice the number of coils""]",1
"A dc compound generator having full load terminal voltage equal to the no load generator voltage is called __________ generator","[""under compounded"",""flat compounded"",""over compounded"",""un compounded""]",1
"The terminal voltage of a __________ generator vary widely with changes in load current","[""series"",""flat compounded"",""shunt"",""over compounded""]",0
"The nature of armature winding of a dc machine is decided by","[""front pitch"",""back pitch"",""commutator path"",""number of coils""]",2
"The voltage regulation of an alternator is larger than of a dc generator because of","[""large armature resistance"",""large leakage reactance"",""complex effects of armature reaction"",""small armature resistance""]",2
"High voltage dc machines use what winding?","[""Lap"",""wave"",""either lap or wave"",""open circuit""]",1
"In a lap winding, the number of the brushes required is equal to","[""number of poles"",""commutator pitch"",""number of pairs of poles"",""number of coils""]",0
"What is the approximate efficiency of large transformer?","[""65%"",""80%"",""50%"",""95%""]",3
"In a wave winding, the commutator pitch is approximately equal to","[""pole pitch"",""thrice the pole pitch"",""twice the pole pitch"",""half the pole pitch""]",2
"A triplex wave winding will have _________ parallel paths","[""6"",""4"",""2"",""8""]",0
"For a given dc generator, the generated voltage depends upon","[""flux only"",""both speed and flux"",""speed only"",""armature rotation""]",1
"For the same rating, a dc machine has _________ an ac machine","[""the same weight as"",""less weight than"",""more weight than"",""half the weight than""]",2
"Difference between the speed of a rotating magnetic field and the associated rotor","[""split"",""salient pole"",""slip"",""pull out torque""]",2
"The field winding of a dc shunt machine usually carries ___________ of the rated current of the machine","[""2% to 5%"",""more than 20%"",""15% to 20%"",""less than 0.5%""]",0
"A separately excited dc generator is not used because","[""it is costly"",""a separate dc source is required for field circuit"",""voltage drops considerably with load"",""it is bulky""]",1
"The effect of armature reaction is to","[""decreased the total flux"",""make the air gap flux uniform"",""increase the total flux"",""make the flux constant""]",0
"In a dc generator armature reaction __________ pole tip","[""weakens the flux at the trailing"",""weakens the flux at the leading"",""strengthens the flux at the leading"",""strengthens the flux at the trailing""]",1
"The greatest percentage of the heat loss in a dc machine is due to","[""eddy current loss"",""copper loss"",""hysteresis loss"",""frictional loss""]",1
"The size of a dc generator can be reduced by using","[""lap winding"",""high resistance winding material"",""iron commutator"",""magnetic material of high permeability""]",3
"A device that is capable of converting chemical energy into electrical energy","[""generator"",""battery"",""converter"",""cell""]",3
"A secondary cell whose active positive plate consists of nickel hydroxide, and active negative-plate material is powdered iron oxide mixed with cadmium. Its typical output when fully charged is VO = 1.2 V","[""Leclanche cell"",""dry cell"",""Edison cell"",""lead-acid cell""]",2
"If a cell can be charged after it is depleted, it is considered as","[""a secondary cell"",""a storage cell"",""an accumulator"",""all of the above""]",3
"What type of cell that cannot be recharged which cannot restore chemical reaction?","[""nickel-cadmium cell"",""secondary cell"",""primary cell"",""lead-acid wet cell""]",2
"A cell whose chemical reaction is not reversible","[""primary cell"",""secondary cell"",""rechargeable cell"",""solar cell""]",0
"A voltage source in a single container made from one or more cells combines in series, parallel, or series-parallel.","[""photoelectric"",""thermocouple"",""battery"",""piezo-electric""]",2
"A battery means","[""cells connected in series"",""cells connected in parallel"",""cells connected in series-parallel"",""all of the above""]",3
"A battery is used to","[""supply a steady dc voltage"",""supply an unstable dc voltage"",""supply an ac voltage"",""supply an ac\/dc voltage""]",0
"In a dry cell, what will happen to the internal resistance as it aged?","[""decreases"",""increases"",""remains constant"",""decreases or increases, depends on the chemical composition""]",1
"The maximum current a cell can deliver through a 0.01 ohm load during testing","[""flash current"",""surge current"",""ideal current"",""full-load current""]",0
"In batteries, the material used to insulate the positive plates from negative plates are technically called","[""insulator"",""break-point"",""coupler"",""separator""]",3
"How long will a battery need to operate a 240 Watts equipment, whose capacity is 100 Ah and 24 volts rating?","[""5 hrs"",""10 hrs"",""1 hr"",""0.10 hr""]",1
"A battery is rated 20 A-hr and is delivering a current of 2 A. How long does it last?","[""1 hr"",""5 hrs"",""8 hrs"",""10 hrs""]",3
"A primary cell with carbon and zinc as its positive and negative electrodes respectively, and an electrolyte of either a gel or paste. This is commonly known as dry cell.","[""Leclanche cell"",""Edison cell"",""storage cell"",""solar cell""]",0
"Find the output of a four (4) lead acid cells.","[""3.2 V"",""8.4 V"",""5.8 V"",""12 V""]",1
"Silver-cadmium cell has a nominal open-circuit voltage of","[""1.05 V"",""1.5 V"",""2.1 V"",""2.2 V""]",0
"Output of six carbon-zinc cells connected in series","[""3 V"",""6 V"",""6.6 V"",""9 V""]",3
"The flat 9-V battery, has how many cells in series?","[""3"",""4"",""6"",""9""]",2
"Output of automotive battery with six lead-acid cells in series","[""6 V"",""12 V"",""24 V"",""48 V""]",1
"Substance, which generates a voltage when exposed to light.","[""generating substance"",""photovoltaic material"",""thermoelectric generator"",""hydroelectric generator""]",1
"A cell whose voltage is generated as a function of light","[""photovoltaic cell"",""thermoelectric cell"",""photodiode"",""LED""]",0
"Substance used in photovoltaic cells","[""Silicon"",""Selenium"",""Germanium"",""All of these""]",3
"A junction between two conductors that exhibits electrical characteristics under condition of changing temperature","[""pn junction"",""photojunction"",""thermoelectric junction"",""hydroelectric junction""]",2
"Electricity that is generated due to heat, as in thermocouple.","[""thermodynamics"",""thermojunction"",""electric heater"",""thermoelectricity""]",3
"The source of mechanical power to turn the rotors of alternators, large and small, A.C. and D.C.","[""prime contactor"",""primer"",""prime mover"",""prime user""]",2
"Electrical machines refer to machines that convert ________.","[""mechanical to electrical energy"",""electrical to mechanical energy"",""electrical energy of one form to electrical energy of another form"",""all of the above""]",3
"Electrical machines that convert mechanical energy to electrical energy.","[""generators"",""motors"",""cycloconverters"",""frequency converters""]",0
"Electrical machine that converts ac voltage to dc voltage, or vice versa.","[""generator"",""motor"",""rotary converter"",""frequency converter""]",2
"Electrical machine that changes ac voltage at one frequency to another ac voltage at another frequency.","[""generator"",""motor"",""rotary converter"",""frequency converter""]",3
"It consist of a single coil rotated in a magnetic field and produces an A.C. voltage.","[""field winding"",""armature"",""commutator"",""elementary generator""]",3
"Generation of voltage in a generator can only happen when?","[""there is a rotary conductor"",""there is a magnetic field in a conductor"",""there is a relative motion between conducting wires and magnetic lines of force"",""there is a relative motion between a conductor and electric field""]",2
"Two essential parts in rotating generators","[""electro\/permanent magnets and armature winding"",""electromagnets or permanent magnets and commutator"",""commutator and armature winding"",""brushes and commutator""]",0
"In electrical machines, what do you call the set of conductors wound on laminated cores of good magnetic permeability?","[""armature core"",""armature winding"",""rotary winding"",""rotary core""]",1
"In dc generator, what converts the alternating emf to DC?","[""armature"",""commutator"",""diode"",""alternator""]",1
"Generally, in dc generators","[""The armature winding is rotated with respect to a stationary magnetic field produced by electromagnets or permanent magnets."",""The electromagnets or permanent magnets (magnetic fields) are rotated with respect to the stationary armature winding."",""Current is sent into the armature winding; or the armature winding is usually placed in a stationary laminated iron core and the rotating element may or may not be a set of magnet poles, it depends on the type of motor."",""The armature winding is supplied with current; or the armature is placed inside a set of radially supported magnetic poles.""]",0
"In electrical machines, what type of voltage is generated at the armature winding?","[""dc"",""pulsating dc"",""ac"",""ac or dc depending on the type of machine""]",2
"Generally in ac generators","[""The armature winding is rotated by a stationary magnetic field produced by electromagnets or permanent magnets."",""Current is sent into the armature winding; or the armature winding is usually placed in a stationary laminated iron core and the rotating element may or may not be a set of magnet poles, it depends on the type of motor."",""The electromagnets or permanent magnets (magnetic fields) are rotated with respect to the stationary armature winding."",""The armature winding is supplied with current; or the armature is placed inside a set of radially supported magnetic poles.""]",2
"A dc generator whose excitation is produced by a winding connected to its own positive and negative terminals.","[""series generator"",""separately excited shunt generator"",""self-excited shunt generator"",""compound generator""]",2
"What is true about field poles in electric machines?","[""there are always even number of them (exist by pair)"",""there are always an odd number of them"",""there are an even or an odd number of them"",""none of the above""]",0
"In a compound generator, which field winding usually, has a lower resistance?","[""series field winding"",""shunt field winding"",""armature winding"",""excitation winding""]",0
"Which winding in a dc-compound generator that is relatively made of fine wires?","[""armature winding"",""excitation winding"",""shunt field winding"",""series field winding""]",2
"What important characteristic you should consider in choosing a dc-generator?","[""voltage capacity"",""current capacity"",""voltage vs. load"",""power rating""]",2
"What is the purpose of laminating the field poles and armature of a dc machine?","[""to reduce eddy current"",""to avoid contaminants"",""to provide isolation"",""to beautify the machine""]",0
"An alternator with a lagging power factor of 0.8 will have a ________ voltage regulation at unity power factor.","[""0%"",""less than"",""greater than"",""100%""]",2
"With alternators connected in parallel, the frequency of the system can be changed by","[""increasing the field excitation"",""decreasing the field excitation"",""changing the rpm of the prime movers"",""synchronizing the prime movers""]",2
"With alternators connected in parallel, the voltage of the system can be changed by","[""changing the field excitation"",""increasing the speed of the prime movers"",""changing the rpm of the prime movers"",""synchronizing the prime movers""]",0
"If an ac generator is to be driven from prime mover having variable speed, such as aircraft engine, a ________ must be used.","[""constant speed drive (CSD)"",""regulator"",""conditioner"",""peak limited""]",0
"Find the frequency in kilocycles per second in the armature of a 10 pole, 1,200 rpm generator.","[""100"",""1000"",""10"",""0.1""]",3
"What should be the speed of a 6-pole ac generator in order to have a frequency of 50 Hz?","[""100 rpm"",""500 rpm"",""1000 rpm"",""1500 rpm""]",2
"Calculate the voltage regulation of a generator having a no-load voltage of 220 V and a full load voltage of 180 V.","[""18%"",""22%"",""28%"",""32%""]",1
"Usually used to drive low-speed alternators","[""diesel engines"",""jet propulsion engines"",""steam turbines"",""hydraulic turbines""]",3
"Is usually used to drive high-speed alternators","[""diesel engines"",""pneumatic engines"",""steam turbines"",""hydraulic turbines""]",2
"Which statement is true regarding alternators?","[""high-speed alternators are smaller than low-speed"",""low-speed alternators are smaller than high-speed"",""high-power alternators are smaller than low-power"",""high-voltage alternators are smaller than low-voltage""]",0
"For what reason, why carbon brushes are widely used dc machines?","[""it is abundant"",""it is cheap"",""it has a high voltage drop"",""it lubricates and polishes the contacts""]",3
"Alternators have less chance to hunt if driven by","[""steam turbines"",""hydroturbines"",""diesel turbines"",""nuclear reactor""]",0
"In alternators, what is the purpose of damper windings?","[""it prevents over speeding"",""it maintain constant speed"",""it prevents hunting"",""it protects overloading""]",2
"What term applies to the use of two or more generators to supply a common load?","[""on-line operation"",""series operation"",""cascaded operation"",""parallel operation""]",3
"In paralleling ac generators, ________ is very important.","[""voltage level"",""current level"",""phase angle"",""internal resistance""]",2
"Description used for generators trying to self-adjust its parameters before paralleling with on line generators.","[""synchronizing"",""sequencing"",""jogging"",""alighning""]",2
"In changing power from one generator to another, what do you call the operational sequence wherein the incoming generator is connected first before removing the existing generator?","[""No Break Power Transfer (NBPT)"",""UPS"",""LIFO"",""Standby Power transfer""]",0
"What do you mean by break power transfer?","[""The incoming generator will be connected first to the bus bar before disconnecting the existing generator."",""The present on-line generator will be disconnected first before connecting the incoming generator."",""The incoming generator will only be connected to the bus bar when the bus bar breaks."",""The present on-line generator will be disconnected first and then reconnected together with the incoming generator.""]",1
"How alternators rated?","[""in Watts"",""in kW"",""in kVar"",""in kVA""]",3
"In electrical power distribution, what do you call the first distribution line from the main generating station?","[""main transmission lines"",""primary distribution lines"",""sub transmission lines"",""secondary distribution lines""]",0
"The lines which carry the energy from the transformer to a customer’s services are called ________.","[""main transmission lines"",""primary distribution lines"",""sub transmission lines"",""secondary distribution lines""]",3
"In electrical power Generating/distribution Company, which do you think is their highest expenses?","[""generation of power"",""distribution of power to the consumers"",""power transmission"",""substations""]",1
"In electrical power distributions, what insulator is generally used?","[""rubber"",""wood"",""plastic"",""porcelain""]",3
"Electrical machines refer to machines that convert ________.","[""mechanical to electrical energy"",""electrical to mechanical energy"",""electrical energy of one form to electrical energy of another form"",""all of the above""]",3
"Electrical machines that convert electrical energy to mechanical energy.","[""generators"",""motors"",""rotary converters"",""frequency converters""]",1
"Synchronous type of ac-motor,","[""uses a dc-generator to supply dc-excitation to the rotating field"",""uses pulsating dc"",""uses alternator"",""has an ac or dc depending on the type of machine""]",0
"Generally in dc motors","[""the armature winding is rotated by a stationary magnetic field produced by electromagnets or permanent magnets."",""current is sent into the armature winding; or the armature winding is usually placed in a stationary laminated iron core and the rotating element may or may not be a set of magnet poles, it depends on the type of motor."",""the electromagnets or permanent magnets (magnetic fields) are rotated with respect to the stationary armature winding."",""the armature winding is supplied with current; or the armature is placed inside a set of radially supported magnetic poles.""]",3
"In ac motors, generally","[""current is sent into the armature winding; or the armature winding is usually placed in a stationary laminated iron core and the rotating element may or may not be a set of magnet poles, it depends on the type of motor."",""the armature winding is supplied with current; or the armature is placed inside a set of radially supported magnetic poles."",""the armature winding is rotated by a stationary magnetic field produced by electromagnets or permanent magnets."",""the electromagnets or permanent magnets (magnetic fields) are rotated with respect to the stationary armature winding.""]",0
"Among the dc motors, which produces the highest torque?","[""series"",""shunt"",""compound"",""differentially compounded""]",0
"Dc motor that has the most stable speed.","[""differentially compounded"",""compound"",""shunt"",""series""]",2
"In dc motors, when does severe arcing happens?","[""during starting"",""during rated speed"",""during speed fluctuation"",""during shutdown""]",0
"What is the primary reason why carbon brushes are preferred over copper brushes in dc motors?","[""they have low loss"",""they are more strong"",""they produce less arcing"",""all of the above""]",2
"In dc motors, the emf developed which opposes to the supplied voltage.","[""residual emf"",""induced emf"",""coercive emf"",""counter emf or back emf""]",3
"To minimize arcing during starting of dc motors, a resistance should be added to limit the current in the ________.","[""series field winding"",""shunt field winding"",""armature winding"",""all of these""]",2
"Which dc motors whose speed is greatly affected by a change in load? It will even run away if the load is removed.","[""series"",""shunt"",""cumulatively compounded"",""differentially compounded""]",0
"Motors whose speed can be easily controlled.","[""dc motors"",""ac motors"",""ac &amp; dc motors"",""ac or dc motors""]",0
"When a dc motor has no load, what will happen to the back emf?","[""reduces"",""increases"",""becomes maximum"",""becomes zero""]",2
"When can we get a maximum mechanical power from a dc motor?","[""Eb = 0"",""Eb = \u00bdV"",""Eb = 1V"",""Eb = 2V""]",1
"The torque of a dc motor is","[""directly proportional to the field strength"",""inversely proportional to the field strength"",""directly proportional to the armature current"",""A and C are correct""]",3
"One causes why the shaft torque is less than the developed armature torque of a dc motor.","[""eddy current"",""field loss"",""brushes loss"",""friction loss""]",3
"For heavy-duty dc motor, how does the effect of armature reaction be corrected?","[""using interpoles &amp; brush shifting"",""using interpoles"",""using compensatory winding"",""B &amp; C are correct""]",3
"Considered as a variable speed motor","[""compounded"",""differentially compounded"",""shunt"",""series""]",3
"What is the most common method used in varying the speed of a dc motor?","[""by varying the supply voltage"",""by changing the effective number of conductors in series"",""by varying the armature resistance"",""by varying the field strength""]",3
"The running speed of a dc series motor is greatly affected by what factor?","[""field excitation"",""load"",""armature resistance"",""supply voltage""]",1
"In choosing a motor for a particular application, what characteristic you should consider?","[""speed-torque"",""speed-armature current"",""speed efficiency"",""speed power""]",0
"What will happen to the dc shunt motor if the load torque greatly increases?","[""the speed will decrease"",""there will be a great increase in current"",""the speed almost remains constant"",""B and C are correct""]",3
"What will happen to a dc series motor when its load is removed?","[""the motor will stop"",""the motor speed remains the same"",""the torque remains the same"",""the motor will overspeed""]",3
"A motor whose speed increases as the load is increased.","[""series dc"",""dc shunt"",""cumulatively compounded"",""differentially compounded""]",3
"Factor(s) that affect iron losses in a dc motor.","[""flux"",""speed"",""armature resistance and flux"",""A and B are correct""]",3
"One advantage of a cumulatively compounded motor is that it does not run widely at light loads, this feature is due to","[""shunt winding"",""brake winding"",""series winding"",""clutch winding""]",0
"In applications where an almost constant speed is required, a _______ motor is a good choice.","[""dc shunt"",""dc series"",""cumulatively compounded"",""differentially compounded""]",0
"In applications where a high torque is needed during starting a _______ motor is preferred.","[""dc shunt"",""dc series"",""differentially compounded"",""cumulatively compounded""]",1
"In applications where sudden heavy loads happen for short duration, a _______ motor is the best choice.","[""dc shunt"",""dc series"",""cumulatively compounded"",""differentially compounded""]",2
"In motors of the same rating, which has the least starting torque?","[""dc shunt"",""dc series"",""differentially compounded"",""cumulatively compounded""]",0
"Factor(s) that affect friction and winding loses in dc motors.","[""speed"",""armature current"",""interpoles"",""armature resistance""]",0
"Dirt on the commutator may produce","[""isolation"",""excessive sparking"",""power loss"",""lower torque""]",1
"Motor vibrations are usually caused by","[""loose coupling"",""dirt on the commutator"",""much brush tension"",""worn bearings""]",3
