question,choices,answer
"A type of cable which is a single or multi conductor solid dielectric insulated cable rated 2001 volts or higher.","[""MC"",""MV"",""FCC"",""AC""]",1
"In selecting the maximum setting of an instantaneous trip CB to be used to protect all AC motors from short circuit, a multiplying factor of ____ shall be used.","[""250%"",""300%"",""150%"",""700%""]",3
"The paper spacer thickness if type IGS cable having a conductor size of 125 mm2 to 500 mm2 shall be______.","[""1.20 mm"",""1.02 mm"",""0.92 mm"",""1.12 mm""]",1
"What is the maximum number of overcurrent devices of a lighting and appliance panel board that shall be installed in a cabinet?","[""36 devices"",""24 devices"",""48 devices"",""52 devices""]",2
"Intermediate metal conduit shall be firmly fastened within _____ of each outlet box junction box, cabinet or fitting.","[""750 mm"",""1000 mm"",""800 mm"",""900 mm""]",3
"Resistance type heating elements in electric space heating equipment shall be protected at NOT more than ____.","[""50 A"",""30 A"",""40 A"",""60 A""]",3
"Heavy-duty lighting track is a lighting track identified for use exceeding ____.","[""15 A"",""20 A"",""30 A"",""10 A""]",1
"For three-phase motors supply by any 3-phase system, the number of overload units required shall be ____.","[""three, one in each phase"",""two, in any two of each phase"",""one, in any one phase"",""none of these""]",0
"As compared with solid wires, stranded wires of the same cross sectional area have the following advantage EXCEPT one. Which one is this?","[""It is larger in overall diameter"",""It is easier to skin off the insulation"",""It is better for high voltage"",""It has a higher current rating""]",1
"Each length of the rigid metal conduit shall be clearly and durably identified in every ______ as required.","[""3,000 mm"",""2,000 mm"",""4,000 mm"",""1,000 mm""]",0
"Flexible metal conduit shall be supported within ____ on each side of every outlet box, junction box, cabinet or fitting.","[""300 mm"",""200 mm"",""460 mm"",""150 mm""]",0
"The maximum electrical trade size of electrical metallic tubing shall be_____.","[""125 mm"",""150 mm"",""100 mm"",""200 mm""]",2
"For installations of 2.0 mm<sup>2</sup> conductors in 600-v circuits, what is the minimum insulation resistance allowed by the Philippine Electrical Code?","[""1,000,000 \u03a9"",""750,000 \u03a9"",""250,000 \u03a9"",""500,000 \u03a9""]",3
"Askarel insulated transformers installed indoors and rated over ____ kVA shall be furnished with a pressure relief vent.","[""37.5"",""25"",""50"",""15""]",1
"In straight pulls, the length of the pull box shall not be less than _____ times the trade diameter of the largest raceway.","[""8"",""6"",""10"",""5""]",0
"Busways shall be securely supported at intervals NOT exceeding ____ unless otherwise designed and marked.","[""1,000 mm"",""2,000 mm"",""2,500 mm"",""1,500 mm""]",3
"The smallest electrical trade size of a liquidtight flexible non-metallic conduit shall be.","[""15 mm"",""12 mm"",""20 mm"",""25 mm""]",2
"Boxes intended to enclose flush devices shall have an internal depth of NOT less than ____.","[""24 mm"",""20 mm"",""16 mm"",""28 mm""]",0
"A branch circuit supplying a fixed storage type water heater having a capacity of 450 liters or less shall have a rating not less than _____ of the nameplate rating of the water heater.","[""100%"",""115%"",""120%"",""125%""]",3
"Defined as the shortest distance measured between a point on the top surface of any direct buried conductor, cable, conduit and the top surface of finish grade.","[""Trench"",""Cover"",""Tray"",""Duct""]",1
"A wall screen or fence less than ____ in height shall NOT be considered as a preventing access unless it has other features that provide a degree of isolation equivalent to the height of the fence in question.","[""2,000 mm"",""2,500 mm"",""3,000 mm"",""1,500 mm""]",1
"Branch circuit conductors supplying a single phase motor shall have an ampacity NOT exceeding","[""100%"",""125%"",""200%"",""115%""]",1
"Pits within ____ horizontally from the flammable vapor source, shall be considered a hazardous location under Class I, Division I location","[""6,000 mm"",""5,000 mm"",""7,600 mm"",""4,600 mm""]",2
"Type TW conductor is a ____ type.","[""moisture and heat resistant"",""moisture and heat resistant thermoplastic"",""moisture resistant and thermoplastic"",""heat resistant and thermoplastic""]",2
"The current in amperes a conductor can carry continuously under the conditions of use without exceeding its temperature rating","[""Ampacity"",""Capacitivity"",""Rating"",""Amperage""]",0
"Flat conductor cables maybe installed in any of the following location EXCEPT one. Which one is this?","[""On hard concrete flooring"",""In wet locations"",""For branch circuits"",""In damp locations""]",1
"Operation of loads and intervals of time both of which maybe subject to wide","[""Periodic duty"",""Intermittent duty"",""Continuous duty"",""Varying duty""]",3
"For equipment rated 1200 A and over 1,900 mm wide containing overcurrent devices and control devices at least one entrance of NOT less than ____ wide and ____ high shall be provided at each end.","[""600 mm, 2,000 mm"",""600 mm, 2,500 mm"",""80 mm, 2,000 mm"",""800 mm, 2,500 mm""]",0
"Batteries and direct current circuits shall be physically separated by at least a ___ gap or other approved means from circuits of a different power source.","[""12 mm"",""15 mm"",""20 mm"",""10 mm""]",0
"Where contactors are used as the disconnecting means for fuses an individually externally operable switch, such as tumbler switch for the control of each contractor shall be located at a distance of not more than ____ from the contactor.","[""1,500 mm"",""1,800 mm"",""2,000 mm"",""2,400 mm""]",1
"No electrical installation, alteration and or addition shall be connected or reconnected to any power supply or any other source of electrical energy without","[""an electrical permit"",""an application for inspection"",""certificate of payment"",""certificate of final inspection""]",3
"Four (4) 3-phase motor are supplied by one common feeder cable. The full load current ratings of the motors are 10 A, 20 A, 30 A, and 40 A. What should be the minimum ampacity of the feeder cable?","[""110 A"",""125 A"",""150 A"",""100 A""]",0
"Thermal barrier shall be required if the space between the resistors and reactors and any combustible material is less than ____.","[""600 mm"",""400 mm"",""500 mm"",""300 mm""]",3
"The ampacity of conductors that connect a capacitor to the terminals of a motor circuit conductor shall not be less than ____ the ampacity of the motor circuit conductors and in no case less than 135% of the rated capacitor current.","[""one-third"",""one-fourth"",""one-half"",""one-fifth""]",0
"The load for each ungrounded feeder and services conductor supplying 5 to 8 receptacles that supply shore power for boats shall be calculated as ____ of the sum of the rating of the receptacles.","[""80%"",""70%"",""90%"",""60%""]",2
"A device actuated by the operation of some devices with which it is directly associated to govern succeeding operations of some or allied devices","[""Selsyn"",""Automatic"",""Interlock"",""Relay""]",2
"The underground service conductors between the street main, including any risers at pole or other structure or from transformers and the first point of connection to the services entrance conductors.","[""Service drop"",""Service cable"",""Service lateral"",""None of these""]",2
"For 101 A to 200 A circuits, the minimum insulation required shall be____","[""50,000 ohms"",""100,000 ohms"",""250,000 ohms"",""75,000 ohms""]",0
"Which of the following is NOT a standard kVA rating of a single-phase transformer?","[""175"",""150"",""167"",""100""]",0
"For voltage above 600 V, the minimum insulation resistance shall be ____","[""1,500,000 ohms per kilovolt rating"",""500,000 ohms per kilovolt rating"",""1,000,000 ohms per kilovolt rating"",""2,000,000 ohms per kilovolt rating""]",2
"The rating of any cord and plug connected utilization equipment shall NOT exceed ____ of the branch circuit rating.","[""100%"",""80%"",""125%"",""90%""]",1
"If there will six or more 2-wire branch circuits, the service disconnecting means shall NOT be smaller than ____.","[""100 A"",""90 A"",""60 A"",""30 A""]",0
"For direct current motors, the multiplying factor to be used in selecting the size of overcurrent device using an inverse time CB shall be____ percent of its full load current.","[""125"",""150"",""175"",""200""]",1
"Specifications written on the plans or submitted on separate standard size sheets shall show_____.","[""types of writing, i.e. service entrance, branch circuit, feeders, etc."",""nature of electrical services, i.e. no. of phase, voltage, frequency, etc."",""special equipment5 to be installed indicating ratings"",""all of these""]",3
"An appliance which is fixed in one place to another in normal use","[""Fixed appliance"",""Stationary appliance"",""Portable appliance"",""None of these""]",1
"In starting a large DC motor, a starter is primarily used in order to","[""save electrical power"",""limit the starting current"",""add more power"",""reduce the voltage drop""]",1
"Hazardous locations in which easily ignitable fibers are stored and handled.","[""Class III, Division 2"",""Class III, Division 1"",""Class II, Division 2"",""Class II, Division 1""]",0
"In commercial garages, repair and storage areas, the entire area up to a level of ____ above the floor shall be considered to be Class I, Division 2 hazardous location","[""400 mm"",""500 mm"",""460 mm"",""450 mm""]",2
"Conductors passing over roof surface, a vertical clearance of ____ shall be maintained.","[""2,500 mm"",""1,500 mm"",""2,000 mm"",""3,000 mm""]",0
"What is the minimum vertical clearance for service drop conductors (not over 600 volts) above finished grade or sidewalks accessible only to pedestrians?","[""3100 mm"",""3700 mm"",""4600 mm"",""5500 mm""]",0
"Busways shall be permitted to be installed behind panels if means of access are provided and if the conditions below are met. One of them is NOT valid. Which one is this?","[""No over current are installed on the busway other than for an individual fixture"",""The busway is so installed that the joints between sections and fitting are accessible for maintenance purposes"",""The busway is open and of the ventilator type"",""The space behind the panels is not for air handling purposes""]",2
"The OCPD for resistance welders shall NOT exceed _____ of the conductor’s ampacity supplying the circuit.","[""200%"",""250%"",""300%"",""400%""]",2
"For installations to supply only limited load of a single branch circuit, the service disconnecting means shall have a rating of NOT less than _____.","[""20 A"",""30 A"",""40 A"",""15 A""]",3
"Metal clad cable (MC) can be used in systems of 600 V or ____.","[""less"",""more"",""both A and B"",""neither A and B""]",1
"Open conductors passing over residential driveways and those commercial areas not subject to truck traffic where the voltage exceeds 300 V to ground shall have a vertical clearance of ____.","[""3,700 mm"",""4,600 mm"",""3,100 mm"",""5,500 mm""]",1
"MC cable insulation have a maximum operating temperature of not less than ____.","[""75\u00b0C"",""80\u00b0C"",""90\u00b0C"",""60\u00b0C""]",2
"The ampacity of conductors in non-metallic sheathed cable shall be used at ____.","[""75\u00b0C"",""60\u00b0C"",""90\u00b0C"",""80\u00b0C""]",1
"What is the radius of a solid round conductor, which id the nearest equivalent of a stranded conductor whose total area is exactly 8.0 mm²?","[""1.597 mm"",""1.596 mm"",""3.191 mm"",""3.192 mm""]",2
"For high impedance grounding, the system _____ conductor shall not be connected to the ground EXCEPT through the grounding impedance.","[""line"",""neutral"",""both A and B"",""neither A and B""]",1
"The load for household electric clothes dryer in dwelling is the larger of the nameplate or ____ VA.","[""4,000"",""5,000"",""6,000"",""8,000""]",1
"Each lighting and appliance branch circuit panel board shall be protected individually on the supply side by not mare than two main CBs or two sets of fuses having a combined rating not ____ than that of the panel board.","[""less"",""greater"",""both A and B"",""neither A and B""]",1
"The long time rating for x-ray equipment is based on an operating time of ____ minutes or longer.","[""five"",""eight"",""six"",""ten""]",0
"For circuits supplying loads consisting of motor operated utilization equipment that is fastened in place and that has a motor larger than 0.125 hp in combination with other loads, the total computed load shall be on ____ percent of the largest motor load plus the sum of the other loads.","[""100"",""125"",""150"",""130""]",1
"Exposed AC cable shall closely follow the ____ of the building.","[""finish"",""studs"",""both A and B"",""neither A and B""]",0
"A three- phase general purpose squirrel cage motor draws a full load current of 40 A. What id the maximum size of time delay fuses that may be used for short circuit protection?","[""120 A"",""80 A"",""40 A"",""100 A""]",1
"A 5.5 mm² TW copper has a conductor ampacity of ____.","[""30 A"",""40 A"",""20 A"",""50 A""]",0
"The branch circuit load for continuous duty receptacles shall be calculated at ____ VA per receptacle.","[""150"",""175"",""180"",""200""]",2
"Ground rod clamps shall be secured with at least ____ bolt(s) or cap screws","[""one"",""two"",""three"",""four""]",1
"Over current protection devices in emergency system shall _____.","[""be coordinated"",""clear in steps"",""not trip the main device"",""all of these""]",3
"The underground service conductors between the street main, including any risers at the pole or other structure or from transformer and the first point of connection to the service entrance of the conductors in a terminal box. The point of connection is considered to be the point of entrance of the service conductors into the building.","[""Service entry"",""Service raceway"",""Service lateral"",""Service drop""]",2
"Down conductors on a heavy duty smoke or vent stacks shall be protected from physical damage of NOT less than ____ above finish grade.","[""2,000 mm"",""2,300 mm"",""2,500 mm"",""2,400 mm""]",3
"The PEC permits ____ 90° bends in a single conduit run","[""one"",""two"",""three"",""four""]",3
"A warning sign shall be posted where ____ voltage is available in service equipment.","[""high"",""low"",""both A and B"",""neither A and B""]",0
"Circuits with a nominal voltage of 600 V or less in rigid metal or non-metallic conduit and placed under a minimum of 100 mm thick concrete exterior stab with no vehicular traffic shall have cover distance of ____.","[""200 mm"",""300 mm"",""400 mm"",""100 mm""]",3
"Conductors supplying a group of motor-generator arc welders are sized at ____of the third largest welder plus the percentage of the other welders.","[""65%"",""85%"",""70%"",""75%""]",1
"Which of the following statements on winding in commercial garages and shops is NOT correct?","[""The ground conductor shall be connected to the ground terminal of the utilization equipment"",""Receptacles, attachment plugs and similar devices shall be of the polarized type"",""Lamps and lamp holders for fixed lighting that are located above vehicles shall be installed not lower than 2,500 mm"",""Battery chargers and batteries being charged shall not be located in location classified as hazardous""]",2
"Conductors may travel horizontally through ____ sections of switchboards if isolated from busbars by a barrier.","[""horizontal"",""vertical"",""both A and B"",""neither A or B""]",1
"There shall be no more than ______ disconnects per service grouped in any location.","[""four"",""five"",""six"",""three""]",2
"When a circuit breaker handles are operated vertically rather than horizontally, the “up” position of the handle shall be the ___ position.","[""off"",""on"",""neutral"",""any of these""]",1
"AC equipment on board watercraft shall operate satisfactorily at the following voltage limitations. Which one is correct?","[""Minus 5% to plus 10%"",""Minus 6% to plus 10%"",""Minus 10% to plus 6%"",""Minus 10% to plus 10%""]",0
"Emergency power panel conductors supplying a building are tapped on ____.","[""The line side of the service"",""Any subfed panel"",""Any circuit breaker main"",""Any feeder circuit""]",0
"Where buildings exceed three stories or 15 meters in height, overhead lines shall be arranged, where practicable, so that a clear space of at least ____ wide will be left to facilitate title raising of ladders when necessary for fire fighting.","[""2,000 mm"",""1,800 mm"",""1,900 mm"",""1,500 mm""]",2
"For the purpose of lighting protection, a smoke or vent stack is classified as heavy duty if the cross sectional area of the flue is greater than ____ square meter and the height is greater than 23 meters.","[""0.50"",""0.32"",""0.42"",""0.27""]",1
"Voltage drop shall be considered to service laterals run at _____ distance.","[""short"",""long"",""both A and B"",""neither A and B""]",1
"Conductors used in lightning protection system shall have no bend forming an included angle of less than ______.","[""60\u00b0"",""75\u00b0"",""50\u00b0"",""90\u00b0""]",3
"Control conductors used for load management can be routed with the service entrance conductors in the same _______.","[""raceway"",""cable"",""either A or B"",""neither A or B""]",2
"A lighting fixture shall be wired with a flexible lighting cord with a cross sectional area of NOT less than a certain minimum area. Which is this?","[""0.75 mm<sup>2<\/sup>"",""0.50 mm<sup>2<\/sup>"",""2.00 mm<sup>2<\/sup>"",""1.25 mm<sup>2<\/sup>""]",0
"Service conductors shall not be run in such a manner as to block _____ to buildings.","[""openings"",""driveways"",""both A and B"",""neither A and B""]",0
"Continuous duty loads shall be figured at ____ percent for branch circuits.","[""100"",""115"",""120"",""125""]",3
"Enclosures for over-current devices in damp or wet locations shall be identified for use in such locations and shall be mounted so there is at least _____ air space between the enclosure and the wall.","[""10 mm"",""12 mm"",""15 mm"",""20 mm""]",0
"What type letter for conductors has a trade name “moisture and heat resistant rubber”?","[""RH"",""RHW"",""XHHW"",""THW""]",1
"Grounding conductor installed over lightning cables for the purpose of interconnecting the system ground electrodes and providing lightning protection for the cables.","[""Anchor"",""Counterpoise"",""Elevation rod"",""Air terminal""]",1
"The surge arrester for services less than 1,000 volts connected by copper conductor to grounding electrode conductor or the equivalent grounding terminal shall NOT be smaller than _____.","[""8.0 mm<sup>2<\/sup>"",""3.5 mm<sup>2<\/sup>"",""5.5 mm<sup>2<\/sup>"",""2.0 mm<sup>2<\/sup>""]",3
"The OCPD for arc welders with transformers shall NOT exceed _____ percent of the primary full load current.","[""200"",""300"",""250"",""400""]",0
"On circuits of less than 1000V, the rating of the surge arrester shall be ___ the maximum continuous phase to ground power frequency voltage available at the point of application.","[""equal to or greater than"",""not less than"",""not less than 125%"",""none of these""]",0
"The long time rating used to select OCPDs to protect circuits to x-ray equipment shall be _____.","[""125%"",""150%"",""175%"",""100%""]",3
"A 3.5 mm<sup>2</sup> TW copper conductor has an ampacity equal to ____.","[""20 A"",""15 A"",""30 A"",""12 A""]",0
"Which of the following statements on lighting fixtures NOT correct?","[""Outdoor lighting fixtures and associated equipment shall be permitted to be supported by trees"",""Metal fixtures and enclosures rated at 250 V and installed up in the ceiling shall be grounded."",""Stranded conductors shall be used in wiring a fixture supporting chain and other movable flexible parts."",""Fixtures and lighting equipment operating at over 250 V shall be grounded""]",3
"Conductors from the service point to the service disconnecting means are considered service____.","[""subpanels"",""conductors"",""both A and B"",""neither A and B""]",1
"Connection or fittings shall not connect grounding electrode conductors to equipment by means of _______.","[""solder"",""lugs"",""pressure connectors"",""clamps""]",0
"Each length of non-metallic conduit shall be clearly and durably marked at least every ______ as required.","[""3,000 mm"",""2,000 mm"",""4,000 mm"",""5,000 mm""]",0
"Doors leading into a transformer vault shall be kept locked and access allowed only to ______.","[""the owner"",""qualified person"",""general public"",""any person working in the building""]",1
"Resistors and reactors shall not be installed in close proximity to combustible materials such that it constitutes a fire hazard. What minimum clearance is required by the Code?","[""250 mm"",""300 mm"",""400 mm"",""100 mm""]",1
"The ground conductor shall be equal to the largest ____ conductor.","[""bonding"",""phase"",""ungrounded service"",""equipment""]",1
"Completely enclosed, ventilated transformers equipped with a 80C rise insulation may be installed in a room ____.","[""with concrete walls"",""designed as a vault"",""of fire resistant construction"",""built with tile blocks""]",2
"In a switchboard there shall be an air space of at least _____ between the energized metal part and the door or the cabinet.","[""30 mm"",""20 mm"",""15 mm"",""25 mm""]",3
"Electrical metallic tubing shall be securely fastened in place within ____ of each outlet box, junction box, cabinet or fitting.","[""300 mm"",""600 mm"",""900 mm"",""800 mm""]",2
"Lead-in antenna conductors for television or radio equipment shall be securely _____ to antennas.","[""attached"",""fastened"",""both A and B"",""neither A or B""]",2
"What is the metric size equivalent of 1,000 MCM?","[""250 mm<sup>2<\/sup>"",""500 mm<sup>2<\/sup>"",""750 mm<sup>2<\/sup>"",""1,000 mm<sup>2<\/sup>""]",2
"Antenna conductors for television equipment shall be installed so they will not ____ under open electric light or power conductors where possible.","[""parallel"",""cross"",""both A and B"",""neither A or B""]",1
"For churches, the general lighting load shall be computed at ____.","[""8 VA\/m<sup>2<\/sup>"",""16 VA\/m<sup>2<\/sup>"",""12 VA\/m<sup>2<\/sup>"",""24 VA\/m<sup>2<\/sup>""]",0
"Surface metallic raceway shall NOT be used where the voltage is ____ volts or more between conductors unless the metal has a thickness of not less than one mm.","[""300 mm"",""250 mm"",""150 mm"",""400 mm""]",0
"Electric discharge lighting shall be connected by flexible cord if the cord is visible for _____ percent of its entire length.","[""50"",""80"",""90"",""100""]",3
"What is the latest edition of the Philippine Electrical Code, Part 2?","[""1994"",""1990"",""1992"",""1988""]",3
"All circuit conductors between the service equipment or the generator switchboard of an isolate plant, and the final branch circuit over current device.","[""Service"",""Feeder"",""Branch Circuit"",""All of these""]",1
"A disruptive discharge through insulation.","[""Breakdown"",""Surge"",""Overload"",""Fault""]",0
"Insulators used to support wires under cross arms are","[""pin"",""spool"",""suspension"",""strain""]",2
"A pliable corrugated raceway of circular cross-section with integral or associated couplings, connectors and fittings for the installation of electric conductors.","[""Electrical metallic tubing"",""Rigid non-metallic conduit"",""Electrical non-metallic tubing"",""Rigid metal conduit""]",2
"The scope of the PEC covers all electrical conductors including optical fiber cable and equipment installed within or to or from any of the following premises, which one is NOT included?","[""Aircraft"",""Motor vehicles"",""Railway rolling stocks"",""All of these""]",3
"The maximum size of liquid tight flexible metal conduit shall be ____ trade size.","[""50 mm"",""125 mm"",""150 mm"",""100 mm""]",3
"Transformers that are installed in unsupervised locations and rated over 600 V are protected by fuses on the primary side cannot exceed ____ percent of the primary full load current.","[""150"",""300"",""200"",""250""]",1
"Each length of intermediate metal conduit shall be clearly and durably identified at ____ intervals with the letters “IMC”.","[""760 mm"",""600 mm"",""900 mm"",""1,000 mm""]",0
"What is the maximum rating of a molded case circuit breaker to protect a 10 hp squirrel cage induction motor rated at 230 volts, 3-phase, 60 Hz with a full load rating of 28 A?","[""30 A"",""50 A"",""70 A"",""100 A""]",2
"The sum of all contained conductors of an auxiliary gutter at any cross section shall NOT exceed ____ of the interior cross sectional area of the said gutter.","[""10%"",""15%"",""20%"",""25%""]",1
"Fluorescent lighting fixtures installed in _____ ceilings shall be attached to the framing of the ceiling by clips, screws, or rivets.","[""rocked"",""suspended"",""both A and B"",""neither A or B""]",1
"In rigid metal wiring conduit, conduits shall be supported at least every","[""2,000 mm"",""2,500 mm"",""3,500 mm"",""3,000 mm""]",3
"Direct burial cables or conductors with a nominal voltage of 600 V or less and passes under airport runways including adjacent areas where trespassing is prohibited, shall have a minimum cover distance of _____.","[""460 mm"",""500 mm"",""600 mm"",""300 mm""]",0
"If the voltage level is from 250 to 600 V, the air space between the wall, door or gutter partition of any cabinet shall be at least _____.","[""24 mm"",""22 mm"",""28 mm"",""26 mm""]",3
"For motors with a marked service factor not less than 1.15, the multiplying factor to be used in determining for size of overload protection shall be _____.","[""110%"",""115%"",""120%"",""125%""]",3
"For a motor starter to be in sight of the controlled motor, it must NOT be more than _____ meters away.","[""20"",""10"",""25"",""15""]",3
