question,choices,answer
"Before starting any installation work, alteration, repair or extension on any electrical system, what type of permit is needed?","[""Building permit"",""Working permit"",""Electrical Permit"",""Mayor\u2019s permit""]",2
"The Philippine Electrical Code (PEC) is intended for ______ applications by government bodies exercising legal jurisdiction over electrical installation.","[""Advisory"",""Optional"",""Mandatory"",""All of these""]",2
"Equipment for installation in hazardous locations must be tested and approved for use according to the classification of the hazards involved. These are divided into _____ groups.","[""4"",""3"",""7"",""6""]",1
"Individual branch circuits using type FCC (flat conductor cable) shall have ratings not exceeding ____.","[""20 A"",""30 A"",""15 A"",""40 A""]",1
"Which of the following conductors is applicable for underground service entrance conductors?","[""type THWN"",""type UF"",""type MI"",""type USE""]",3
"If there are three wires of 150 mm<sup>2</sup> connected to one terminal entering a cabinet or a switchboard, the bending space at each terminal shall NOT be less than ____, provided the conductors do not enter or leave the enclosure through the wall opposite its terminals.","[""200 mm"",""300 mm"",""400 mm"",""250 mm""]",3
"A clearance of not less than ____ shall be secured between bare current carrying metal parts and any metal surface of an auxiliary gutter.","[""26 mm"",""24 mm"",""13 mm"",""12 mm""]",0
"No box shall have an internal depth of less than ____.","[""15 mm"",""10 mm"",""12 mm"",""14 mm""]",2
"Which of the following electrical conductor has the highest resistance?","[""3.5 mm<sup>2<\/sup>"",""8.0 mm<sup>2<\/sup>"",""2.0 mm<sup>2<\/sup>"",""5.5 mm<sup>2<\/sup>""]",2
"A device or equipment which is suspended from overhead either by means of a flexible cord carrying the current, or otherwise.","[""Rosette"",""Pendant"",""Fixture"",""Air terminal""]",1
"In the schedule of loads for motor circuits, which of the following is NOT included?","[""Type of motor"",""Motor\u2019s manufacturer"",""Motor as numbered or identified in the power layout"",""Number of phase""]",1
"What is the allowable ampacity of THW insulated copper conductor with an area of 8.0 mm2 and exposed to an ambient temperature of 30°C?","[""45 A"",""20 A"",""30 A"",""60 A""]",0
"For the two conductors inside the conduit, the ampacity of the conductors shall be derated to what percent?","[""90%"",""80%"",""70%"",""none of these""]",3
"Electrical equipment may be best mounted on a concrete wall using one of the following. Which one of this?","[""Wooden plug"",""Expansion bolt"",""Load plug"",""Plastic plug""]",1
"What is the neutral load of a range that has a demand load of 10.4 kW?","[""7.28 kW"",""13 kW"",""13 kW"",""10.4 kW""]",0
"If the project is expensive and requires more time for checking and for computations of fees, the issuance of the electrical permit need to be issued immediately. However, the delay shall not be longer than how man y working days?","[""7"",""6"",""5"",""8""]",2
"Splices in ground conductors shall be as few as practicable and shall be attached so as to withstand a pull test of _____.","[""900 Newton"",""880 Newton"",""800 Newton"",""890 Newton""]",3
"Locations which are hazardous because of the presence of combustible dust.","[""Class I"",""Class II"",""Class III"",""Class IV""]",1
"For an ambient temperature of 30°C, a THW insulated copper conductor with a cross sectional area of 3.5 mm<sup>2</sup> and buried underground has the following ampacity. Which one is correct?","[""20 A"",""40 A"",""15 A"",""30 A""]",3
"All extended parts located within ______ of the lighting protection system shall be bonded thereto.","[""1,500 mm"",""1,600 mm"",""1,800 mm"",""2,000 mm""]",2
"Operation at substantially constant load for an indefinitely long time.","[""Periodic duty"",""Intermittent duty"",""Continuous duty"",""Short time duty""]",2
"Transformer exceeding 112.5 kVA, shall not be located within ____ from combustible materials of the building.","[""400 mm"",""300 mm"",""200 mm"",""500 mm""]",1
"Electrodes of iron or steel shall be at least _____ in thickness.","[""6.2 mm"",""5.8 mm"",""6.0 mm"",""6.4 mm""]",3
"The frame of the vehicle-mounted generator shall be permitted to serve as the grounding electrode for a system supplied by a generator located on the vehicle under which of the following conditions?","[""The vehicle of the generator is bonded to the vehicle frame"",""The generator supplies only equipment located on the vehicle"",""The non-current carrying metal parts of equipment and the equipment grounding conductor terminals of the receptacles are bonded to the generator frame."",""All of these.""]",3
"The minimum insulation level for the neutral conductors of a solidly grounded system shall be ______.","[""600 V"",""300 V"",""500 V"",""1,000 V""]",0
"The following copper conductors have the same cross sectional area but are made up of different number of strands. Which one has the least resistance to AC current?","[""19-strand conductor"",""Single solid conductor"",""7-strand conductor"",""37-strand conductor""]",1
"Advisory rules in the Code are characterized by the use of word ____.","[""will"",""would"",""shall"",""should""]",3
"A device capable to drawing lightning discharge to it in preference to vulnerable parts of the protected area.","[""Ground terminal"",""Lightning trap"",""Ground mat"",""Air terminal""]",3
"Conductors normally used to carry current shall be of ______ unless otherwise provided in the PEC.","[""aluminum"",""copper"",""copper clad aluminum"",""all of these""]",1
"Light fixtures suspended from the ceiling by chains should be wired so that the","[""chain is grounded"",""wires help support the fixture"",""wires will not touch the chains"",""wires do not support the fixture""]",3
"An appliance, which is fastened or otherwise, secured at a specific location.","[""Permanent appliance"",""Stationary appliance"",""Portable appliance"",""Fixed appliance""]",3
"Which one is a standard rating of an inverse time CB?","[""140 A"",""130 A"",""120 A"",""110 A""]",3
"Aerial cable under non-metallic extensions shall have a clearance of not less than ____ from steel structure members or other conductive materials.","[""60 mm"",""30 mm"",""50 mm"",""40 mm""]",2
"Above ground tanks containing liquids at atmospheric pressure are considered to be protected against lightning if the following requirements are meet. Which one is NOT included?","[""The metal roof shall have a minimum thickness of 4.8 mm"",""The roof shall be welded, bolted or riveted to the shell"",""All pipes entering the tank shall be metallically connected to the tank at the point of entrance"",""None of these""]",3
"According to the Republic Act No. 184, a licensed Master Electrician may operate and tend generator rated up to a certain voltage. What is the voltage?","[""440 V"",""750 V"",""220 V"",""460 V""]",1
"A heavy duty lamp holder shall have a rating no less than ______.","[""450 W"",""500 W"",""600 W"",""660 W""]",3
"In rigid metal conduit wiring, conduits shall be supported at least every","[""2,500 mm"",""3,500 mm"",""3,000 mm"",""2,000 mm""]",2
"Conductors used in open wiring method within ______ from the floor shall be considered exposed to physical damage.","[""3,000 mm"",""2,500 mm"",""2,000 mm"",""1,800 mm""]",2
"Heating elements of cables shall be separated at least ____ from the edge of outlet boxes and junction boxes.","[""200 mm"",""100 mm"",""150 mm"",""300 mm""]",0
"Auxiliary gutters shall not contain more than ____ current carrying conductors at any cross section.","[""38"",""32"",""30"",""24""]",2
"Circuits rated from 201 to 400 A requires a minimum insulation resistance of","[""25,000 ohms"",""50,000 ohms"",""100,000 ohms"",""12,500 ohms""]",0
"No over-current device shall be connected in series with any conductor that is","[""stranded"",""current carrying"",""closed"",""intentionally grounded""]",3
"Which of the following size of single-phase transformer is NOT standard?","[""30 kVA"",""37 \u00bd kVA"",""75 kVA"",""20 kVA""]",0
"For the purpose of lightning protection, a high rise building is a building with a height over ____.","[""23 m"",""50 m"",""20 m"",""15 m""]",0
"Branch circuits are classified according to the maximum ______.","[""voltage across it"",""load being served"",""power consumed"",""setting off the over-current device""]",3
"Cable tray shall NOT be used in","[""hoistways"",""dry locations"",""industrial establishment"",""all of these""]",0
"What type of electrical conductors has a trade name “moisture resistant thermoplastic“?","[""TW"",""THW"",""THWN"",""All of these""]",0
"A device used for the purpose of minimizing irregularities in the flow of welding currents.","[""Rheostat box"",""Grounding transformer"",""Reactor"",""None of these""]",2
"For all land-based electrical installation under the scope of the Philippine Electrical Code, where should an electrical permit be filed?","[""Department of Energy"",""Office of the City\/Provincial Engineer"",""Office of the Mayor"",""Local Building Office""]",3
"Rigid non-metallic conduit approved for direct burial without concrete encasement shall have a minimum burial of _____.","[""500 mm"",""400 mm"",""460 mm"",""440 mm""]",2
"All metal parts associated with the hot tub shall be bonded using copper bonding jumper, insulated, covered, or bare, not smaller than _____.","[""5.5 mm<sup>2<\/sup>"",""8.0 mm<sup>2<\/sup>"",""14.0 mm<sup>2<\/sup>"",""3.5 mm<sup>2<\/sup>""]",1
"All lighting fixtures, submersible pumps and other submersible equipment used in fountains shall operate at _____ or less between conductors.","[""230 V"",""300 V"",""250 V"",""500 V""]",2
"The ground counterpoise when installed in earth shall be placed _____ above all cable in a trench.","[""75 mm"",""100 mm"",""80 mm"",""50 mm""]",0
"Type FCC cable shall NOT be used in any of the following EXCEPT","[""outdoors"",""indoors"",""wet locations"",""hazardous locations""]",1
"The ampacity of the conductors and the rating or setting of over-current devices in a circuit of a solar photovoltaic system shall NOT be less than _____ of the computed current.","[""100 %"",""115 %"",""125%"",""130%""]",2
"For signalling circuits NOT exceeding _____ volts, the current required shall not exceed one ampere.","[""24"",""12"",""30"",""40""]",0
"The grounding electrode shall be _____.","[""the nearest available effectively grounded structural metal member of the structure"",""the nearest available effectively grounded metal water pipe"",""the nearest concrete encased electrode"",""any of these""]",3
"Non-metallic boxes not over _____ cu. cm shall be permitted only on non-metallic wiring method.","[""1,725"",""1,520"",""1,700"",""1,640""]",3
"The equipment bonding jumper (the connection between the equipment grounding conductor and the grounding impedance) shall be _____.","[""an unspliced conductor run"",""a spliced conductor run"",""either A or B"",""neither A or B""]",0
"According to its make, conduits maybe classified as","[""rigid metal"",""rigid non-metal"",""flexible metal"",""all of these""]",3
"In no case shall the grounding conductor be smaller than _____ copper.","[""5.5 mm\u00b2"",""8.0 mm\u00b2"",""3.5 mm<sup>2<\/sup>"",""2.0 mm<sup>2<\/sup>""]",1
"Hazardous location in which flammable gases or vapors are present in the air in quantities sufficient to produce explosives or ignitable mixtures.","[""Class IV"",""Class III"",""Class II"",""Class I""]",3
"The system neutral conductor shall NOT be connected to ground, EXCEPT through the neutral ____.","[""grounding impedance"",""grounding electrode"",""grounding transformer"",""derived from other system""]",0
"In damp or wet locations, cabinets and cutout boxes of the surface type shall be mounted with at least _____ air space between the enclosures and the wall.","[""6.0 mm"",""6.4 mm"",""7.0 mm"",""7.5 mm""]",1
"The minimum diameter of a solid air terminal under class I material requirements shall be ____ for copper ____ for aluminum.","[""9.5 mm, 12.7 mm"",""12.7 mm, 9.5 mm"",""8.0 mm, 12.5 mm"",""12.5 mm, 8.0 mm""]",0
"Circuits with a nominal voltage of 600V or less in a rigid metal conduit or intermediate metal conduit and placed in a trench below a 50 mm thick concrete or equivalent shall maintain a minimum cover distance of______.","[""150 mm"",""250 mm"",""460 mm"",""300 mm""]",0
"Vertical clearances of all service drop conductors above roofs shall NOT be less than one of the following values.","[""2000 mm"",""2750 mm"",""3000 mm"",""2500 mm""]",3
"The lighting or conductor ground terminal shall extend vertically NOT less than ______ into the earth.","[""2000 mm"",""3000 mm"",""4000 mm"",""2500 mm""]",1
"The circuit supplying an auto-transformer type dimmer shall NOT exceed ______ the between conductors.","[""240 V"",""250 V"",""230 V"",""200 V""]",2
"A spark occurring between nearby metallic objects or from such objects to the lighting protection system or to ground.","[""Flashover"",""Side flash"",""Spark over"",""Discharge""]",1
"Covers for boxes shall be permanently marked. The marking shall be on the outside of the box using the block type letters at least ______ in height.","[""10 mm"",""12 mm"",""15 mm"",""20 mm""]",1
"When wiring a raceway at least a certain length of free conductors shall be left at each outlet. What is the minimum length?","[""75 mm"",""100 mm"",""150 mm"",""200 mm""]",2
"Where a rigid metal conduit is used, there shall NOT be more than the equivalent of ____ quarter bends between pull points.","[""three"",""four"",""five"",""two""]",1
"There shall be at least _____ down conductor(s) on a heavy-duty smoke or vent stacks.","[""one"",""two"",""three"",""four""]",1
"If the setting of the over current device in a circuit ahead of the equipment is 60A, the minimum equipment grounding conductor using copper shall be _____.","[""5.5 mm\u00b2"",""3.5 mm\u00b2"",""2.0 mm<sup>2<\/sup>"",""8.0 mm\u00b2""]",0
"An exposed wiring support system using a messenger wire to support insulated conductors.","[""Metal clad cable wiring"",""Concealed knob and tube wiring"",""Messenger cable wiring"",""Messenger supported wiring""]",3
"Air terminal shall be within ____ of outermost projection of roof edge.","[""700 mm"",""760 mm"",""800 mm"",""600 mm""]",3
"In replacing a busted fuse which of the following is important?","[""same size and type"",""same size but different rating"",""same type but different rating"",""different size and type""]",0
"Which of the following wires has 75-ohm impedance?","[""Foam-filled twin lead"",""Coaxial"",""Flat twin lead"",""None of these""]",1
"Rigid metal conduit shall ship in standard lengths of ____.","[""3000 mm"",""6000 mm"",""4000 mm"",""5000 mm""]",0
"The term given to an insulated standard wire","[""Durability"",""Cord"",""Length"",""Volume""]",1
"Exposed non-current carrying metal parts of fixed equipment likely to become energized shall be grounded under the following conditions. Which one is NOT included?","[""where located in wet or damp locations"",""where in electrical contact with wooden floor"",""where in a classified hazardous locations"",""where supplied with a metal raceway or other wiring methods""]",1
"Electrical equipment except x-ray tube inside anesthetizing room shall be located at least ____ above the floor.","[""2000 mm"",""2500 mm"",""2400 mm"",""2300 mm""]",2
"Where the distance requirement in making holes cannot be maintained, the cable or raceway shall be protected from penetration by screws or nails by a steel plate or bushing at least ____ thick and of approved length and a width to cover the area of the wiring.","[""2.0 mm"",""1.5 mm"",""1.8 mm"",""1.6 mm""]",3
"The entire area of the aircraft hangar, including any adjacent communication areas not suitably cut-off from the hangar shall be classified as hazardous up to a level of ____ above the floor.","[""400 mm"",""460 mm"",""500 mm"",""480 mm""]",1
"In which method of starting a motor is the starting current a minimum?","[""star-delta"",""starter-rotor starter"",""direct on line"",""autotransformer""]",0
"All switches and circuit breakers used as switches shall be so installed that the center of the grip of the operating handle when in its highest position shall NOT be more than ____ above the floor or working flat form.","[""2000 mm"",""1800 mm"",""1500 mm"",""2100 mm""]",0
"For straight pulls, the length of the pull box shall NOT be less than ____ times the outside diameter of the largest non-shielded conductor or cable.","[""42"",""48"",""32"",""30""]",2
"Aluminum electrode ____ permitted to be used.","[""shall not be"",""shall be"",""either A or B"",""neither A or B""]",0
"Electrical non-metallic tubing shall be clearly and durably marked at least every","[""2000 mm"",""1000 mm"",""3000 mm"",""1500 mm""]",2
"Which of the following sizes of fuse NOT standard?","[""80 A"",""45 A"",""125 A"",""75 A""]",3
"The Philippine Electrical Code, Part 1 does not cover wiring of equipment installed within or to or from one of the following. Which one is this?","[""Trailers"",""Mobile homes"",""Water crafts"",""Airplanes""]",3
"The smallest electrical trade size of intermediate metal conduit.","[""15 mm"",""20 mm"",""12 mm"",""25 mm""]",0
"The use of electrical metallic tubing shall be permitted for_____.","[""exposed works C. both A and B"",""concealed works"",""both A and B"",""neither A or B""]",2
"The zone of protection of an overhead ground wire is conventionally taken as a","[""cone"",""cylinder"",""triangular prism"",""all of these""]",2
"The minimum spacing between bare metal parts of opposite polarity where mounted on the same surface shall be ____ for voltages rated not over 250V nominal.","[""26 mm"",""32 mm"",""30 mm"",""28 mm""]",1
"The maximum electrical trade size of flexible metallic tubing shall be ____.","[""15 mm"",""20 mm"",""32 mm"",""100 mm""]",1
"A protected device for limiting surge voltage by discharging or by passing surge current.","[""Arrester"",""Circuit breaker"",""Lighting rod"",""Thermocouple""]",0
"Plug fuses and fuse holders shall NOT be installed or such in circuit’s exceeding ____ between conductors.","[""200 V"",""250 V"",""230 V"",""150 V""]",1
"The standard length of rigid metal conduit is","[""30 feet"",""10 feet"",""8 feet"",""20 feet""]",1
"For warehouse, the feeder demand load for the general lighting and small appliance load for the first 12,500VA or less is 100%, while the remainder over 12,500VA is charged at ____.","[""40%"",""60%"",""70%"",""50%""]",2
"Liquid tight flexible non-metallic conduit shall NOT be used in lengths longer than","[""1,500 mm"",""1,800 mm"",""2,000 mm"",""2,500 mm""]",1
"Line and ground connecting conductors to surge arresters shall NOT be smaller than ______ copper or ______ aluminum.","[""2.0 mm\u00b2, 2.0 mm\u00b2"",""3.5 mm\u00b2, 2.0 mm\u00b2"",""3.5 mm<sup>2<\/sup>, 3.5 mm<sup>2<\/sup>"",""2.0 mm\u00b2, 3.5 mm\u00b2""]",3
"Electrical metallic tubing shall be securely fastened in place at least every______.","[""2,000 mm"",""1,800 mm"",""3,000 mm"",""1,500 mm""]",2
"For the purpose of lighting protection, class I ordinary building is one that is at less than_____ in height.","[""20 m"",""22 m"",""24 m"",""23 m""]",3
"For dwelling units, the demand factor for the first 3000 voltamperes of load is","[""95%"",""85%"",""100%"",""80%""]",2
"Ventilating pipes for motors, generators or other rotating electric machinery or for enclosures for electric equipment shall be of metal NOT less than _____ in thickness.","[""0.50 mm"",""0.45 mm"",""0.40 mm"",""0.60 mm""]",0
"Direct burial cables or conductors with nominal voltage of 600V or less and passes under streets, hi-way, roads, alleys, driveways and parking lots shall have a minimum cover distance of ____.","[""500 mm"",""600 mm"",""460 mm"",""550 mm""]",1
"A factor assembly of parallel conductors formed integrally with an insulating _____ material web specifically designed for field installation in metal surface raceway.","[""type FC"",""type MI"",""type TC"",""type FCC""]",0
"Snap switches shall not be grouped or ganged in enclosures unless they can be so arranged that the voltage between adjacent switches does not exceed ____.","[""250 V"",""300 V"",""150 V"",""100 V""]",1
"Wiring located above heated ceilings shall be spaced not less than ____ above the heated ceiling and shall be considered as operating at an ambient of 50°C.","[""100 mm"",""50 mm"",""75 mm"",""40 mm""]",1
"Are rectangular sheet metal enclosures equipped with removable covers providing access to conductors inside","[""Metal clad cable"",""Multiple cable conductors"",""Busways"",""Wireways""]",3
"Each unit length of heating cable shall have a permanent legible marking of each non-heating lead located within ____ of the terminal end.","[""75 mm"",""70 mm"",""80 mm"",""85 mm""]",0
"Metal faceplates of receptacles shall be of ferrous metal not less than ____ in thickness or of non-ferrous metal not less than ____ in thickness.","[""0.76 mm, 1.0 mm"",""0.76 mm, 1.2 mm"",""0.64 mm, 1.0 mm"",""0.64 mm, 1.2 mm""]",0
"Surface mounted incandescent fixture shall be permitted to be installed in clothes closets provided there is a minimum clearance of _____ between the fixture and the nearest point of the storage area.","[""150 mm"",""200 mm"",""250 mm"",""300 mm""]",3
"Thermal insulation shall not be installed within _____ of the recessed fixture enclosure.","[""40 mm"",""35 mm"",""38 mm"",""42 mm""]",2
"Lighting track load shall NOT be installed where less than _____ above the finished floor EXCEPT where protected from physical damage.","[""1,800 mm"",""1,500 mm"",""2,000 mm"",""1,000 mm""]",1
"Where circuit breakers are used to protect the primary side of a transformer over 600 V nominal, their continuous current rating shall NOT exceed _____ of the rated primary current.","[""250%"",""300%"",""175%"",""200%""]",1
"The lowest standard size of disconnect is ______.","[""20 A"",""30 A"",""60 A"",""15 A""]",1
"The primary winding of the step down transformer shall be protected on the primary side by an overcurrent device rated NOT more than a certain percentage of the primary current. Which is this percentage?","[""110%"",""125%"",""80%"",""150%""]",1
"For a two wire FCC cable system with grounding, the grounding conductor shall be _____ conductor.","[""the middle"",""the rightmost"",""the rightmost"",""any of these""]",0
"Where passing through wood cross members in plastered partitions, conductors in concealed knob and tube wiring shall be protected by insulating tubes extending NOT less than _____ beyond the wood member.","[""80 mm"",""70 mm"",""76 mm"",""64 mm""]",2
"Branch circuit conductors supplying a single motor shall have an ampacity NOT less than _____ percent of the motor full load current rating.","[""115"",""120"",""125"",""130""]",2
"In indoor wet locations, the entire wiring system including all boxes, fittings, control boards and panelboards shall be installed on walls with a minimum clearance. What is the clearance?","[""10 mm"",""5 mm"",""20 mm"",""15 mm""]",0
"Type NM cable shall NOT be installed ______.","[""where exposed to corrosive material"",""where embedded in concrete"",""in a shallow chase in masonry, concrete or adobe"",""all of these""]",3
"Dry type transformers installed indoors and rated 112.5 kVA or less shall have a separation of at least ____ from combustible material.","[""500 mm"",""400 mm"",""300 mm"",""200 mm""]",2
"A factory assembly of two or more insulated conductors in an extruded core of moisture resistant, flame retardant, non-metallic material covered with an overlapping spiral metal tape and wire shield and sunlight resistant nonmetallic material.","[""type SNM cable"",""type NM cable"",""type SE cable"",""type AC cable""]",0
"To cut rigid metal conduits, an electrician should do one of the following. Which one is this?","[""Order it cut to size from the supplier"",""Use a three-wheel pipe cutter"",""Use a cold chisel and ream the ends"",""Use a hack saw and ream the ends""]",3
"Where the overload relay selected using the factor 125 % is not sufficient to start the motor or to carry the load, the multiplying factor shall be increased but shall NOT exceed _____ percent.","[""130"",""140"",""150"",""125""]",1
"Where the protection of a motor-compressor load is not sufficient for the start current of the motor, the rating or setting shall be increased but not more than ____ of its rated load current.","[""200%"",""225%"",""250%"",""275%""]",1
"An insulator designed to electrically insulate the end of a type FCC cable.","[""Spool insulator"",""Bonding insulator"",""Insulating end"",""Cable connector""]",2
"Consists of three or more flat copper conductor placed edge to edge separated and enclosed within an insulating assembly","[""Armored cable"",""Flat cable assemblies"",""Sheathed cable"",""Flat conductor cable""]",3
"Lampholders installed in wet or damp locations shall be of the ____ type.","[""heavy-duty"",""waterproof"",""weatherproof"",""all of these""]",2
"The single phase conductors supplying the less phase than converter shall have an ampacity NOT ____times the full current rating of the motor or load being served.","[""2.50"",""1.25"",""2.16"",""1.75""]",2
"An assembly of the two insulated conductors within a nonmetallic jacket or an extruded thermoplastic covering.","[""Shielded non-metallic sheathed cable"",""Non-metallic sheathed cable"",""Non-metallic extension"",""None of these""]",2
"Dry type transformers rated over ____ volts, shall be installed in vaults.","[""25,000"",""10,000"",""35,000"",""50,000""]",2
"In walls or ceilings of concrete tile, or other noncombustible materials, boxes and fittings shall be installed that the front edge of the box or fitting will NOT set back of the finished surface more than_____.","[""5.0 mm"",""6.4 mm"",""6.2 mm"",""7.6 mm""]",1
