question,choices,answer
"Pipelines with impedance heating shall NOT operate at greater than _____ AC.","[""30 V"",""24 V"",""50 V"",""100 V""]",0
"The area within _____ horizontally from an aircraft power plant shall be classified hazardous under Class I, Division 2 Location.","[""1,200 mm"",""1,500 mm"",""1,800 mm"",""2,000 mm""]",1
"Fixture chains shall be wired with ____ wire from the outlet box connections to the sockets of the fixture .","[""solid"",""stranded"",""either A or B"",""neither A or B""]",1
"Metal faceplates for flush mounted snap switches shall be of ferrous metal NOT less than _____ in thickness.","[""0.6 mm"",""0.7 mm"",""0.8 mm"",""0.9 mm""]",2
"Flexible metallic tubing smaller than _____ electrical trade size shall NOT be used.","[""20 mm"",""15 mm"",""12 mm"",""32 mm""]",1
"The sum of the cross sectional areas of all contained conductors at any cross section of the wireway shall NOT exceed _____ percent of the interior cross sectional area of the wireway.","[""30"",""40"",""50"",""20""]",2
"Where nails or screws are likely to penetrate non-metallic sheathed cable or electrical non- metal tubing, a steel sleeve or steel clip NOT less than _____ in thickness shall be used to protect the cable or tubing.","[""1.6 mm"",""1.5 mm"",""2.0 mm"",""1.8 mm""]",0
"An auxiliary gutter shall NOT extend a greater distance than _____ beyond the equipment, which it supplements.","[""8,500 mm"",""8,900 mm"",""9,100 mm"",""none of these""]",2
"A clearance of NOT less than ____ shall be provided from recessed fixtures and their trims, ventilating openings and other such openings in room surfaces.","[""100 mm"",""70 mm"",""50 mm"",""30 mm""]",2
"Storage batteries in solar photovoltaic systems for dwellings shall have cells operating at less than _____.","[""50 V"",""30 V"",""24 V"",""12 V""]",0
"The minimum spacing between the bottom of enclosure and the insulated busbars, their supports and other obstructions shall be _____.","[""200 mm"",""210 mm"",""215 mm"",""205 mm""]",3
"Consist of a group of wire twisted to form a metallic string.","[""Duplex wire"",""Loomex wire"",""Solid wire"",""Stranded wire""]",3
"Service drop conductors passing through sidewalk accessible only to pedestrians where the voltage is limited to 300 V to ground shall maintain a vertical clearance of NOT less than _____ at the electric service entrance to buildings.","[""3,700 mm"",""3,100 mm"",""4,600 mm"",""5,500 mm""]",1
"Secondaries of transformers supplying voltage for impedance heating of vessels are computed at NOT less than _____ percent of the heating load.","[""150"",""100"",""125"",""130""]",1
"The ampacity of supply branch circuit conductors supplying diagnostic equipment and the current rating of the overcurrent protective devices shall NOT be less than _____ percent of the momentary rating or _____ percent of the long time rating which ever is larger.","[""50, 100"",""60, 125"",""60, 100"",""50, 125""]",0
"In dwelling units and guestrooms of hotels, motels and similar occupancies, the voltage shall NOT exceed _____ volts nominal between conductors that supply the terminals of medium base screw shell lamp holders.","[""250"",""230"",""300"",""150""]",0
"The grounding electrode for grounding communications systems may be connected to the nearest accessible location on any of the following EXCEPT one. Which on is this?","[""Buried interior PVC water piping system"",""Grounding electrode conductor"",""Building structure of a concrete building"",""Grounding terminal of service equipment if provided by the utility company""]",0
"Transformers used to step down voltage for general use are classified as _____ systems.","[""separately derived"",""classified"",""direct"",""emergency""]",0
"For a portable motor rated at _____ horsepower or less, the controller shall be permitted to be an attachment plug and receptacle.","[""0.25"",""0.33"",""0.125"",""none of these""]",1
"Hazardous locations in which combustible dust is in the air under normal operating conditions in quantities sufficient to produce explosive or ignitable mixtures.","[""Class II, Division 1"",""Class II, Division 2"",""Class III, Division 1"",""Class III, Division 2""]",0
"A fixture requiring supply wire rated higher than 90°C shall be so marked in letters _____ high prominently displayed on the fixture.","[""6.0 mm"",""10 mm"",""6.4 mm"",""8.4 mm""]",2
"Rosettes for exposed wiring shall be provided with bases that shall be high enough to keep the wires and terminals at least _____ from the surface wired over.","[""10 mm"",""12 mm"",""13 mm"",""15 mm""]",2
"Branch lighting circuits shall be protected by over-current devices not rated more than _____.","[""40 A"",""20 A"",""30 A"",""50 A""]",1
"Solar photovoltaic systems in a one- family dwelling units with circuits rated over _____ to ground while energized shall NOT be accessible to other than qualified persons.","[""50 V"",""150 V"",""100 V"",""none of these""]",1
"Where liquidtight flexible metal conduit is installed as a fixed raceway, it shall be secured at intervals NOT exceeding _____.","[""1,500 mm"",""1,250 mm"",""1,400 mm"",""1,300 mm""]",3
"An approved assembly of insulted conductors with fittings and conductor terminations in a completely enclosed ventilated protective metal housing.","[""Cable tray"",""Cablebus"",""Gutter"",""Busway""]",1
"The inner strand of ACSR is made of","[""Brass"",""Steel"",""Copper"",""Lead""]",1
"The continuous load supplied by a branch circuit shall NOT exceed the branch circuit rating by more than _____ percent.","[""50"",""60"",""80"",""90""]",2
"A cable provided with a wrapping or metal usually steel wires or tapes, primarily for the purpose of mechanical protection.","[""metal clad cable"",""metallic sheathed cable"",""armored cable"",""flat conductor cable""]",2
"In all cases where there are energized parts on the front of the switch boards or motor control centers, the working space in front of such equipment shall NOT be less than minimum distance. What is this distance?","[""2,000 mm"",""500 mm"",""1,500 mm"",""1,000 mm""]",3
"Border lights shall be installed around stages in theaters on circuits rated at _____ less.","[""20 A"",""15 A"",""30 A"",""10 A""]",0
"Wirings allowed to be installed outside buildings are enumerated below EXCEPT one. Which one is this?","[""type MC cable"",""flat conductor cable"",""rigid metal conduit"",""open wires on insulators""]",1
"Conductors supplying a heating unit shall be calculated at ____ percent times the heating load plus the blower motor.","[""110"",""100"",""130"",""125""]",3
"Masts separate from the structure to be protected shall be a minimum of _____ from the protected structure.","[""1,800 mm"",""2,000 mm"",""1,900 mm"",""1,500 mm""]",0
"Lighting track conductors shall be a minimum of _____ or equal and shall be copper.","[""2.0 mm<sup>2<\/sup>"",""5.5 mm<sup>2<\/sup>"",""1.25 mm<sup>2<\/sup>"",""3.5 mm<sup>2<\/sup>""]",3
"The walls and roofs of transformer vaults shall be constructed of materials that have adequate structural strength for the condition with a minimum fire resistance of _____ hours.","[""1.5"",""2.0"",""2.5"",""3.0""]",3
"In order to protect a personnel and prevent shock, the equipment should be connected good earth ground through the","[""conduit pipe"",""hot water pipe"",""cold water pipe"",""rigid conduit pipe""]",2
"When computing the service load with the standard method, more than three fixed appliances are computed with a demand factor of _____ of the nameplate rating.","[""80%"",""65%"",""70%"",""75%""]",3
"When computing the service load with the standard method, a 2 kW electric space heating unit is computed at _____ percent.","[""80"",""100"",""90"",""125""]",1
"Where knobs are used, conductors shall be securely tied there to by _____ wires having insulation equivalent to that of the conductors.","[""tie"",""bonding"",""guy"",""splicing""]",0
"A photovoltaic power source having one conductor of a 2-wire system over _____ volts shall be solidly grounded.","[""100"",""150"",""50"",""200""]",1
"The Code requires that all energized part of electrical equipment operating at _____ or more shall be guarded against accidental contacts by approved enclosures. What is this voltage?","[""24 volts"",""110 volts"",""230 volts"",""50 volts""]",3
"What is the minimum size of the aluminum or copper clad aluminum conductors, used as service entrance conductors?","[""8.0 mm<sup>2<\/sup>"",""5.5 mm<sup>2<\/sup>"",""14.0 mm<sup>2<\/sup>"",""3.5 mm<sup>2<\/sup>""]",0
"When removing insulation from the wire before making the splice, care should be taken to avoid nicking the wire (slightly cutting the wire) because of one of the following. Which one of this?","[""the wire might break"",""the ampacity will be reduced"",""the wire tinning (protective coating) will be injured"",""the resistance will increase""]",0
"The unit lighting for a dwelling unit expressed in watts per square meter shall be","[""8 watts"",""40 watts"",""24 watts"",""16 watts""]",2
"Wires and cables used in dry and wet locations for over 2000 volts insulation and ozone resistant with moisture and heat resistance rubber and has a maximum operating temperature of 90°C is _____ type.","[""MI"",""RHW"",""THW"",""THHN""]",0
"In dwelling units, when the actual number of receptacle outlet is not known, an additional load of ____ volt-ampere per square meter shall be included.","[""10"",""4"",""8"",""6""]",2
"Conductors of AC and DC rated up to 600 V nominal shall be permitted to occupy the same equipment wiring enclosure, cable tray or raceway (pipes). Is this being allowed under Section 5.1.1.3 (c) (1) Art 5.1?","[""Installation is correct"",""False"",""True"",""Acceptable""]",2
"The point of attachment of the service drop conductors to a building or other structure shall NOT be less than ____ above finished grade.","[""3100 mm"",""2800 mm"",""3000 mm"",""3500 mm""]",0
"Which type of temperature detector is used in motor windings?","[""Capacitance"",""Resistance"",""Inductance"",""Reluctance""]",1
"If there will be 6 or more 2- wire branch circuits for a one family dwelling unit, how much is the minimum service entrance capacity required?","[""60 A"",""100 A"",""90 A"",""120 A""]",1
"Determine the minimum appliance and laundry load required for a dwelling unit.","[""4000 volt-amperes"",""1500 volt-amperes"",""3000 volt-amperes"",""2000 volt-amperes""]",2
"Underground communication conductors in a raceway, handhole or manhole containing electric light and power conductors, shall be in a section ____ from such conductors by means of a separator (brick, concrete or tile) under Art 10.1.3.2 (a).","[""combined"",""separated"",""included"",""inside""]",2
"Which of the raceway methods is NOT allowed to be used in a hazardous location?","[""Rigid metal conduit"",""Liquid-tight flexible metal conduit"",""Rigid non-metallic conduit"",""None of these""]",2
"Where raceways are exposed to widely different temperatures they shall be _____.","[""grounded"",""sealed"",""isolated"",""bonded""]",1
"Art 1. 10.2 of PEC 1 requires working spaces for equipment operating 600 V, nominal or less to ground. This is required for live parts on the other side, like concrete, brick or tile walls and shall be considered as grounded. What is this minimum distance for Condition 2?","[""1300 mm"",""1400 mm"",""1200 mm"",""1100 mm""]",3
"Where galvanized steel conduit is used, the primary purpose of the galvanizing is to","[""retard rusting"",""provide good electrical contact for grounding"",""increase mechanical strength"",""provide a good surface foe painting""]",0
"A protective device for assembly as an integral part of a motor or motor compressor and which when properly applied, protects the motor against dangerous overheating due to overload and failure to start.","[""Fault current"",""Ground fault"",""Thermal heat"",""Thermal protector""]",3
"Underfloor raceways may be occupied up to _______ percent of the area.","[""55"",""38"",""40"",""30""]",2
"This type of loads will NOT require Electrical Permits nor Certificate of Inspection. Which one is this?","[""Fixed water heater"",""Fixed electric range"",""Window type room air-conditioner"",""Potable appliances rated not more than 1200 volt-amperes""]",3
"The electrical drawing of single family shall show the following. EXCEPT one","[""Floor plan"",""Computation of illumination"",""Local Plan"",""One-line diagram""]",1
"Where extensive metal in or on buildings may become energizer and is subject to personal contact ____ will provide additional safety.","[""Bonding"",""Suitable ground detectors"",""Suitable arresters"",""Adequate bonding and grounding""]",3
"The computed load for the branch circuit installed to supply exterior signs and outline lighting shall be computed at a minimum of ______ volt-amperes.","[""1,200"",""1,500"",""1,800"",""1,000""]",0
"Non-metallic boxes shall be permitted only with ______.","[""concealed knob and tube wiring"",""non-metallic sheathed cable"",""open wiring on insulators"",""all of these""]",3
"A building or other structure serve shall be supplied by only one service drop EXCEPT for","[""multiple occupancy building"",""fire pumps"",""emergency electrical system"",""all of these""]",3
"Air terminals exceeding 600 mm in height shall be supported at a point NOT less ______ of its height.","[""three-fourths"",""two-fifth"",""one-half"",""one-third""]",2
"This type of cable is a fabricated assembly of insulated conductors enclosed in a flexible metal sheath.","[""Ground wire"",""Integrated gas spacer cable"",""Medium voltage cable"",""Armored cable""]",3
"The following are common splicing rules EXPECT one. Which one is this?","[""A splice must provide a path for the current to pass through"",""A joint must be mechanically as strong as the wire itself"",""All splices must be mechanically and electrically secured by means of solder"",""Wires of the same should be spliced together in line""]",3
"Service entrance cables shall be supported by straps or other approved means within _______ of every service head","[""300 mm"",""500 mm"",""600 mm"",""400 mm""]",0
"A point in a wiring system at which current is taken to be used in some equipment","[""Grounded"",""Conductor"",""Service entrance"",""Outlet""]",3
"The clearance from the top of a switchboard to a ceiling which is combustible shall NOT be less than_________.","[""1,000 mm"",""800 mm"",""900 mm"",""1,250 mm""]",0
"In concealed knob and tube wiring, the clearance to be maintained between conductors is","[""55 mm"",""45 mm"",""76 mm"",""50 mm""]",2
"What is the total number of mechanical degrees that a PVC conduit run maybe bent between pull points (pull boxes, junction boxes or utility boxes)?","[""360 degrees"",""180 degrees"",""120 degrees"",""270 degrees""]",0
"The sum of the cross sectional area of all conductors in a wireway must not exceed ____ percent of the cross-sectional area of the wireway.","[""15"",""20"",""10"",""25""]",1
"A lighting fixture shall be wired with a flexible lighting cord with a cross section area of NOT less","[""0.75 mm<sup>2<\/sup>"",""2.00 mm<sup>2<\/sup>"",""0.50 mm<sup>2<\/sup>"",""1.25 mm<sup>2<\/sup>""]",0
"Flexible metal conduits must not be used in","[""wet locations"",""hoistways"",""storage battery rooms"",""all of these""]",3
"What is the maximum operating temperature of type THWN conductor?","[""75\u00b0C"",""60\u00b0C"",""90\u00b0C"",""110\u00b0C""]",0
"A conductor encircling a building and interconnecting all ground terminals?","[""Bonding"",""Interlink"",""Air terminal"",""Counterpoise""]",3
"The use of surface nonmetallic raceway may NOT be used in the following locations EXCEPT one. Which one is this?","[""In dry locations"",""Where subject to severe physical damage"",""Where the voltage is over 300 V"",""Where concealed""]",0
"For installation consisting of not more than two 2-wire branch circuits, the service disconnecting mains shall be rated NOT less than what rating?","[""20 A"",""40 A"",""30 A"",""50 A""]",2
"For a dwelling unit having a floor area not more than 50 square meters shall be permitted to have a single 20-A, 2- wire branch circuit provided the total load shall NOT exceed how many volt-amperes?","[""3,680"",""3,860"",""3,080"",""3,068""]",0
"Flat conductor cable (FCC) system shall NOT be used in the locations enumerated below EXCEPT one. Which one is this?","[""Locations where subject to corrosive vapors"",""Damp locations"",""Residential buildings"",""Outdoors""]",1
"A run conduit between outlets, between fittings, between outlet and fitting shall not contain more than the equivalent of _________ quarterbends.","[""2"",""4"",""3"",""5""]",1
"Transformers that contain liquid that will burn shall be installed only in approved vaults and shall also comply with the following conditions EXCEPT one. Which one is this?","[""Ample ventilation\u2019s shall be provided for the continuous"",""Vent openings shall lead to a safe location outside the building"",""All vent ducts and openings shall be of sufficient areas to reliable explosion pressures within the vault"",""There shall be a robust door between the vault and any non-hazardous location""]",3
"To provide for small appliance in a dwelling unit, the feeder should be computed at","[""2,400 watts"",""3,000 watts"",""1,500 watts"",""3,600 watts""]",2
"Cables operated at over ______ shall be shielded.","[""2,000 V"",""1,000 V"",""3,000 V"",""none of these""]",0
"The nearest ground terminal shall NOT less than______ from the foundation wall.","[""760 mm"",""800 mm"",""550 mm"",""600 mm""]",3
"The circuit conductors between the service entrance equipment or isolated generating plant and the branch circuit overload device or devices.","[""overcurrent protector"",""feeder"",""motor controller"",""disconnecting switch""]",1
"Conductors shall be securely attached to the buildings using fasteners. Fasteners shall be spaced NOT more than","[""760 mm"",""600 mm"",""880 mm"",""900 mm""]",3
"The minimum diameter of air terminal used at the top of a heavy duty smoke or vent stacks shall be ____, exclusive of the corrosion protection.","[""10 mm"",""15 mm"",""13 mm"",""20 mm""]",1
"______ are used on conduits and are located inside and outside of the box.","[""Couplings"",""Bushings"",""Locknuts"",""Washers""]",2
"No parts of cord connected fixtures, hanging fixtures or pendants shall be located within a zone measured ______ horizontally from a bathtub rim.","[""900 mm"",""1,000 mm"",""800 mm"",""700 mm""]",0
"Busbars shall be copper having a minimum conductivity of ______.","[""100%"",""96%"",""98%"",""97%""]",3
"What is the temperature rating of THW insulation?","[""60\u00b0C"",""85\u00b0C"",""75\u00b0C"",""90\u00b0C""]",2
"Individual open conductors and cables other than service cables shall NOT be installed within______ of every grade level.","[""3,100 mm"",""2,500 mm"",""3,700 mm"",""3,000 mm""]",0
"An insulated grounded conductor of 14 mm2 or smaller shall be identified by a continuous ____ outer finish along its entire length.","[""green"",""black"",""green with yellow stripes"",""white or natural gray""]",3
"Messenger support wiring is permitted only in ______ establishments where maintenance personnel service the system.","[""industrial"",""commercial"",""both A and B"",""neither A or B""]",0
"In damp or wet locations, boxes and fittings should be properly placed or insulated to prevent","[""dust from entering the box or fitting"",""water from entering the box or fitting"",""wiring exposure"",""grounding""]",1
"Equipment having an open circuit voltage exceeding ____ shall NOT be installed in dwelling occupancies.","[""500 V"",""300 V"",""250 V"",""230 V""]",1
"Connected knob and tube wiring conductors shall be rigidly supported on knobs not more than a certain minimum distance apart. What is this distance?","[""2,000 mm"",""1,500 mm"",""1,300 mm"",""2,500 mm""]",2
"Which of the following materials is used to support the conductor in the open wiring method?","[""insulated wire stoppers"",""insulated nails"",""rosettes"",""split knobs""]",3
"The minimum size of type IGS cable shall be","[""100 mm<sup>2<\/sup>"",""125 mm<sup>2 <\/sup>"",""150 mm<sup>2<\/sup>"",""200 mm<sup>2<\/sup>""]",1
"Watercraft’s switchboards shall be provided with a clear working space of at least ____ at the front.","[""1,500 mm"",""1,200 mm"",""1,600 mm"",""1,000 mm""]",3
"For grounding electrode to which portable or mobile equipment system neutral impedance is connected, shall be isolated from the ground by at least a certain distance from any other system or equipment grounding electrode. What is this distance?","[""4,000 mm"",""6,000 mm"",""5,000 mm"",""3,000 mm""]",1
"Which of the following metals is the best conductor of electricity?","[""Steel"",""Iron"",""Aluminum"",""Copper""]",3
"Incandescent lamp fixtures shall be marked to indicate the allowable wattage of lamps. The markings shall be permanently installed in letters at least ______ high.","[""6.0 mm"",""6.4 mm"",""6.3 mm"",""6.5 mm""]",1
"If the duty cycle of a motor-generator arc welder is 100%, the supply conductors shall NOT be less than______ of its rated primary nameplate current.","[""115%"",""125%"",""100%"",""130%""]",2
"Most wires used in residential house wiring are usually insulated by","[""Asbestos"",""Cotton"",""Thermoplastic"",""Varnished cambric""]",2
"Open wiring on insulators shall be permitted for wiring systems of ____ or less.","[""150 V"",""240 V"",""300 V"",""600 V""]",3
"The branch circuit conductors that supply one or more units of data processing systems shall have an ampacity not less than ____ percent of the total connected load.","[""150"",""100"",""125"",""200""]",2
"Communication cable and wires shall have a voltage rating NOT less than _____.","[""400 volts"",""300 volts"",""600 volts"",""250 volts""]",1
"A 15-A or a 20-A branch circuit shall be permitted to supply lighting units and other utilization devices. The rating of any one cord and plug connected appliance shall NOT exceed a certain percentage of the branch circuit rating. What is this percentage?","[""80%"",""90%"",""70%"",""60%""]",0
"The bonding conductor used in agricultural buildings shall be copper, insulated, covered or bare, NOT smaller than ______.","[""8.0 mm\u00b2"",""5.5 mm\u00b2"",""14.0 mm<sup>2<\/sup>"",""3.5 mm\u00b2""]",0
"In any watercraft, the motor circuit shall have an ampacity of NOT less than ____ of the motors full load current rating.","[""125%"",""100%"",""115%"",""130%""]",1
"The largest size of electric metallic tubing is","[""75 mm"",""125 mm"",""150 mm"",""100 mm""]",3
"The overload relay used to protect each motor compressor set shall be selected to trip at NOT more than ____ of the motor-compressor rated load current.","[""125%"",""130%"",""150%"",""140%""]",3
"Lamp protection shall be provided by elevation of at least ______ meters from the normal working surface.","[""2"",""1"",""2.5"",""3""]",0
"Type UF cables shall NOT be used ______.","[""as branch circuits"",""as service entrance"",""as direct burial to earth"",""all of these""]",1
"Where “U” pulls are made on the pull box, the distance between each raceway entry inside the box and the opposite wall of the box shall NOT be less than ____ times the trade diameter of the largest raceway in a row.","[""8"",""7"",""6"",""5""]",2
"Reference ambient temperature for explosion proof electrical equipment shall be ____ degree Celsius.","[""30"",""40"",""50"",""60""]",2
"Welding process wherein coalescene is produced by heating with an electric arc with or without the application of pressure and with or without the use of filler metal.","[""Resistance welding"",""Spot welding"",""Arc welding"",""All of these""]",2
"The use of underground feeder cables may NOT be used in the following conditions EXCEPT one. Which one is this?","[""Embedded in concrete"",""Hazardous location"",""Direct burial"",""Theaters""]",2
"Face plates of insulating materials shall be noncombustible and less than ____ in thickness.","[""2.5 mm"",""1.5 mm"",""2.0 mm"",""3.0 mm""]",0
"Conductors supplying two or more motors shall have an ampacity equal to the sum of the FLA rating of all motors plus ____ of the highest motor FLA in the group.","[""30%"",""15%"",""20%"",""25%""]",3
"Which of the following colors identifies the grounded conductor of a branch circuit?","[""Green"",""Black"",""White"",""Blue""]",2
"An enclosure of porcelain or other insulating materials fitting with terminals and intended for connecting the flexible chord carrying a pendant to the permanent wiring.","[""Rosette"",""Raceway"",""Cable bus"",""None of these""]",0
"Receptacles installed for the attachment of portable cords shall be rates at NOT lest than ____ 250 V.","[""20 A"",""30 A"",""10 A"",""15 A""]",3
"Motors with marked service factor of less than 1.15 shall have an overload protection equal to ____ percent of the motor’s FLA.","[""100"",""125"",""120"",""115""]",3
"Cables and cords supplied through plugging boxes shall be of","[""aluminum"",""copper"",""aluminum or copper"",""copper-clad aluminum""]",1
"Overcurrent devices shall be located where they will","[""not be exposed to physical damage."",""Overcurrent devices shall be readily accessible."",""Overcurrent devices maybe located inside clothes closets"",""In a multi-family dwelling, each occupant shall have ready access to all over-current device protecting his occupancy.""]",2
"A conductor or group of conductors, in switch-gear assemblies which serves as a common connection for two or more circuits.","[""Bus"",""Lug"",""Cut-out"",""Terminal Block""]",0
"The ampacity of capacitor circuit conductors shall not be less than ____ of the rated current of the capacitor.","[""125%"",""115%"",""135%"",""150%""]",2
"The alternate or Back-up source of power in a hospital shall have a capacity to sustain its connected loads for a minimum of ______.","[""1.5 hours"",""2.0 hours"",""1.0 hours"",""2.5 hours""]",0
