question,A,B,C,D,E,answer,explanation
<p>Which of the following is the main advantage of PCM system?</p>,Lower noise,Lower power,Lower bandwidth,All of the above,,A,
<p>BPSK stands for</p>,Binary Phase Shifting Key,Broad Phase Shifting Key,Bit Phase Shifting Key,Binary Pulse Shifting Key,,A,
"<p>If a dipole is meant for a frequency of 1 MHz, the length of each rod is about</p>",5 m,20 m,100 m,50 m,,D,
"<p>Consider the following statements: <br/>In a radar system having a high value of the ratio (antenna diameter)/wavelength <ol style=""list-style-type: decimal; padding-bottom:10px;""><li style=""padding-top:10px;"">the maximum range is large</li><li style=""padding-top:10px;"">good target discrimination is achieved</li><li style=""padding-top:10px;"">capture area is increased</li><li style=""padding-top:10px;"">target acquisition is difficult</li></ol> Which of the above are correct?</p>","1, 2, 3, 4","1, 2, 3","1, 2","1, 3, 4",,B,
<p><p><b>Assertion (A):</b>  The maximum range of a radar is proportional to fourth root of the peak transmitted pulse power.</p><p><b>Reason (R):</b>  Radar signals are subjected twice to inverse square law.</p></p>,Both A and R are correct and R is correct explanation of A,Both A and R are correct but R is not correct explanation of A,A is correct but R is wrong,A is wrong but R is correct,,A,
<p>As EM waves travel in free space they get</p>,reflected,refracted,attenuated,absorbed,,C,
<p>Cross talk is due to reception of portions of a signal from one channel into another.</p>,True,False,,,,A,
"<p>If there are M equally likely and independent messages and M = 2<sup>N</sup> where N is an integer, the information in each message is equal to</p>",N bits,0.5 N bits,2 N bits,4 N bits,,A,
"<p>A radar beacon is a small radar set having a receiver, a separate transmitter and an antenna.</p>",True,False,,,,A,
"<p>In the above case the total power in the modulated wave double sideband, suppressed carrier AM will be</p>",112 W,400 W,415 W,512 W,,B,
<p>Brownian motion is</p>,random emission of electrons in vacuum tubes,thermal motion of electrons in a resistance,random diffusion of holes and electrons in semi- conductors,both (b) and (c),,B,
<p>In a TV studio the illuminance is about</p>,200 lux,1000 lux,10000 lux,10 lux,,B,
<p>MEWS stands for</p>,Missile Early Warning System,Moving Target Early warning System,Missile Early Warning Signal,Moving Target Early Warning Signal,,A,
<p>Top loading in an antenna increases</p>,effective height,beam width,input capacitance,bandwidth,,A,
"<p>In a radar, the return echo arrives after the allocated pulse interval. Then</p>",the receiver may be over loaded,the target will appear closer than its actual position,the return echo may interfere with transmitter operation,none of the above,,B,
<p>The decoder for PAL system is</p>,similar to NTSC decoder,similar to NTSC decoder supplemented by 64 ms delay line,similar to NTSC decoder supplemented by 64 ms delay line and an electronic commutator,either (b) or (c),,C,
<p>CW Doppler radar is capable of giving accurate measurements of relative velocities.</p>,True,False,,,,A,
<p>In the stabilized reactance modulators AFC system</p>,the discriminator must have a fast time constant to prevent demodulation,the higher discriminator frequency the better the oscillator frequency stability,"the discriminator frequency must not be too low, or the system will fail",phase modulation is converted into FM by the equalizer circuit,,D,
<p>An antenna is 30 metre high. The frequency is 1 MHz. The radiation resistance is about</p>,1500 Ω,150 Ω,15 Ω,1.5 Ω,,C,
<p>Which of the following codes is based on BCD format?</p>,EBCDIC,ASCII,Hollerith,both (a) and (b),,D,
"<p>In a system using QASK and 4 bits to form a symbol, the required bandwidth is</p>",same as BPSK,half of that in BPSK,one-fourth of that in BPSK,none of the above,,C,
<p>Each of the following statements regarding frequency modulation is true except</p>,amplitude of the modulated wave remains the same as that of carrier wave,the amount of variation of deviation from the original carrier frequency is determined by the frequency of the modulating signal,the rate at which the frequency of modulated wave varies is determined by the frequency of the modulating signal,frequency of modulated wave increases as the signal voltage increases and vice-versa,,B,
<p><p><b>Assertion (A):</b>  Radio transmission is by sky waves</p><p><b>Reason (R):</b>  Waves having frequencies higher than 30 MHz penetrate the atmosphere and do not return to earth.</p></p>,Both A and R are correct and R is correct explanation of A,Both A and R are correct but R is not correct explanation of A,A is correct but R is wrong,A is wrong but R is correct,,B,
<p>During playback the take up reel is</p>,in clockwise motion,in anticlockwise motion,either clockwise or anticlockwise motion,none of the above,,B,
"<p>To avoid objectionable noise in a microwave TV link, the SNR should be about</p>",50 or more,10 or more,25 or more,200 or more,,C,
<p>Foster Seeley discriminator uses a</p>,single tuned circuit,double tuned circuit with primary and secondary tuned to the same frequency,double tuned circuit with primary and secondary tuned to the different frequency,none of the above,,A,
<p>Which of the following statement about modulation is correct?</p>,It avoid use of antennas,It reduces bandwidth,It ensures transmission over long distances,It combines different transmissions,,C,
<p>Sound wave travels as</p>,longitudinal waves,transverse waves,both longitudinal and transverse waves,either longitudinal or transverse wave,,D,
<p>FM signal can be generated by</p>,diode reactance modulator,saturable reactor modulator,reactance tube modulator,none of the above,,D,
<p>A planar array radar uses a high gain planar array antenna.</p>,True,False,,,,A,
<p>Which of the following terms is not applicable to Yagi-Uda array?</p>,High gain,Folded dipole,Parasitic elements,Good bandwidth,,A,
"<p>If transmission path, in PCM, is very long then</p>",repeater stations are used,pulse width may be increased,pulse amplitude is increased,pulse spacing is reduced,,A,
<p>In a single tone AM the power of carrier is P and modulation index is <i>m</i>. The powers of each of the two side bands are</p>,"<img src=""/_files/images/electronics-and-communication-engineering/communication-systems/498-46-1.png""/>","<img src=""/_files/images/electronics-and-communication-engineering/communication-systems/498-46-2.png""/>","<img src=""/_files/images/electronics-and-communication-engineering/communication-systems/498-46-3.png""/>","<img src=""/_files/images/electronics-and-communication-engineering/communication-systems/498-46-4.png""/>",,A,
"<p>If F(ω) is Fourier transform of <i>f</i>(<i>t</i>), then the Fourier transform of <i>f</i>(<i>t</i>) cos ω<i><sub>c</sub></i><i>t</i> is</p>",F(ω + ω<sub><i>c</i></sub>) + F(ω - ω<sub><i>c</i></sub>),"<img src=""/_files/images/electronics-and-communication-engineering/communication-systems/56-3.94-2.png""/> [F(ω + ω<sub><i>c</i></sub>) + F(ω - ω<sub><i>c</i></sub>)]",F(ω + ω<sub><i>c</i></sub>) - F(ω - ω<sub><i>c</i></sub>),"<img src=""/_files/images/electronics-and-communication-engineering/communication-systems/56-3.94-2.png""/> [F(ω + ω<sub><i>c</i></sub>) - F(ω - ω<sub><i>c</i></sub>)]",,B,
<p>In a TV receiver the raster is normal but there is no sound and quality of picture is poor. The defective part is</p>,power supply,loudspeaker,"AGC, video IF amplifier, RF amplifier",horizontal oscillator,,C,
"<p>If the plate supply voltage for a plate modulated class C amplifier is E, the maximum plate cathode voltage could be almost as high as</p>",E,2 E,3 E,4 E,,C,
"<p>If the carrier of a 100 percent modulated AM wave is suppressed, the percentage power saving will be</p>",50,"<img src=""/_files/images/electronics-and-communication-engineering/communication-systems/543-1116-1.png""/>",100,150,,A,
"<p>The characteristics of H and V sync pulses in a colour TV receiver are <ol style=""list-style-type: decimal; padding-bottom:10px;""><li style=""padding-top:10px;"">H sync, pulses are narrow and have frequency of 15625 Hz</li><li style=""padding-top:10px;"">V sync, pulses are much wider and have frequency of 50 Hz</li><li style=""padding-top:10px;"">H and V pulses have almost the same size but frequencies of 15625 and 50 Hz respectively</li><li style=""padding-top:10px;"">V sync, pulses are very narrow but H sync, pulses are wide and their frequencies are 15625 Hz and 50 Hz respectively</li></ol> Which of the above are correct?</p>",1 and 2 only,1 only,3 only,4 only,,A,
"<p>Bandwidth for practical PCM system is (where <i>n</i> is no. of channels, N length of PCM codes)</p>",2<i>n</i> N <i>f<sub>m</sub></i> Hz,4<i>n</i> <i>f<sub>m</sub></i> Hz,2<i>n</i> <i>f<sub>m</sub></i>,(N + 1)<i>f<sub>m</sub></i>,,A,
"<p>Circuit switching, Message switching and Packet Switching Network belong to which of the following systems?</p>",Computer communication system,Electromechanical communication system,PBX system,EPBX system,,A,
<p>The Shannon-Hartley law</p>,refers to noise,defines bandwidth,describes signalling rate,refers to distortion,,A,
<p>In radar PRF depends on maximum range.</p>,True,False,,,,A,
<p>A frequency doubler has an FM signal input at 13 MHz with a deviation of 5 kHz. The output frequency of the carrier will be</p>,26 kHz,260 kHz,26 MHz,260 MHz,,D,
"<p>If <i>f<sub>h</sub></i>(<i>t</i>) is Hilbert transform of <i>f</i>(<i>t</i>), then Hilbert transform of <i>f<sub>h</sub></i>(<i>t</i>) is</p>",-<i>f</i>(<i>t</i>),+<i>f</i>(<i>t</i>),<i>f</i><sup>2</sup>(<i>t</i>),"<span class=""root""><i>f</i>(<i>t</i>)</span>",,A,
<p>Maximum undistorted power output of a transmitter is obtained when its modulation is __________ percent.</p>,more than 100,100,less than 100,50,,B,
<p>Which one of the following is not necessarily an advantage of the phase cancellation method of obtaining SSB over the filter method?</p>,It is possible to generate SSB at any frequency,SSB with lower audio frequencies present can be generated,Switching from one sideband to other is simpler,There are more balanced modulators; therefore the carrier is suppressed better,,D,
<p>Pulse modulation is used in</p>,radio navigation,automatic landing equipment,data communications,all of the above,,D,
"<p>In an amplitude modulated waveform, the amplitude of the sideband is</p>",independent of the carrier amplitude,independent of the modulation index,carrier amplitude x modulation index,1/2 carrier amplitude x modulation index,,D,
<p>In communication systems the frequency range used for voice is</p>,15 Hz to 150 Hz,30 Hz to 1000 Hz,100 Hz to 1500 Hz,300 Hz to 3800 Hz,,D,
<p>In a radio receiver with simple AGC</p>,the highest AGC voltage is produced between stations,an increase in signal strength produces more AGC,the audio stage gain is normally controlled by AGC,"the faster the time constant of AGC, more accurate the output",,B,
