question,A,B,C,D,E,answer,explanation
<p>Transit time is considered as significant at</p>,HF,MF,LF,all of the above,,D,
"<p>In a colour TV receiver, AGC adjusts the gain of</p>",RF stage only,IF stage only,RF stage and one or two IF stages,none of the above,,C,
<p>In pulse transmitter the ratio of time on to time off is called</p>,efficiency,duty cycle,base,bandwidth,,B,
"<p>In figure the output <i>v</i>(<i>t</i>) is <br/><img src=""/_files/images/electronics-and-communication-engineering/communication-systems/514-433-1.png""/></p>",phase modulated signal,amplitude modulated signal,frequency modulated signal,none of the above,,C,
<p>A MASER is a</p>,low noise device,high noise device,medium noise device,may be either high or medium noise device,,A,
<p>Which one of the following is correct?</p>,Coding reduces the noise in the signal,Coding deliberately introduces redundancy into messages,Coding increases the information rate,Coding increases the channel bandwidth,,A,
"<p>A paraboloid reflector has mouth diameter D meters, wavelength λ meters. Its beam width φ is equal to</p>","<img src=""/_files/images/electronics-and-communication-engineering/communication-systems/522-609-1.png""/>","<img src=""/_files/images/electronics-and-communication-engineering/communication-systems/522-609-2.png""/>","<img src=""/_files/images/electronics-and-communication-engineering/communication-systems/522-609-3.png""/>","<img src=""/_files/images/electronics-and-communication-engineering/communication-systems/522-609-4.png""/>",,A,
<p>A balanced modulator circuit uses</p>,two identical diodes with same V-I characteristics,two triodes with different V-I characteristics,two diodes with different V-I characteristics,a diode and a triode,,A,
"<p>In a television camera tube, scanning of a picture is done</p>",line by line from left to right,line by line from right to left,line by line from top to bottom,line by line from bottom to top,,A,
<p>In communication receivers the fidelity is provided by</p>,audio stage,detector range,mixer stage,all of the above,,A,
"<p>Some features of RF stage in good radio receivers is <ol style=""list-style-type: decimal; padding-bottom:10px;""><li style=""padding-top:10px;"">It increases sensitivity by providing amplification to RF signal</li><li style=""padding-top:10px;"">It eliminates image frequency interference</li><li style=""padding-top:10px;"">It increases selectivity</li><li style=""padding-top:10px;"">It reduces noise level</li></ol> Which of the above are true?</p>","1, 2 and 3 only","1, 2 and 4 only","2, 3, 4 only","1, 2, 3, 4",,D,
"<p>During amplitude modulation, the phase angle of the modulating voltage changes by</p>",0°,45°,90°,180°,,A,
<p>The image frequency of a superheterodyne receiver is</p>,created within the receiver itself,not rejected by IF tuned circuits,independent of the frequency of tuning,due to insufficient adjacent channel rejection,,B,
<p>Image frequency rejection mainly depends upon</p>,detector,mixer,IF,RF,,A,
<p>Which of the following is most likely to be found in an SSB transmitter?</p>,"Class A, RF output amplifier","Class B, RF amplifier",Tuned modulator,"Class C, audio amplifier",,B,
<p>Which of the following statement is correct?</p>,Pre-emphasis circuits are used in AM transmitters,FM reception is noise free as compared to AM,A limiter state is also used in AM receivers,Discriminator is used for the detection of AM signals,,B,
<p>Which of the following is true as regards telephone systems?</p>,A larger facility carrying a larger load operates less efficiently than a smaller capacity,A larger facility carrying a lesser load operates more efficiently than a smaller capacity,A larger facility carrying a larger load operates more efficiently than a smaller capacity,A smaller capacity carrying a larger load operates more efficiently than a larger capacity,,C,
<p>SSB can be generated by</p>,filter method,phase shift method,weaver's method,none of the above,,D,
<p>Which one of the following cannot be used to remove the unwanted sideband in SSB?</p>,Balanced modulator,Phase shift method,Filter system,Third method,,A,
"<p>For FM, which of the following statement is not true?</p>",The bandwidth increases as modulation index is increased,The total power remains constant with respect to modulation index,The carrier never becomes zero,All of the above,,C,
"<p>For TV broadcast, picture signal is modulated in</p>",SSB,VSB,FM,AM,,D,
"<p><p><b>Assertion (A):</b>  Stubs, directional couplers and baluns are very commonly used in communication systems</p><p><b>Reason (R):</b>  Characteristic impedance of a line is an important parameter.</p></p>",Both A and R are correct and R is correct explanation of A,Both A and R are correct but R is not correct explanation of A,A is correct but R is wrong,A is wrong but R is correct,,B,
<p>Audio frequency range lies between</p>,20 Hz and 20 kHz,20 kHz and 20 MHz,2 MHz and 20 MHz,20 MHz and 200 MHz,,A,
<p><p><b>Assertion (A):</b>  SSB and ISB receivers have good S/N ratio</p><p><b>Reason (R):</b>  SSB and ISB receivers have good suppression of adjacent channels.</p></p>,Both A and R are correct and R is correct explanation of A,Both A and R are correct but R is not correct explanation of A,A is correct but R is wrong,A is wrong but R is correct,,B,
<p>De-emphasis circuit is used</p>,to attenuate high frequencies,to attenuate low frequencies,to attenuate mid-band frequencies,None of the above,,A,
<p>Which one of the following frequency bands is allocated by ITU (International Telecomm. Union) for DBS - (Direct Broadcast service) also referred as DTH - (Direct to Home service)?</p>,"<img src=""/_files/images/electronics-and-communication-engineering/communication-systems/538-1015-1.png""/>","<img src=""/_files/images/electronics-and-communication-engineering/communication-systems/538-1015-2.png""/>","<img src=""/_files/images/electronics-and-communication-engineering/communication-systems/538-1015-3.png""/>","<img src=""/_files/images/electronics-and-communication-engineering/communication-systems/538-1015-4.png""/>",,B,
<p>FM broadcast lies in which band?</p>,HF,SHF,UHF,VHF,,D,
<p>Which colour picture tube uses slotted aperture mask?</p>,Trinitron,Shadow mask tube,PIL,None of the above,,C,
"<p>If the circumference of a spherical target is between 1 to 10 wavelength in a radar system, the situation is called</p>",resonance region,Rayleigh region,optical region,binomial region,,A,
<p>The complete video signal consists of</p>,video signal and synchronising pulses,"video signal, synchronising pulses and blanking pulses",video signal corresponding to picture information only,video signal and blanking pulses,,B,
<p>Which is most important subsystem for recovering and reconstructing signal in a TDM system?</p>,Envelope detector followed by a low pass filter,Synchronization ckt for proper timing,Bandpass filter to segregate channels,Coherent detector to ensure frequency and phase connection,,A,
<p>Which one of the following is an indirect way of generating FM?</p>,Armstrong modulator,Varactor diode modulator,Reactance FET modulator,Reactance bipolar transistor modulator,,A,
<p>Companding is used in PCM to</p>,reduce bandwidth,increasing S/N ratio,get almost uniform S/N ratio,increase bandwidth,,C,
"<p><p><b>Assertion (A):</b>  In AM the amplitude of carrier is made proportional to the instantaneous amplitude of modulating wave</p><p><b>Reason (R):</b>  In AM, frequency of side band = frequency carrier ± frequency of modulating wave.</p></p>",Both A and R are correct and R is correct explanation of A,Both A and R are correct but R is not correct explanation of A,A is correct but R is wrong,A is wrong but R is correct,,B,
<p>Pressing a key on telephone set generates two frequencies. The basis for selection of these frequencies is</p>,the harmonics of one frequency should not be mistaken for the other frequency,the audio input to the handset transmitter should not be mistaken for a key pressing,both (a) and (b),neither (a) nor (b),,C,
<p>The orbital period of a geostationary communication satellite is</p>,12 hours,24 hours,36 hours,48 hours,,B,
<p>Which of the following is not true as regards communication receiver?</p>,It is exactly same as radio receiver used in households,"It can be used, besides communication, for detection in high frequency bridges",It is designed to perform the task of low and high frequency reception better than in household receiver,Its tuning and operation are more complicated than those in household receiver,,A,
<p>Which of the following is the disadvantage of PDM and PPM?</p>,It requires pulses of larger widths,More samples are needed per second,More powerful transmitter is required,None of the above,,C,
<p>Frequency frogging is used in a carrier system to</p>,conserve frequencies,reduce distortion,reduce cross talk,none of the above,,C,
<p>TDM</p>,can be used with PCM only,interleaves pulses belonging to different transmissions,combines five groups into a super group,stacks 24 channels in adjacent frequency slots,,B,
<p>Which of the following oscillator is not in FM?</p>,Crystal oscillator,Hartley oscillator,Colpitts oscillator,All of the above,,B,
<p>The number of spectral component of impulse wave is</p>,1,0,2,∞,,D,
"<p><p><b>Assertion (A):</b>  If a carrier is modulated by three sine waves and <i>m</i><sub>1</sub>, <i>m</i><sub>2</sub>, <i>m</i><sub>3</sub> are the modulation indices, the total modulation index <i>m</i><sub><i>t</i></sub> is <br/><i>m<sub>t</sub></i> = (<i>m</i><sub>1</sub><sup>2</sup> + <i>m</i><sub>2</sub><sup>2</sup> + <i>m</i><sub>3</sub><sup>2</sup>)<sup>0.5</sup></p><p><b>Reason (R):</b>  An AM, higher the level of modulation, lower is the audio power required to produce modulation.</p></p>",Both A and R are correct and R is correct explanation of A,Both A and R are correct but R is not correct explanation of A,A is correct but R is wrong,A is wrong but R is correct,,C,
"<p>If <i>M</i> (jω) = £[<i>m(t)</i>] where £ denotes Fourier transform, then £[<i>m(t)</i> cos ω<sub>c</sub><i>t</i>] =</p>",M (<i>j</i>ω + <i>j</i>ω<sub><i>c</i></sub>),M (<i>j</i>ω - <i>j</i>ω<sub><i>c</i></sub>),M (<i>j</i>ω + <i>j</i>ω<sub><i>c</i></sub>) + M (<i>j</i>ω - <i>j</i>ω<sub><i>c</i></sub>),"<img src=""/_files/images/electronics-and-communication-engineering/communication-systems/56-3.94-2.png""/> [M (<i>j</i>ω + <i>j</i>ω<sub><i>c</i></sub>) + M (<i>j</i>ω - <i>j</i>ω<sub><i>c</i></sub>)]",,D,
<p>When a wave reaches the open circuited end of a line</p>,all the forward energy is reflected by the open circuit,all the forward energy is absorbed by the open circuit,a small portion of energy is radiated into atmosphere and the remaining energy is reflected,either (a) or (b),,C,
<p>A signal having uniformly distributed amplitude in the interval (- V to + V) is to be encoded using PCM with uniform quantization. The signal to quantization noise ratio is determined by</p>,dynamic range of signal,sampling rate,number of quantizing levels,power spectrum of signal,,B,
<p>Bipolar signalling uses the following bits</p>,"-1, +1","-1, 0, +1","0, 1","-1, 0",,B,
<p>The first geostationary satellite was named</p>,Intelsat I,Intelsat II,Intelsat III,Early bird,,D,
<p>Typical value of power consumption of TV transmitter is</p>,0.5 kVA,2 kVA,50 kVA,1000 kVA,,C,
"<p>In a colour TV receiver, which of the following incorporates colour saturation control?</p>",Chroma detector,Colour killer circuit,SAW filter,Chroma amplifier,,D,
