question,choices,answer
"Refers to the horizontal pointing of an antenna.","[""Look angle"",""Elevation"",""Azimuth"",""Spot""]",2
"What is meant by the angle of elevation?","[""The angle formed between the direction of travel of a wave radiated from an earth station antenna and the horizontal."",""The horizontal pointing of an antenna"",""The angle subtended at the earth station antenna between the satellite and the horizontal"",""A or C is right""]",3
"The range of frequencies used by communications satellites?","[""From 1 GHz up to 3 GHz"",""From 1 GHz up to 30 GHz"",""From 30 GHz up to 300 GHz"",""From 300 GHz up to 350 GHz""]",1
"Otherwise considered as radio repeater in the sky.","[""Transponder"",""Satellite"",""Sputnik"",""Courier""]",0
"How does interference between uplink and downlink signals be prevented?","[""By using different ground stations"",""By using different satellites"",""By using different carrier frequencies"",""All of these""]",2
"An electronic system called transponder of the communications satellite is used","[""For frequency translations"",""To retransmit signals"",""To receive signals"",""All of the above""]",3
"What do you call of the signal path from the transmitter to satellite and from the satellite to earth-based receiver?","[""Downlink and uplink, respectively"",""Downlink"",""Uplink and downlink, respectively"",""Uplink""]",2
"Why is it that the uplink is always higher in frequency than the downlink?","[""Because the uplink suffers greater spreading or free-space loss of frequency than its lower counterpart"",""Since an earth station aims upward with well-controlled antenna sidelobes"",""A and B are correct"",""None of these""]",2
"What is frequency hopping?","[""A form of CDMA where a digital code is used to continually change the frequency of the carrier"",""Available bandwidth is partitioned into smaller frequency bands and the total transmission time is subdivided into smaller time slots"",""Each earth stations within a CDMA network is assigned a different frequency hopping pattern in which each transmitter hops or switched from one frequency band to the next according to their assigned pattern"",""All of these""]",3
"What is meant by satellite footprint?","[""Is the earth area that the satellite can receive from or transmit to"",""Is the function of both the satellite orbit and height, and the type of antenna the satellite uses."",""The geographical representation of the satellite antenna\u2019s radiation pattern."",""All of the above""]",3
"What (is)are the advantage(s) using 1-GHz and higher frequencies?","[""Large amount of information can be sent due to large available bandwidth"",""Propagation characteristics are very consistent"",""Signal wavelengths are shorter"",""All of these are correct""]",3
"What is meant by link budget?","[""The sum of all the signal gains and losses along the way."",""The difference of the signal gains and losses along the way"",""Identifies the system parameters and is used to determine the projected C\/N and Eb\/No ratios at both the satellite and earth stations receivers for a given modulation scheme and desired Pq."",""A or C is right""]",3
"How can satellite maintains its desired orbit consistently?","[""Using small on-board rocket trusters"",""Through using guidance system"",""By telemetry channel"",""All of these""]",0
"A satellite consists of any subsystem functions incorporated into a single system. What is the subsystem responsible for providing the primary dc power and the regulated, secondary supply voltages for the satellite circuits?","[""Communication channel subsystem"",""Telemetry subsystem"",""Power subsystem"",""Antennas""]",2
"How do communications satellites powered?","[""By a bank of batteries whose charge is maintained by an array of solar cells"",""Liquid fuel"",""Nuclear"",""AC power""]",0
"_____________ is the total power consumption for the satellite operation?","[""About 10 W"",""About 150 W"",""About 2000 W"",""About 25000 W""]",1
"As the height of a satellite orbits gets lower, the speed of the satellite","[""Increases"",""Decreases"",""Remains the same"",""None of the above""]",0
"The main function of a communications satellite is the","[""Repeater"",""Reflector"",""Beacon"",""Observation platform""]",0
"The key electronic component in a communications satellite is the","[""Telemetry"",""On-board computer"",""Command and control system"",""Transponder""]",3
"A circular orbit around the equator with a 24-h period is called a(n)","[""Elliptical orbit"",""Geostationary orbit"",""Polar orbit"",""Transfer obit""]",1
"A satellite stays in orbit because the following two factors are balanced.","[""Satellite weight and speed"",""Gravitational pull and inertia"",""Centripetal force and speed"",""Satellite weight and the pull of the moon and sun""]",1
"The height of a satellite in a synchronous equatorial orbit is","[""100 mi"",""6800 mi"",""22,300 mi"",""35, 860 mi""]",2
"Most satellites operate in which frequency band?","[""30 to 300 MHz"",""300 MHz to 3 GHz"",""3 GHz to 30 GHz"",""Above 300 GHz""]",2
"The main power sources for a satellite are","[""Batteries"",""Solar cells"",""Fuel cells"",""Thermoelectric generators""]",1
"The maximum height of an elliptical orbit is called the","[""Perigee"",""Apex"",""Zenith"",""Apogee""]",3
"Batteries are used to power all satellite subsystems","[""At all times"",""Only during emergencies"",""During eclipse periods"",""To give the solar arrays a rest""]",2
"The satellite subsystems that monitors and controls the satellite is the","[""Propulsion subsystem"",""Power subsystem"",""Communications subsystem"",""Telemetry, tracking, and command subsystem""]",3
"The basic technique used to stabilized a satellite is","[""Gravity-forward motion balance"",""Spin"",""Thrusters control"",""Solar panel orientation""]",1
"The jet thrusters are usually fired to","[""Maintain altitude"",""Put the satellite into the transfer orbit"",""Inject the satellite into the geosynchronous orbit"",""Bring the satellite back to the earth""]",0
"Most commercial satellite activity occurs in which band(s)?","[""L"",""C and Ku"",""X"",""S and P""]",1
"How can multiple earth stations share a satellite on the same frequencies?","[""Frequency reuse"",""Multiplexing"",""Mixing"",""They can\u2019t""]",0
"The typical bandwidth of a satellite band is","[""36 MHz"",""40 MHz"",""70 MHz"",""500 MHz""]",3
"Which of the following is not usually a part of a transponder?","[""LNA"",""Mixer"",""Modulator"",""HPA""]",2
"What is the first passive satellite transponder?","[""Sun"",""Early Bird"",""Score"",""Moon""]",1
"What is the height of a satellite in a synchronous equatorial orbit?","[""42000 mi"",""6800 mi"",""22,300 mi"",""35,860 mi""]",2
"It is caused by the inertia of the satellite balanced by the earth’s gravitational pull.","[""Centrifugal force"",""Centripetal force"",""Speed"",""Earth\u2019s rotation""]",1
"The first active satellite","[""Moon"",""Sputnik I"",""Score"",""Echo""]",1
