question,choices,answer
"Which of the following is the first commercial satellite?","[""Early Bird"",""Telstar"",""Explorer"",""Courier""]",1
"What is the first passive satellite transponder?","[""Sun"",""Early Bird"",""Score"",""Moon""]",1
"The first satellite to receive and transmit simultaneously","[""Intelsat I"",""Agila I"",""Syncorn I"",""Telstar I""]",3
"A helical antenna is used for satellite tracking because of","[""circular polarization"",""maneuverability"",""beamwidth"",""gain""]",0
"Repeaters inside communications satellites are known as","[""Trancievers"",""Transponders"",""Transducers"",""TWT""]",1
"Considered as the unsolved problem in satellite system","[""Coverage"",""Cost"",""Access"",""Privacy""]",3
"___________ is a satellite that rotates around the earth in a low-altitude elliptical or circular pattern.","[""Geosynchronous satellite"",""Nonsynchronous satellite"",""Prograde satellite"",""Retrograde satellite""]",1
"Is the geographical representation of a satellite antenna radiation pattern","[""Footprint"",""Spot"",""Earth"",""Region""]",0
"The smallest beam of a satellite antenna radiation pattern","[""Zone beam"",""Hemispheric beam"",""Spot beam"",""Global beam""]",2
"A satellite beam that covers almost 42.4% of the earths surface.","[""Zone beam"",""Hemispheric beam"",""Spot beam"",""Global beam""]",3
"What is the frequency range of C-band?","[""8.5 to 12.5 GHz"",""3.4 to 6.425 GHz"",""12.95 to 14.95 GHz"",""27.5 to 31 GHz""]",1
"A satellite signal transmitted from a satellite transponder to earth’s station.","[""Uplink"",""Downlink"",""Terrestrial"",""Earthbound""]",1
"Collects very weak signals from a broadcast satellite","[""Helical antenna"",""Satellite dish"",""LNA"",""TWT""]",1
"What is a device that detects both vertically and horizontally polarized signals simultaneously?","[""Orthomode transducer"",""Crystal detector"",""Optoisolator"",""Isomode detector""]",0
"_________ detects the satellite signal relayed from the feed and converts it to an electric current, amplifies and lower its frequency.","[""Horn antenna"",""LNA"",""Satellite receiver"",""Satellite dish""]",1
"Is a loss of power of a satellite downlink signal due to earth’s atmosphere.","[""Atmospheric loss"",""Path loss"",""Radiation loss"",""RFI""]",1
"What height must a satellite be placed above the surface of the earth in order for its rotation to be equal to earth’s rotation?","[""26,426.4 miles"",""27,426.4 miles"",""23,426.4 miles"",""22,426.4 miles""]",3
"Point on the satellite obits closest to the earth.","[""Apogee"",""Perigee"",""Prograde"",""Zenith""]",1
"The earth area covered by a satellite radio beam.","[""Beamwidth"",""Bandwidth"",""Footprint"",""Zone""]",2
"What is the local oscillator (mixer) frequency of the satellite with an uplink frequency in GHz band?","[""3500 MHz"",""4500 MHz"",""2225 MHz"",""2555 MHz""]",2
"What kind of battery panels are used in some advance satellites","[""Germanium based panels"",""Silicon based panel"",""Galium Phosphate solar panel array"",""Galium Arsenide solar panel array""]",3
"Satellite engine uses","[""jet propulsion"",""ion propulsion system"",""liquid fuel"",""solar jet""]",1
"A satellite batter has more power but lighter.","[""Lithium"",""Leclanche"",""Hydrogen"",""Magnesium""]",0
"What kind of battery used by older satellites?","[""Lithium"",""Leclanche"",""Hydrogen"",""Magnesium""]",2
"VSAT was made available in","[""1979"",""1981"",""1983"",""1977""]",0
"What band does VSAT first operate?","[""L-band"",""X-band"",""C-band"",""Ku-band""]",2
"The first Philippine Mabuhay satellite has how many channels?","[""30"",""24"",""48"",""50""]",0
"The first Philippine Agila I will have how many transponders.","[""36"",""48"",""24"",""12""]",0
"How may satellite orbital slots are requested by the Philippine Government from ITU?","[""2"",""4"",""6"",""8""]",2
"The location of AsiaSat I.","[""105.5\u02da East"",""151.5\u02da East"",""115.5\u02da East"",""170.5\u02da East""]",0
"AsiaSat I covers how many countries in Asia?","[""38"",""10"",""28"",""15""]",0
"The owner of AsiaSat 2 is","[""Asia Satellite Telecommunications Company (ASTC)"",""Japan Satellite System (JSAT)"",""China Great Wall Industry Corporation"",""Singapore Satellite Commission""]",2
"What is the approximate path loss from satellite-to-earth station?","[""100 dB"",""150 dB"",""175 dB"",""200 dB""]",3
"INTELSAT stands for","[""Intel Satellite"",""International Telephone Satellite"",""International Telecommunications Satellite"",""International Satellite""]",2
"The frequency of Ku band for satellite communications.","[""6\/4 GHz"",""14\/11 GHz"",""12\/14 GHz"",""4\/8 GHz""]",1
"A satellite cross-link means","[""Earth-to-satellite link"",""Satellite-to-earth link"",""Satellite-to-satellite link"",""None of these""]",2
"Earth station uses what type of antenna","[""Despun antenna"",""Helical antenna"",""Toroidal antenna"",""Cassegrain antenna""]",3
"What is the delay time for satellite transmission from earth transmitter to earth receiver?","[""0.5 s"",""1.0 s"",""5 ms"",""0.25 ms""]",0
"The bandwidth of C-band satellite frequency band in U.S.","[""500 GHz"",""1000 GHz"",""1000 MHz"",""500 MHz""]",3
"The most common device used as an LNA is","[""zener diode"",""tunnel diode"",""IMPATT"",""Shockley diode""]",1
"The radiation patterns of earth coverage antennas have a beamwidth of approximately","[""21\u02da"",""5\u02da"",""17\u02da"",""35\u02da""]",2
"A mobile satellite array has usually how many elements?","[""6"",""88"",""12"",""14""]",3
"In a typical mobile satellite array antenna if three elements are activated, how many elements are deactivated?","[""3"",""11"",""5"",""9""]",1
"What circuit is responsible in activating and deactivating adjacent antenna elements in a mobile satellite array?","[""Radial divider"",""Divider\/combiner"",""Radial combiner"",""Radial multiplexer""]",0
"Most mobile satellite array uses ___________ in transforming 50 to 150 Ω impedance.","[""stub"",""balun"",""quarter-wavelength transformer"",""microstrip tapers.""]",2
"The switching from one element to the other element in a typical mobile satellite array.","[""Series"",""Radial"",""Matrix"",""Shunt""]",3
"A method of multiple accessing where a given RF channel bandwidth is divided inot smaller frequency band.","[""CDMA"",""ANIK-D"",""TDMA"",""FDMA""]",3
"What is the delay time for satellite transmissions from earth transmitter to earth receiver?","[""0.5 s"",""1s"",""5 ms"",""0.25 s""]",0
"As the height of a satellite orbit gets lower, the speed of the satellite _________.","[""increases"",""decreases"",""remains the same"",""None of the above""]",0
"The key electronic component in a communications satellite is the","[""telemetry equipment"",""on-board computer"",""command and control system"",""transponder""]",3
"A circular orbit around the equator with a 24-h period is called a/an","[""elliptical orbit"",""geostationary orbit"",""polar orbit"",""transfer orbit""]",1
"A satellite stay in orbit because the following two factors are balanced","[""Satellite weight and speed"",""Gravitational force and centrifugal force"",""Centripetal force and speed"",""Satellite weight and the pull of the moon and sun""]",1
"What is the height of a satellite in a synchronous equatorial orbit?","[""42000 mi"",""6800 mi"",""22,300 mi"",""35,860 mi""]",2
"Most satellites operate in which frequency band?","[""30 to 300 MHz"",""300 MHz to 3 GHz"",""3 GHz to 30 GHz"",""Above 300 GHz""]",2
"The main power sources for a satellite are","[""batteries"",""solar cells"",""fuel cells"",""thermoelectric generators""]",1
"The maximum height of an elliptical orbit is called the","[""Perigee"",""Apex"",""Zenith"",""Apogee""]",3
"Batteries are used to power all satellite subsystems","[""at all times"",""only during emergencies"",""during eclipse periods"",""to give the solar arrays a rest""]",2
"The satellite subsystem that monitors and controls the satellite is the","[""propulsion subsystem"",""power subsystem"",""communications subsystem"",""telemetry, tracking, and command subsystem""]",3
"What is the basic technique used to stabilize a satellite?","[""Gravity-forward motion balance"",""Spin"",""Thruster control"",""Solar panel orientation""]",1
"The jet thrusters are usually fired to","[""maintain altitude"",""put the satellite into the transfer orbit"",""inject the satellite in the geosynchronous orbit"",""bring the satellite back to earth.""]",0
"Most commercial satellite activity occurs in which band(s)?","[""L"",""C and Ku"",""X"",""S and P""]",1
"How can multiple earth stations share a satellite on the same frequencies?","[""Frequency reuse"",""Multiplexing"",""Mixing"",""Frequency hopping""]",0
"What is the typical bandwidth of a satellite band?","[""36 MHz"",""40 MHz"",""70 MHz"",""500 MHz""]",3
"Which of the following is not usually a part of a transponder are defined by the","[""LNA"",""Mixer"",""Modulator"",""HPA""]",2
"The satellite communications channels in a transponder are defined by the","[""LNA"",""bandpass filter"",""mixer"",""input signals""]",1
"The HPAs in most satellite are","[""TWTs"",""Klystrons"",""Vacuum tubes"",""Magnetrons""]",0
"The physical location of a satellite is determined by its","[""distance from the earth"",""latitude and longitude"",""reference to the stars"",""position relative to the sun""]",1
"The receive GCE system in an earth station performs what function(s)?","[""Modulation and multiplexing"",""Up conversion"",""Demodulation and demultiplexing"",""Down conversion""]",2
"Which of the following types of HPA is not used in earth stations?","[""TWT"",""Transistor"",""Klystron"",""Magnetron""]",3
"What is the common up-converter and down-converter IF?","[""36 MHz"",""40 MHz"",""70 MHz"",""500 MHz""]",2
"What type of modulation is used on voice and video signals?","[""AM"",""FM"",""SSB"",""QPSK""]",1
"What modulation is normally used with digital data?","[""AM"",""FM"",""SSB"",""QPSK""]",3
"Which of the following is not a typical output from a GPS receiver?","[""Latitude"",""Speed"",""Altitude"",""Longitude""]",1
"The total space loss of transmission and reception for two ground stations with uplink frequency 8GHz and a downlink of 6 GHz with angle of elevations of 3˚ and 7˚ A respectively is","[""403 dB"",""100 dB"",""20 dB"",""215 dB""]",0
"The maximum propagation delay of a geostationary satellite is","[""278 ms"",""239 ms"",""300 ms"",""250 ms""]",0
"The total propagation delay time from transmission to reception of signals from a ground transmitter to ground receiver with angle of elevation at 10 degrees respectively is","[""273 ms"",""239 ms"",""275 ms"",""260 ms""]",0
"A satellite which simply reflects the signal without further amplification","[""Passive satellite"",""Active satellite"",""Geostationary satellite"",""Domestic satellite""]",0
"Essentially a satellite ___________ is a radio repeater in the sky","[""transponder"",""comparator"",""duplexer"",""billboard""]",0
"Satellite the orbits in a circular pattern with an angular velocity equal to that of the earth","[""Geostationary"",""Early Bird I"",""Syncorn I"",""Stationary satellite""]",0
"Satellite that provide services within a single country","[""Domsat"",""Comsat"",""Regional"",""Global""]",0
"The round-trip propagation delay between two earth stations through a geosynchronous satellite is","[""600 to 700 ms"",""300 to 400 ms"",""500 to 600 ms"",""400 to 500 ms""]",2
"The signal path from earth station satellite","[""Downlink signal"",""Reflected signal"",""Incident signal"",""Uplink signal""]",3
"Designed to receive a signal from a transmitting station on the ground and retransmit it to a receiving station located elsewhere","[""Repeater"",""Communication satellite"",""Relay station"",""Transponder""]",1
"The signal path from satellite to earth-based receiver.","[""Incident signal"",""Uplink signal"",""Downlink signal"",""Reflected signal""]",2
"A satellite position is measured by its __________ angle with respect to the horizon.","[""azimuth"",""depression"",""elevation"",""critical""]",2
"The ________ angle measures the satellite position clockwise from the direction of true north.","[""azimuth"",""elevation"",""depression"",""critical""]",0
"incidentally propose the geostationary scheme or orbit of the satellite in 1940s","[""Stephen Gray"",""Carl Friedrich Gauss"",""Samuel Morse"",""Arthur Clarke""]",3
"When the satellite are spaced 4˚ of the 360˚ complete circle, how many parking spaces or orbit slots are available?","[""95"",""85"",""90"",""80""]",2
"The control routine necessary to keep the satellite in position is referred to as","[""station keeping"",""station tracking"",""station monitoring"",""station maintaining""]",0
"Refers to the satellite orientation with respect to the earth","[""Satellite location"",""Satellite altitude"",""Satellite position"",""Satellite orbit""]",1
"The first intelsat satellite that was launched in 1965 was named","[""Courier"",""Echo"",""Telstar I"",""Early Bird I""]",3
"The first satellite launched for a geosynchronous orbit but unfortunately lost during orbit injection","[""Telstar I"",""Syncom I"",""Sputnik I"",""Early Bird I""]",1
"When the elevation angle of a geostationary satellite is 23˚ and the transmitting frequency is 3840 MHz, what is the free space loss in dB?","[""150 dB"",""200 dB"",""196 dB"",""100 dB""]",2
"What is the propagation delay when a signal is transmitter by an earth station to a geosynchronous satellite about 38,500 km above earth’s equator and then received by the same earth station?","[""128 msec"",""256 msec"",""300 msec"",""400 msec""]",1
"What is the free space attenuation of a satellite communications system operating at 36,000 km above the earth at 5.0 GHz?","[""138 dB"",""202 dB"",""142 dB"",""198 dB""]",3
"Which of the following is the most common application of satellite?","[""Surveillance"",""Military application"",""Communications"",""Newscasting""]",2
"Descending pass for a satellite means a pass from","[""North to South"",""South to North"",""East to West"",""West to East""]",0
"Geostationary stationary satellites are located ___________ with respect to the equator.","[""0\u02da longitude"",""0\u02da latitude"",""90\u02da latitude"",""45\u02da latitude""]",1
"It is a position and timing service that is available to all GPS users on a continuous, worldwide basis with no direct charge.","[""PPI"",""PPS"",""SPS"",""SSP""]",2
"The geometric shape of a non-circular orbit of a satellite is ____.","[""Ellipse"",""Parabolic"",""Hyperbolic"",""Paraboloid""]",0
"The circuit that provides channelization in a transponder is the","[""Mixer"",""Local oscillator"",""Bandpass filter"",""HPA""]",2
"The three axes referred to the three-axis attitude stabilization are; except","[""Pitch"",""Yaw"",""Roll"",""Speed""]",3
"A ground station is operating to a geostationary satellite at a 5 degrees angle of elevation. Calculate the round-trip time between ground station to satellites in a geostationary orbit.","[""456.45 ms"",""275.58 ms"",""137.79 ms"",""126.89 ms""]",1
"The escape velocity of the earth is approximately","[""30,000 km\/hr"",""25,000 mi\/hr"",""35,000 m\/s"",""25,000 km\/hr""]",1
"A satellite radio repeater is called ____.","[""Repeater"",""Transponder"",""Satellite"",""Mixer""]",1
"Calculate the angle of declination for an antenna using a polar mount at a latitude of 45 degrees.","[""3.2 degrees"",""1.3 degrees"",""4.2 degrees"",""6.81 degrees""]",3
"The time transfer accuracy used with reference to the Universal Transmitter Mercator Grid is ____.","[""UTC"",""UTMG"",""GMT"",""UTM""]",0
"It is caused by the inertia of the satellite balanced by the earth’s gravitational pull.","[""Centrifugal force"",""Centripetal force"",""Speed"",""Earth\u2019s rotation""]",1
"In satellites, it includes control mechanism that support the payload operation.","[""Bus"",""Payload"",""Ground segment"",""Space segment""]",0
"A satellite transmitter operates at a 4 GHz with a transmitter power of 7W and an antenna gain of 40 dBi. The receiver has antenna gain of 30 dBi, and the path length is 40,000 km. calculate the signal strength at the receiver.","[""-88 dBm"",""-98 dBm"",""-77 dBm"",""-79.8 dBm""]",0
"The satellite subsystem that monitors and controls the satellite is the","[""Propulsion system"",""Power subsystem"",""Communications subsystem"",""Telemetry, tracking, and command subsystems""]",3
"Standard positioning service has time transfer accuracy to Universal Transfer Mercator Grid within ____.","[""140 nanoseconds"",""340 nanoseconds"",""230 nanoseconds"",""530 nanoseconds""]",1
"A satellite remains in orbit because the centrifugal force caused by its rotation around the Earth is counterbalanced by Earth’s ____.","[""Centripetal force"",""Inertia"",""Gravitational pull"",""Speed""]",2
"A TVRO installation for use with C-band satellite (download frequency at 4 GHz), has a diameter of about 3.5 meters and an efficiency of 60%. Calculate the gain.","[""41 dB"",""19 dB"",""29 dB"",""9 dB""]",0
"Which of the following is not a typical output from the GPS receiver?","[""Latitude"",""Speed"",""Altitude"",""Longitude""]",1
"The law that states that a satellite will orbit a primary body following an elliptical path.","[""1st law of Kepler"",""2nd law of Kepler"",""3rd law of Kepler"",""4th law of Kepler""]",0
"Telephone communication takes place between two earth stations via a satellite that is 40,000 km from each station. Suppose Bill, at station 1, asks a question and Sharon, at station 2, answers immediately, as soon as she hears the question. How much time elapses between the end of Bill’s question and the beginning of Sharon’s reply, as heard by Bill?","[""0.26 sec"",""3.2 sec"",""0.52 sec"",""1.6 sec""]",2
"In GPS, it is accomplished by manipulating navigation message orbit data (epsilon) and/or the satellite clock frequency (dither).","[""Selective availability"",""Reverse error notification"",""Forward error notification"",""Two dimensional reporting""]",0
"The modulation normally used with digital data is","[""AM"",""FM"",""SSB"",""QPSK""]",3
"Kepler’s 2nd law is known as","[""Law of gravity"",""Law of areas"",""Newton\u2019s law of motion"",""Harmonic law""]",1
"A receiving antenna with a gain of 40 dB looks at a sky with a noise temperature of 15K. the loss between the antenna and the LNA input, due to the feedhorn is 0.4 dB, and the LNA has a noise temperature of 40K. Calculate the G/T?","[""13.4 dB"",""39 dB"",""20.6 dB"",""11.2 dB""]",2
"The operational satellites of Navstar GPS are revolving around Earth in ____ orbital planes.","[""4"",""3"",""5"",""6""]",3
"Kepler’s 3rd law is also known as","[""Law of gravity"",""Law of areas"",""Newton\u2019s law of motion"",""Harmonic law""]",3
"The basic technique used to stabilize a satellite is","[""Gravity-forward motion balance"",""Spin"",""Thruster control"",""Solar panel orientation""]",1
"Calculate the length of the path to a geostationary satellite from an earth station where the angle of elevation is 30 degrees.","[""55 x 10^3 km"",""13 x 10^3 km"",""23 x 10^3 km"",""39 x 10^3 km""]",3
"Navstar GPS is a ____.","[""LEO"",""MEO"",""HEO"",""GEO""]",1
"The satellite is orbiting in the same direction as the Earth’s rotation and at angular velocity greater than that of the Earth.","[""Retrograde"",""Synchronous"",""Posigrade"",""Asynchronous""]",2
"Find the orbital period of the satellite in a circular orbit 500 km above the Earth’s surface","[""1.6 hrs"",""3.2 hrs"",""2.4 hrs"",""6.4 hrs""]",0
"Satellite orbiting in the opposite direction as the Earth’s rotation and at angular velocity less than that of the Earth","[""Asynchronous"",""Synchronous"",""Posigrade"",""Retrograde""]",3
"A transponder that demodulates the baseband signals and then demodulates a carrier is known as ____ transponder.","[""Single-conversion"",""Double-conversion"",""Regenerative"",""Degenerative""]",2
"Low Earth Orbit (LEO) satellite orbits around the earth at a height of approximately ____.","[""3000 miles"",""1000 miles"",""575 miles"",""370 miles""]",3
"Power amplification in a transponder is usually provided by","[""klystron"",""TWT"",""Transistor"",""Magnetron""]",1
"Which of the following clocks is developed for Galileo satellite?","[""Cesium Atomic Frequency Standard"",""Rubidium Atomic Frequency Standard"",""Ruby Atomic Frequency Standard"",""Hydrogen Frequency Standard""]",1
"Master control station of GPS is located in ____.","[""Colorado"",""California"",""Alaska"",""New York""]",0
"Medium Earth Orbit (MEO) satellite orbits around the earth at a height approximately ____.","[""3,000 miles to 6,000 miles"",""4,000 miles to 8,000 miles"",""6,000 miles to 12,000 miles"",""8,000 miles to 10,000 miles""]",2
"A satellite stays in orbit because the following two factors are balanced","[""Satellite weight and speed"",""Gravitational pull and inertia"",""Centripetal force and speed"",""Satellite weight and the pull of the moon and sun""]",1
"A ____ circuit in the transponder performs the frequency conversion.","[""HPA"",""Mixer"",""Local oscillator"",""LPA""]",1
"Geosynchronous satellites are high-altitude earth-orbit satellites with heights about ____.","[""22,300 miles"",""21,000 miles"",""8,000 miles"",""10,400 miles""]",0
"The input circuit to a transponder is the ____.","[""BPF"",""HPA"",""LPA"",""Any of these""]",2
"The access scheme used by GPS","[""FDMA"",""OFDMA"",""TDMA"",""CDMA""]",3
"The point in an orbit which is located farthest from earth","[""Perigee"",""Apogee"",""Line of apsides"",""Point of shoot""]",1
"Using very narrow beamwidth antennas to isolate signals on the same frequency is known as ____.","[""Spatial isolation"",""Footprint"",""Frequency reuse"",""Boresight""]",0
"The point in an orbit which is located closest to Earth","[""Point of shoot"",""Apogee"",""Line of apsides"",""Perigee""]",3
"The most popular satellite frequency range is 4 to 6 GHz and is called the ____ band.","[""C"",""L"",""Ka"",""Ku""]",0
"All satellites rotate around the earth in an orbit that forms a plane that passes through the center of gravity of earth called ____.","[""Focus"",""Geocenter"",""Orbit"",""Center""]",1
"In satellite communications, the type of modulation used in voice and video signals is","[""AM"",""FM"",""SSB"",""QPSK""]",1
"In satellite communications, type of orbit which is virtually all orbits except those travel directly above the equator or directly over the North or the South poles.","[""Equatorial orbit"",""Polar orbit"",""Geosynchronous orbit"",""Inclined orbit""]",3
"It is the angle between the earth’s equatorial plane and the orbital plane of the satellite measured counterclockwise.","[""Angle of elevation"",""Angle of azimuth"",""Angle of inclination"",""Angle of tetrahedron""]",2
"Which of the following types of HPA is not used in earth stations?","[""TWT"",""Klystron"",""Transistors"",""Magnetron""]",3
"Galileo satellite’s mass is ____.","[""880 kg"",""675 kg"",""900 kg"",""540 kg""]",1
"The point where a polar or inclined orbit crosses the equatorial plane traveling from north to south","[""Ascending node"",""Line of nodes"",""Descending node"",""Diagonal nodes""]",2
"The receive GCE system in an earth station performs what function/s","[""Modulation and multiplexing"",""Up conversion"",""Demodulation and demultiplexing"",""Down conversion""]",2
"The term generally associated with the table showing the position of a heavenly body on the number of dates in a regular sequence.","[""Astronomical almanac"",""Smith"",""Ephemeris"",""Space reporting""]",2
"The point where a polar or inclined orbit crosses the equatorial plane traveling from south to north.","[""Ascending node"",""Descending node"",""Diagonal node"",""Inclined node""]",0
"The line joining the ascending and descending node is called ____.","[""Line of apsides"",""Line of nodes"",""Line of shoot"",""Any of these""]",1
"When the satellite rotates in an orbit directly above the equator, usually in circular pattern. This type of orbit is called ____.","[""Polar orbit"",""Synchronous orbit"",""Geosynchronous satellite"",""Equatorial orbit""]",3
"The Navstar GPS satellite system was declared fully operational as of ____.","[""April 17, 1995"",""April 24, 1995"",""April 27, 1995"",""April 10, 1995""]",2
"The HPAs in most satellites are","[""TWTs"",""Vacuum tubes"",""Klystrons"",""Magnetrons""]",0
"The physical location of a satellite is determined by its","[""Distance from the earth"",""Latitude and longitude"",""Reference to the stars"",""Position relative to the sun""]",1
"When the satellite rotates in a path that takes it over the north and south poles in an orbit perpendicular to the equatorial plane. This type of orbit is called ____.","[""Inclined orbit"",""Polar orbit"",""Geosynchronous orbit"",""Diagonal orbit""]",1
"The azimuth angles and the angle of elevation is collectively known as ____.","[""Antennas look angles"",""Antennas see angles"",""Antennas keep angles"",""Antennas satellite angles""]",0
"The point on the surface of the Earth directly below the satellite.","[""Satellite point"",""Latitude"",""Longitude"",""Subsatellite point""]",3
"It is the vertical angle formed between the direction of travel of an electromagnetic wave radiated from an earth station antenna pointing directly toward a satellite and the horizontal plane.","[""Angle of depression"",""Angle of inclination"",""Angle of elevation"",""Angle of azimuth""]",2
"The unique number used to encrypt the signal from that of the GPS satellite.","[""SV"",""UV"",""PRN"",""ESN""]",2
"The minimum acceptable angle of elevation","[""6 degrees"",""4 degrees"",""5 degrees"",""7 degrees""]",2
"It is the horizontal angular distance from a reference direction either the southern or northern most point of the horizon.","[""Angle of elevation"",""Latitude"",""Longitude"",""Azimuth""]",3
