question,choices,answer
"The _______ field in the SNMP PDU reports an error in a response message.","[""community"",""enterprise"",""error status"",""none of the above""]",2
"All objects managed by SNMP are given an object identifier. The object identifier always starts with _______.","[""1.3.6.1.2.1"",""1.3.6.1.2.2"",""1.3.6.1.2.3"",""none of the above""]",0
"Which of the following could be a legitimate MIB object identifier?","[""1.3.6.1.2.1.1"",""1.3.6.1.2.2.1"",""2.3.6.1.2.1.2"",""none of the above""]",0
"SMI has two broad categories of data type: _______ and _______.","[""simple; complex"",""simple; structured"",""structured; unstructured"",""none of the above""]",1
"The _______ field in the SNMP PDU is an offset that points to the variable in error.","[""community"",""enterprise"",""error index"",""none of the above""]",2
"SNMP defines the ___________________ to be sent from a manager to an agent and vice versa.","[""format of the packets"",""encoding of the packets"",""number of packets"",""none of the above""]",0
"The GetRequest PDU is sent from the _______ to the __________ to retrieve the value of a variable or a set of variables.","[""client; server"",""server; client"",""server; network"",""none of the above""]",0
"The _________ ordering enables a manager to access a set of variables one after another by defining the first variable.","[""lexicographic"",""linear"",""non-linear"",""none of the above""]",0
"To define the data type, SMI uses fundamental _______ definitions and adds some new definitions.","[""AMS.1"",""ASN.1"",""ASN.2"",""none of the above""]",1
"________ defines the general rules for naming objects, defining object types, and showing how to encode objects and values.","[""MIB"",""BER"",""SMI"",""none of the above""]",2
"For a 1-byte length field, what is the maximum value for the data length?","[""127"",""128"",""255"",""none of the above""]",0
"Which of the following is an application layer service?","[""File transfer and access"",""Mail service"",""Remote log-in"",""All the above""]",3
"When data are transmitted from device A to device B, the header from A’s layer 4 is read by B’s _______ layer.","[""Transport"",""Application"",""Physical"",""None of the above""]",0
"__________ provides full transport layer services to applications.","[""UDP"",""TCP"",""ARP"",""none of the above""]",1
"The process-to-process delivery of the entire message is the responsibility of the _______ layer.","[""Transport"",""Application"",""Physical"",""Network""]",0
"The ______ layer is responsible for moving frames from one hop (node) to the next.","[""transport"",""data link"",""physical"",""none of the above""]",1
"The _______ layer is responsible for delivering data units from one station to the next without errors.","[""physical"",""data link"",""transport"",""network""]",1
"The session, presentation, and application layers are the ______ support layers.","[""user"",""network"",""both (a) and (b)"",""neither (a) nor (b)""]",0
"The physical, data link, and network layers are the ______ support layers.","[""network"",""user"",""both (a) and (b)"",""neither (a) nor (b)""]",0
"The ________ layer is responsible for the process-to-process delivery of the entire message.","[""transport"",""physical"",""network"",""data link""]",0
"The _______ layer lies between the network layer and the application layer.","[""Data link"",""Transport"",""Physical"",""None of the above""]",1
"The Internetworking Protocol (IP) is a ________ protocol.","[""connection-oriented"",""reliable"",""both a and b"",""none of the above""]",3
"The _______ layer links the network support layers and the user support layers.","[""session"",""transport"",""data link"",""network""]",1
"ICMPv6 includes _______.","[""IGMP"",""ARP"",""RARP"",""a and b""]",3
"The ____ address uniquely defines a host on the Internet.","[""IP"",""port"",""specific"",""physical""]",0
"The _______ layer coordinates the functions required to transmit a bit stream over a physical medium.","[""data link"",""transport"",""network"",""physical""]",3
"The ______ layer is responsible for the source-to-destination delivery of a packet across multiple network links.","[""network"",""physical"",""data link"",""transport""]",0
"Mail services are available to network users through the _______ layer.","[""Transport"",""Physical"",""Data link"",""Application""]",3
"The ____ created a model called the Open Systems Interconnection, which allows diverse systems to communicate.","[""IEEE"",""ISO"",""OSI"",""none of the above""]",1
"The _______ layer changes bits into electromagnetic signals.","[""Physical"",""Transport"",""Data link"",""None of the above""]",0
"IPv6 has _______ -bit addresses.","[""128"",""32"",""64"",""variable""]",0
"The_____ address identifies a process on a host.","[""specific"",""port"",""IP"",""physical""]",1
"The_________ layer is responsible for the delivery of a message from one process to another.","[""transport"",""network"",""physical"",""none of the above""]",0
"The _________ layer enables the users to access the network.","[""application"",""physical"",""data link"",""transport""]",0
"Message _______ means that the receiver is ensured that the message is coming from the intended sender, not an imposter.","[""confidentiality"",""integrity"",""authentication"",""none of the above""]",2
"A(n) ________function creates a message digest out of a message.","[""encryption"",""decryption"",""hash"",""none of the above""]",2
"The secret key between members needs to be created as a ______ key when two members contact KDC.","[""public"",""session"",""complimentary"",""none of the above""]",1
"The ________ criterion ensures that a message cannot easily be forged.","[""one-wayness"",""weak-collision-resistance"",""strong-collision-resistance"",""none of the above""]",1
"A(n) _____ is a trusted third party that assigns a symmetric key to two parties.","[""KDC"",""CA"",""KDD"",""none of the above""]",0
"A witness used in entity authentication is ____________.","[""something known"",""something possessed"",""something inherent"",""all of the above""]",3
"A _______ message digest is used as an MDC.","[""keyless"",""keyed"",""either (a) or (b)"",""neither (a) nor (b)""]",0
"A(n)______ creates a secret key only between a member and the center.","[""CA"",""KDC"",""KDD"",""none of the above""]",1
"________ means to prove the identity of the entity that tries to access the system’s resources.","[""Message authentication"",""Entity authentication"",""Message confidentiality"",""none of the above""]",1
"A ________ signature is included in the document; a _______ signature is a separate entity.","[""conventional; digital"",""digital; digital"",""either (a) or (b)"",""neither (a) nor (b)""]",0
"If _________ is needed, a cryptosystem must be applied over the scheme.","[""integrity"",""confidentiality"",""nonrepudiation"",""authentication""]",1
"Digital signature provides ________.","[""authentication"",""nonrepudiation"",""both (a) and (b)"",""neither (a) nor (b)""]",2
"Digital signature cannot provide ________ for the message.","[""integrity"",""confidentiality"",""nonrepudiation"",""authentication""]",1
"To authenticate the data origin, one needs a(n) _______.","[""MDC"",""MAC"",""either (a) or (b)"",""neither (a) nor (b)""]",1
"A(n) _________ can be used to preserve the integrity of a document or a message.","[""message digest"",""message summary"",""encrypted message"",""none of the above""]",0
"Challenge-response authentication can be done using ________.","[""symmetric-key ciphers"",""asymmetric-key ciphers"",""keyed-hash functions"",""all of the above""]",3
"The _______criterion ensures that we cannot find two messages that hash to the same digest.","[""one-wayness"",""weak-collision-resistance"",""strong-collision-resistance"",""none of the above""]",2
"A digital signature needs a(n)_________ system.","[""symmetric-key"",""asymmetric-key"",""either (a) or (b)"",""neither (a) nor (b)""]",1
"A(n) ________is a federal or state organization that binds a public key to an entity and issues a certificate.","[""KDC"",""Kerberos"",""CA"",""none of the above""]",2
"Message ________ means that the sender and the receiver expect privacy.","[""confidentiality"",""integrity"",""authentication"",""none of the above""]",0
"In ________ authentication, the claimant proves that she knows a secret without actually sending it.","[""password-based"",""challenge-response"",""either (a) or (b)"",""neither (a) nor (b)""]",1
"In _______, a claimant proves her identity to the verifier by using one of the three kinds of witnesses.","[""message authentication"",""entity authentication"",""message confidentiality"",""message integrity""]",1
"The _______ criterion states that it must be extremely difficult or impossible to create the message if the message digest is given.","[""one-wayness"",""weak-collision-resistance"",""strong-collision-resistance"",""none of the above""]",0
"A(n) ______ is a hierarchical system that answers queries about key certification.","[""KDC"",""PKI"",""CA"",""none of the above""]",2
"_________ means that a sender must not be able to deny sending a message that he sent.","[""Confidentiality"",""Integrity"",""Authentication"",""Nonrepudiation""]",3
"A hash function must meet ________ criteria.","[""two"",""three"",""four"",""none of the above""]",1
"__________ is a popular session key creator protocol that requires an authentication server and a ticket-granting server.","[""KDC"",""Kerberos"",""CA"",""none of the above""]",1
"Password-based authentication can be divided into two broad categories: _______ and _______.","[""fixed; variable"",""time-stamped; fixed"",""fixed; one-time"",""none of the above""]",2
"To accomplish flow control, TCP uses a ___________ window protocol.","[""limited-size"",""sliding"",""fixed-size"",""none of the above""]",1
"UDP and TCP are both _______ layer protocols.","[""data link"",""network"",""transport"",""none of the above""]",2
"In TCP, one end can stop sending data while still receiving data. This is called a ______.","[""half-close"",""half-open"",""one-way termination"",""none of the above""]",0
"In SCTP, the acknowledgment number and window size are part of each ________.","[""data chunk"",""control chunk"",""a or b"",""none of the above""]",1
"A connection in SCTP is called an ____________.","[""negotiation"",""association"",""transmission"",""none of the above""]",1
"An ACK segment, if carrying no data, consumes ______ sequence number(s).","[""no"",""one"",""two"",""none of the above""]",0
"The association identifier in SCTP is __________________.","[""a unique verification tag"",""a combination of logical and port addresses"",""either a or b"",""none of the above""]",0
"In SCTP, a data chunk is numbered using ________.","[""a TSN"",""an SI"",""an SSN"",""none of the above""]",0
"The bytes of data being transferred in each connection are numbered by TCP. The numbering starts with a __________________.","[""0"",""1"",""randomly generated number"",""none of the above""]",2
"In the sending computer, UDP receives a data unit from the _______ layer.","[""application"",""transport"",""IP"",""none of the above""]",0
"SCTP allows __________ service in each association.","[""single stream"",""multistream"",""double stream"",""none of the above""]",1
"TCP is a ___________ protocol.","[""connection-oriented"",""connectionless"",""both a and b"",""none of the above""]",0
"UDP uses ________ to handle outgoing user datagrams from multiple processes on one host.","[""flow control"",""multiplexing"",""demultiplexing"",""none of the above""]",1
"Because the sending and the receiving processes may not write or read data at the same speed, TCP ________.","[""speeds up the slower process"",""slows down the faster process"",""uses buffers"",""none of the above""]",2
"SCTP association allows _____________ for each end.","[""only one IP address"",""multiple IP addresses"",""only two IP address"",""none of the above""]",1
"UDP needs the _______ address to deliver the user datagram to the correct application process.","[""port"",""application"",""internet"",""none of the above""]",0
"In an SCTP packet, control chunks come ___________ data chunks.","[""after"",""before"",""a or b"",""none of the above""]",1
"TCP is a(n) _______ transport protocol.","[""unreliable"",""best-effort delivery"",""reliable"",""none of the above""]",2
"TCP delivers _______ out-of-order segments to the process.","[""all"",""no"",""some"",""none of the above""]",1
"Multiply the header length field by _______ to find the total number of bytes in the TCP header.","[""2"",""4"",""6"",""none of the above""]",1
"Which of the following does UDP guarantee?","[""flow control"",""connection-oriented delivery"",""either a or b"",""none of the above""]",3
"TCP allows the sending process to deliver data as a _______of bytes and allows the receiving process to obtain data as a _________ of bytes.","[""message; message"",""stream; stream"",""block; block"",""none of the above""]",1
"To distinguish between different data chunks belonging to the same stream, SCTP uses ___________.","[""TSNs"",""SIs"",""SSNs"",""none of the above""]",2
"The ports ranging from 49,152 to 65,535 can be used as temporary or private port numbers. They are called the ________ ports.","[""well-known"",""registered"",""dynamic"",""none of the above""]",2
"UDP does not add anything to the services of IP except for providing _______ communication.","[""node-to-node"",""process-to-process"",""host-to-host"",""none of the above""]",1
"The combination of an IP address and a port number is called a ____________.","[""transport address"",""network address"",""socket address"",""none of the above""]",2
"The options field of the TCP header ranges from 0 to _______ bytes.","[""10"",""20"",""40"",""none of the above""]",2
"A port address in UDP is _______bits long.","[""8"",""16"",""32"",""none of the above""]",1
"The FIN segment consumes ____ sequence numbers if it does not carry data.","[""two"",""three"",""no"",""none of the above""]",3
"The inclusion of the checksum in the TCP segment is ________.","[""optional"",""mandatory"",""at the discretion of the application program"",""none of the above""]",1
"The FIN + ACK segment consumes _____ sequence number(s) if it does not carry data.","[""two"",""three"",""one"",""none of the above""]",2
"TCP uses _________________ to check the safe and sound arrival of data.","[""an acknowledgment mechanism"",""out-of-band signaling"",""the services of another protocol"",""none of the above""]",0
"ACK segments consume _______ sequence number(s) and _______ acknowledged.","[""no; are not"",""one; are not"",""no; are"",""none of the above""]",0
"In SCTP, acknowledgment numbers are used to acknowledge _____________.","[""both data chunks and control chunks"",""only control chunks"",""only data chunks"",""none of the above""]",2
"The source port address on the UDP user datagram header defines _______.","[""the sending computer"",""the receiving computer"",""the process running on the sending computer"",""none of the above""]",2
"__________ control regulates the amount of data a source can send before receiving an acknowledgment from the destination.","[""Error"",""Flow"",""Congestion"",""none of the above""]",1
"To use the services of UDP, we need ________ socket addresses.","[""four"",""two"",""three"",""none of the above""]",1
"The value of the window size is determined by _________.","[""the sender"",""the receiver"",""both the sender and receiver"",""none of the above""]",1
"TCP assigns a sequence number to each segment that is being sent. The sequence number for each segment is the number of the _______ byte carried in that segment.","[""first"",""last"",""middle"",""none of the above""]",0
"An SCTP packet can carry __________.","[""only one data chunk"",""several data chunks"",""no data chunks"",""none of the above""]",1
"UDP is an acronym for _______.","[""User Delivery Protocol"",""User Datagram Procedure"",""User Datagram Protocol"",""none of the above""]",2
"A SYN + ACK segment cannot carry data; it consumes _____ sequence number(s).","[""no"",""three"",""two"",""none of the above""]",3
"TCP groups a number of bytes together into a packet called a ___________.","[""user datagram"",""segment"",""datagram"",""none of the above""]",1
"There is no need for a header length field in SCTP because ________________.","[""there are no options in the general header"",""the size of the header is fixed"",""both a and b"",""none of the above""]",2
"Connection establishment in TCP is called __________ handshaking.","[""two-way"",""four-way"",""one-way"",""none of the above""]",3
"UDP packets are encapsulated in ___________.","[""an Ethernet frame"",""an TCP segment"",""an IP datagram"",""none of the above""]",2
"The checksum in SCTP is ________ bits.","[""16"",""32"",""64"",""none of the above""]",1
"TCP sliding windows are __________ oriented.","[""packet"",""segment"",""byte"",""none of the above""]",2
"If a segment carries data along with an acknowledgment, this is called _______.","[""backpacking"",""piggybacking"",""piggypacking"",""none of the above""]",1
"If the ACK value is 200, then byte _______ has been received successfully.","[""199"",""200"",""201"",""none of the above""]",0
"A TCP segment is encapsulated in __________.","[""an IP datagram"",""an Ethernet frame"",""a UDP user datagram"",""none of the above""]",0
"TCP is a __________protocol.","[""stream-oriented"",""message-oriented"",""block-oriented"",""none of the above""]",0
"UDP packets are called __________.","[""user datagrams"",""segments"",""frames"",""none of the above""]",0
"In the sending computer, UDP sends a data unit to the _______ layer.","[""application"",""transport"",""IP"",""none of the above""]",2
"In SCTP, control information and data information are carried in _______ chunks.","[""the same chunk"",""different chunks"",""either a or b"",""none of the above""]",1
"TCP has ____________; SCTP has ____________.","[""packets; segments"",""segments; packets"",""segments; frames"",""none of the above""]",1
"One of the responsibilities of the transport layer protocol is to create a ______ communication.","[""host-to-host"",""process-to-process"",""node-to-node"",""none of the above""]",1
"The control information in SCTP is included in the ________.","[""header control field"",""control chunks"",""data chunks"",""none of the above""]",1
"Communication in TCP is ___________.","[""simplex"",""half-duplex"",""full-duplex"",""none of the above""]",2
"Stream Control Transmission Protocol (SCTP) is a new _____________protocol.","[""reliable, character-oriented"",""reliable, message-oriented"",""unreliable, message-oriented"",""none of the above""]",1
"To distinguish between different streams, SCTP uses ___________.","[""a TSN"",""an SI"",""an SSN"",""none of the above""]",1
"Which of the following functions does UDP perform?","[""process-to-process communication"",""host-to-host communication"",""end-to-end reliable data delivery"",""none of the above""]",0
"IP is responsible for _______ communication while TCP is responsible for _______ communication.","[""host-to-host; process-to-process"",""process-to-process; host-to-host"",""process-to-process; network-to-network"",""none of the above""]",0
"The connection establishment procedure in TCP is susceptible to a serious security problem called the _________ attack.","[""ACK flooding"",""FIN flooding"",""SYN flooding"",""none of the above""]",2
"UDP is called a _____________transport protocol.","[""connectionless, reliable"",""connection-oriented, unreliable"",""connectionless, unreliable"",""none of the above""]",2
"In SCTP, ___________ can be carried in a packet that carries an INIT chunk.","[""only data chunks"",""only control chunks"",""no other chunk"",""none of the above""]",2
"UDP packets have a fixed-size header of _______ bytes.","[""16"",""8"",""40"",""none of the above""]",1
"The SYN flooding attack belongs to a group of security attacks known as a _____ attack.","[""denial of service"",""replay"",""man-in-the middle"",""none of the above""]",0
"When the IP layer of a receiving host receives a datagram, _______.","[""delivery is complete"",""a transport layer protocol takes over"",""a header is added"",""none of the above""]",1
"The value of the acknowledgment field in a segment defines the number of the ______byte a party expects to receive.","[""first"",""last"",""next"",""none of the above""]",2
"A SYN segment cannot carry data; it consumes _____ sequence number(s).","[""no"",""one"",""two"",""none of the above""]",1
"The acknowledgment number is ________.","[""independent"",""randomly generated"",""cumulative"",""none of the above""]",2
"The local host and the remote host are defined using IP addresses. To define the processes, we need second identifiers called ____________.","[""UDP addresses"",""transport addresses"",""port addresses"",""none of the above""]",2
"Although there are several ways to achieve process-to-process communication, the most common is through the __________ paradigm.","[""client-server"",""client-client"",""server-server"",""none of the above""]",0
"A(n) _________ machine is a machine that goes through a limited number of states.","[""infinite state"",""finite state"",""both a and b"",""none of the above""]",1
"UDP uses _______ to handle incoming user datagrams that go to different processes on the same host.","[""flow control"",""multiplexing"",""demultiplexing"",""none of the above""]",2
"The actual mail transfer is done through ____________.","[""UAs"",""MTAs"",""MAAs"",""none of the above""]",1
"If the sender wants an option enabled by the receiver, it sends a _______ command.","[""WILL"",""DO"",""WONT"",""none of the above""]",1
"When the sender is connected to the mail server via a LAN or a WAN, we need ______________.","[""two MTA"",""two UAs and two pairs of MTAs"",""two UAs and a pair of MTAs"",""none of the above""]",1
"The ________ usually contains the sender address, the receiver address, and other information.","[""message"",""envelope"",""both a and b"",""none of the above""]",1
"NVT uses two sets of characters, one for _____and one for __________.","[""sending; receiving"",""request; reply"",""data; control"",""none of the above""]",2
"In FTP, ASCII, EBCDIC, and image define an attribute called _______.","[""file type"",""data structure"",""transmission mode"",""none of the above""]",0
"The third stage in an email transfer needs a ________ protocol.","[""pull"",""push"",""both a and b"",""none of the above""]",0
"_______ is the standard mechanism provided by TCP/IP for copying a file from one host to another.","[""TELNET"",""SMTP"",""TFTP"",""none of the above""]",3
"In the _______ mode, each character typed is sent by the client to the server.","[""default"",""character"",""line"",""none of the above""]",1
"The _______ is software residing on the remote system that allows the remote system to receive characters from a TELNET server.","[""terminal driver"",""pseudoterminal driver"",""TELNET client"",""none of the above""]",1
"FTP uses the services of ________.","[""UDP"",""IP"",""TCP"",""none of the above""]",2
"For the control connection, FTP uses the __________ character set.","[""regular ASCII"",""EBCDIC"",""NVT ASCII"",""none of the above""]",2
"In FTP, when we _______, it is copied from the client to the server.","[""retrieve a file"",""store a file"",""retrieve a list"",""none of the above""]",1
"During an FTP session the data connection is opened _______.","[""exactly once"",""exactly twice"",""as many times as necessary"",""none of the above""]",2
"In FTP, _______ is the service type used by the IP protocol because this is an interactive connection between a user (human) and a server.","[""maximize throughput"",""minimize delay"",""minimize error"",""none of the above""]",1
"When a user wants to access an application program or utility located on a remote machine, he or she performs ___________ login.","[""local"",""remote"",""temporary"",""none of the above""]",1
"The third stage in an email transfer uses a(n) ________ protocol.","[""UA"",""MTA"",""MAA"",""none of the above""]",2
"TELNET uses only one TCP connection. The server uses ________ port and the client uses ________ port.","[""a well-known; another well-known"",""an ephemeral; another ephemeral"",""a well-known; an ephemeral"",""none of the above""]",2
"For control, NVT uses US ASCII characters with the highest order bit set to ______.","[""1"",""0"",""a or b"",""none of the above""]",0
"The formal protocol that defines the MTA client and server in the Internet is called ___________.","[""SMTP"",""SNMP"",""TELNET"",""none of the above""]",0
"_________ is a supplementary protocol that allows non-ASCII data to be sent through email.","[""JPEG"",""MPEG"",""MIME"",""none of the above""]",2
"Which of the following services is not provided by a UA?","[""composing messages"",""reading messages"",""replying messages"",""all are""]",3
"If the sender wants to enable an option, it sends a _______ command.","[""WILL"",""DO"",""WONT"",""none of the above""]",0
"In FTP, when we _______, it is copied from the server to the client.","[""retrieve a file"",""retrieve a list"",""a and b"",""none of the above""]",2
"TELNET is an abbreviation for ____________.","[""terminal network"",""telephone network"",""telecommunication network"",""none of the above""]",0
"When a user logs into a local time-sharing system, it is called ________ login.","[""local"",""remote"",""temporary"",""none of the above""]",0
"Which part of the mail created by the UA contains the sender and receiver names?","[""envelope"",""address"",""header"",""none of the above""]",2
"________ is part of a local hard drive, a special file with permission restrictions.","[""A message"",""A response"",""An agent"",""none of the above""]",3
