question,choices,answer
"In cyclic redundancy checking, the divisor is _______ the CRC.","[""one bit less than"",""one bit more than"",""The same size as"",""none of the above""]",1
"The ________ between two words is the number of differences between corresponding bits.","[""Hamming rule"",""Hamming code"",""Hamming distance"",""none of the above""]",2
"The _______ of a polynomial is the highest power in the polynomial.","[""range"",""power"",""degree"",""none of the above""]",2
"In modulo-2 arithmetic, __________ give the same results.","[""addition and subtraction"",""addition and multiplication"",""addition and division"",""none of the above""]",0
"In cyclic redundancy checking, what is the CRC?","[""The quotient"",""The dividend"",""The divisor"",""The remainder""]",3
"Which error detection method consists of just one redundant bit per data unit?","[""CRC"",""Checksum"",""Simple parity check"",""Two-dimensional parity check""]",2
"In _____ coding, we divide our message into blocks, each of k bits, called ___.","[""block; blockwords"",""block; datawords"",""linear; datawords"",""none of the above""]",1
"A _____ error means that two or more bits in the data unit have changed.","[""burst"",""double-bit"",""single-bit"",""none of the above""]",0
"Adding 1 and 1 in modulo-2 arithmetic results in _________.","[""0"",""1"",""2"",""none of the above""]",0
"In ________ error correction, the receiver corrects errors without requesting retransmission.","[""onward"",""forward"",""backward"",""none of the above""]",1
"If the Hamming distance between a dataword and the corresponding codeword is three, there are _____ bits in error.","[""5"",""4"",""3"",""none of the above""]",2
"A simple parity-check code can detect __________ errors.","[""an odd-number of"",""an even-number of"",""two"",""no errors""]",0
"The Hamming distance between equal codewords is _________.","[""0"",""1"",""n"",""none of the above""]",0
"In a linear block code, the _______ of any two valid codewords creates another valid codeword.","[""ANDing"",""XORing"",""ORing"",""none of the above""]",1
"In ________ error correction, the receiver asks the sender to send the data again.","[""forward"",""backward"",""retransmission"",""none of the above""]",2
"We can divide coding schemes into two broad categories: ________ and ______coding.","[""linear; nonlinear"",""block; convolution"",""block; linear"",""none of the above""]",1
"In modulo-2 arithmetic, we use only ______.","[""1 and 2"",""0 and 1"",""0 and 2"",""none of the above""]",1
"To guarantee correction of up to 5 errors in all cases, the minimum Hamming distance in a block code must be ________.","[""11"",""6"",""5"",""none of the above""]",0
"The _____of errors is more difficult than the ______.","[""detection; correction"",""correction; detection"",""creation; correction"",""creation; detection""]",1
"In block coding, if k = 2 and n = 3, we have _______ invalid codewords.","[""4"",""8"",""2"",""none of the above""]",0
"The checksum of 0000 and 0000 is __________.","[""0000"",""1111"",""0111"",""1110""]",1
"In one’s complement arithmetic, if positive 7 is 0111, then negative 7 is ________.","[""1101"",""1000"",""1111"",""none of the above""]",1
"In block coding, if n = 5, the maximum Hamming distance between two codewords is ________.","[""5"",""3"",""2"",""none of the above""]",0
"Which error detection method uses one’s complement arithmetic?","[""Checksum"",""CRC"",""Simple parity check"",""Two-dimensional parity check""]",0
"The divisor in a cyclic code is normally called the _________.","[""redundancy"",""degree"",""generator"",""none of the above""]",2
"In modulo-2 arithmetic, we use the ______ operation for both addition and subtraction.","[""OR"",""XOR"",""AND"",""none of the above""]",1
"We add r redundant bits to each block to make the length n = k + r. The resulting n-bit blocks are called _________.","[""codewords"",""datawords"",""blockwords"",""none of the above""]",0
"To guarantee the detection of up to 5 errors in all cases, the minimum Hamming distance in a block code must be _______.","[""11"",""5"",""6"",""none of the above""]",2
"A generator that contains a factor of ____ can detect all odd-numbered errors.","[""x"",""1"",""x + 1"",""none of the above""]",2
"_______codes are special linear block codes with one extra property. If a codeword is rotated, the result is another codeword.","[""Convolution"",""Cyclic"",""Non-linear"",""none of the above""]",1
"The Hamming distance between 100 and 001 is ________.","[""0"",""1"",""2"",""none of the above""]",2
"______ refers to the physical or logical arrangement of a network.","[""Topology"",""Mode of operation"",""Data flow"",""None of the above""]",0
"A ______ is a data communication system spanning states, countries, or the whole world.","[""MAN"",""WAN"",""LAN"",""none of the above""]",1
"A _______ connection provides a dedicated link between two devices.","[""primary"",""multipoint"",""point-to-point"",""secondary""]",2
"Which topology requires a multipoint connection?","[""Bus"",""Star"",""Mesh"",""Ring""]",0
"A ________ is a set of rules that governs data communication.","[""protocol"",""forum"",""standard"",""none of the above""]",0
"In a ______ connection, two and only two devices are connected by a dedicated link.","[""multipoint"",""point-to-point"",""(a) and (b)"",""none of the above""]",1
"The information to be communicated in a data communications system is the _______.","[""Medium"",""Protocol"",""Message"",""Transmission""]",2
"________ defines how a particular pattern to be interpreted, and what action is to be taken based on that interpretation.","[""Syntax"",""Semantics"",""Timing"",""None of the above""]",1
"Frequency of failure and network recovery time after a failure are measures of the _______of a network.","[""Performance"",""Security"",""Reliability"",""Feasibility""]",2
"A television broadcast is an example of _______ transmission.","[""half-duplex"",""simplex"",""full-duplex"",""automatic""]",1
"Data flow between two devices can occur in a _______ way.","[""simplex"",""half-duplex"",""full-duplex"",""all of the above""]",3
"_______ are special-interest groups that quickly test, evaluate, and standardize new technologies.","[""Standards organizations"",""Regulatory agencies"",""Forums"",""All of the above""]",2
"Which agency developed standards for physical connection interfaces and electronic signaling specifications?","[""ISO"",""ITU-T"",""ANSI"",""EIA""]",3
"A _______ is a data communication system within a building, plant, or campus, or between nearby buildings.","[""LAN"",""MAN"",""WAN"",""none of the above""]",0
"_______ refers to two characteristics: when data should be sent and how fast it can be sent.","[""Semantics"",""Timing"",""Syntax"",""none of the above""]",1
"This was the first network.","[""CSNET"",""NSFNET"",""ARPANET"",""ANSNET""]",2
"Devices may be arranged in a ______ topology.","[""mesh"",""ring"",""bus"",""all of the above""]",3
"_______ is the protocol suite for the current Internet.","[""UNIX"",""NCP"",""TCP\/IP"",""ACM""]",2
"________ is a collection of many separate networks.","[""A WAN"",""An internet"",""A LAN"",""None of the above""]",1
"In a ________ connection, three or more devices share a link.","[""point-to-point"",""multipoint"",""(a) and (b)"",""none of the above""]",1
"Which organization has authority over interstate and international commerce in the communications field?","[""FCC"",""IEEE"",""ITU-T"",""ISOC""]",0
"In the original ARPANET, _______ were directly connected together.","[""routers"",""host computers"",""networks"",""IMPs""]",3
"Communication between a computer and a keyboard involves ______________ transmission.","[""simplex"",""half-duplex"",""full-duplex"",""automatic""]",0
"Which topology requires a central controller or hub?","[""Mesh"",""Bus"",""Star"",""Ring""]",2
"The _______ is the physical path over which a message travels.","[""Protocol"",""Signal"",""Medium"",""All the above""]",2
"In a _______ connection, more than two devices can share a single link.","[""multipoint"",""point-to-point"",""primary"",""secondary""]",0
"_______ refers to the structure or format of the data, meaning the order in which they are presented.","[""Semantics"",""Syntax"",""Timing"",""All of the above""]",1
"An unauthorized user is a network _______ issue.","[""Security"",""Reliability"",""Performance"",""All the above""]",0
"________ is an idea or concept that is a precursor to an Internet standard.","[""RCF"",""ID"",""RFC"",""none of the above""]",2
"In _______ transmission, the channel capacity is shared by both communicating devices at all times.","[""simplex"",""half-duplex"",""full-duplex"",""half-simplex""]",2
"When there is more than one source, the _______ identifier defines the mixer.","[""synchronization source"",""contributor"",""timestamp"",""none of the above""]",0
"__________ is the protocol designed to handle real-time traffic on the Internet.","[""TCP"",""UDP"",""RTP"",""none of the above""]",2
"Jitter is introduced in real-time data by the _______________.","[""error caused during transmission"",""delay between packets"",""both a and b"",""none of the above""]",1
"In a real-time video conference, data from the server is _______ to the client sites.","[""unicast"",""multicast"",""broadcast"",""none of the above""]",1
"An RTP packet is encapsulated in _______.","[""a UDP user datagram"",""a TCP segment"",""an IP datagram"",""none of the above""]",3
"A _______ changes the format of a high-bandwidth video signal to a lower quality narrow-bandwidth signal.","[""timestamp"",""sequence number"",""translator"",""none of the above""]",2
"____________ is used to compress video.","[""MPEG"",""JPEG"",""either a or b"",""none of the above""]",0
"Real-time traffic needs the support of ____________.","[""broadcasting"",""multicasting"",""both a and b"",""none of the above""]",1
"_______ are used to number the packets of a real-time transmission.","[""Timestamps"",""Playback buffers"",""Sequence numbers"",""none of the above""]",2
"The third phase of JPEG is ___________.","[""DCT transformation"",""quantization"",""data compression"",""none of the above""]",2
"The second phase of JPEG is ___________.","[""DCT transformation"",""quantization"",""data compression"",""none of the above""]",1
"A __________on each packet is required for real-time traffic.","[""timestamp"",""sequence number"",""both a and b"",""none of the above""]",2
"To prevent _________, we can timestamp the packets and separate the arrival time from the playback time.","[""error"",""jitter"",""either a or b"",""none of the above""]",1
"__________ means combining several streams of traffic into one stream.","[""Translation"",""Mixing"",""both a and b"",""none of the above""]",1
"A real-time video performance lasts 10 min. If there is jitter in the system, the viewer spends _______ minutes watching the performance.","[""less than 10"",""more than 10"",""exactly 10"",""none of the above""]",1
"___________ audio/video refers to the broadcasting of radio and TV programs through the Internet.","[""Interactive"",""Streaming live"",""Streaming stored"",""none of the above""]",1
"__________ means changing the encoding of a payload to a lower quality to match the bandwidth of the receiving network.","[""Translation"",""Mixing"",""both a and b"",""none of the above""]",0
"____________ is used to compress images.","[""MPEG"",""JPEG"",""either a or b"",""none of the above""]",1
"A ________buffer is required for real-time traffic.","[""playback"",""reordering"",""sorting"",""none of the above""]",0
"In ________ encoding, the differences between the samples are encoded instead of encoding all the sampled values.","[""predictive"",""perceptual"",""both a and b"",""none of the above""]",0
"__________ encoding is based on the science of psychoacoustics, which is the study of how people perceive sound.","[""Predictive"",""Perceptual"",""both a and b"",""none of the above""]",1
"_________ audio/video refers to the use of the Internet for interactive audio/video applications.","[""Interactive"",""Streaming live"",""Streaming stored"",""none of the above""]",0
"According to the Nyquist theorem, we need to sample an analog signal ________times the highest frequency.","[""three"",""two"",""four"",""none of the above""]",1
"___________ is an application protocol that establishes, manages, and terminates a multimedia session.","[""RIP"",""SIP"",""DIP"",""none of the above""]",1
"_________ is not suitable for interactive multimedia traffic because it retransmits packets in case of errors.","[""UDP"",""TCP"",""both a and b"",""none of the above""]",1
"RTCP uses an odd-numbered _______ port number that follows the port number selected for RTP.","[""UDP"",""TCP"",""both a and b"",""none of the above""]",0
"We can divide audio and video services into _______ broad categories.","[""three"",""two"",""four"",""none of the above""]",0
"RTP uses a temporary even-numbered _______ port.","[""UDP"",""TCP"",""both a and b"",""none of the above""]",0
"________ audio/video refers to on-demand requests for compressed audio/video files.","[""Streaming live"",""Streaming stored"",""Interactive"",""none of the above""]",1
"___________ is a protocol for controlling the flow and quality of data.","[""RTP"",""RTCP"",""UDP"",""none of the above""]",1
"A _______ adds signals from different sources to create a single signal.","[""timestamp"",""sequence number"",""mixer"",""none of the above""]",2
"A _______ shows the time a packet was produced relative to the first or previous packet.","[""timestamp"",""playback buffer"",""sequence number"",""none of the above""]",0
"The first phase of JPEG is ___________.","[""DCT transformation"",""quantization"",""data compression"",""none of the above""]",0
"In ______, the chance of collision can be reduced if a station senses the medium before trying to use it.","[""CSMA"",""MA"",""CDMA"",""FDMA""]",0
"In the _______ method, the stations in a network are organized in a logical ring.","[""polling"",""token passing"",""reservation"",""none of the above""]",1
"In _______, the sequences are generated using orthogonal codes such the Walsh tables.","[""TDMA"",""CDMA"",""FDMA"",""none of the above""]",1
"__________ augments the CSMA algorithm to detect collision.","[""CSMA\/CD"",""CSMA\/CA"",""either (a) or (b)"",""both (a) and (b)""]",0
"In the _________ method, after the station finds the line idle, it sends its frame immediately. If the line is not idle, it continuously senses the line until it finds it idle.","[""p-persistent"",""nonpersistent"",""1-persistent"",""none of the above""]",2
"In the _____ method, time is divided into intervals. In each interval, a reservation frame precedes the data frames sent in that interval.","[""token passing"",""reservation"",""polling"",""none of the above""]",1
"In the _______ method, each station has a predecessor and a successor.","[""token passing"",""polling"",""reservation"",""none of the above""]",0
"The vulnerable time for CSMA is the ________propagation time.","[""three times"",""two times"",""the same as"",""none of the above""]",2
"In the _________ method, a special packet called a ______ circulates through the ring.","[""polling: poll request"",""token passing: token"",""reservation: control frame"",""none of the above""]",1
"In ________, the available bandwidth is divided into frequency bands.","[""TDMA"",""CDMA"",""FDMA"",""none of the above""]",2
"In ___________ methods, no station is superior to another station and none is assigned the control over another.","[""controlled access"",""random access"",""channelization"",""none of the above""]",1
"In the ________method, a station that has a frame to send senses the line. If the line is idle, it sends immediately. If the line is not idle, it waits a random amount of time and then senses the line again.","[""1-persistent"",""nonpersistent"",""p-persistent"",""none of the above""]",1
"In ______, each station is allocated a band to send its data. In other words, each band is reserved for a specific station, and it belongs to the station all the time.","[""CDMA"",""FDMA"",""TDMA"",""none of the above""]",1
"In the _______method, after the station finds the line idle it sends or refrain from sending based on the outcome of a random number generator. If the line is busy, it tries again.","[""p-persistent"",""nonpersistent"",""1-persistent"",""none of the above""]",0
"To avoid collisions on wireless networks, ________was invented.","[""CSMA\/CD"",""CSMA\/CA"",""either (a) or (b)"",""both (a) and (b)""]",1
"In _____, each station is allocated a time slot during which it can send data. Each station transmits its data in its assigned time slot.","[""TDMA"",""CDMA"",""FDMA"",""none of the above""]",0
"In the _______ method, the primary device controls the link; the secondary devices follow its instructions.","[""token passing"",""reservation"",""polling"",""none of the above""]",2
"In _____, each station transmits its data in its assigned time slot.","[""TDMA"",""CDMA"",""FDMA"",""none of the above""]",0
"We discussed ________ channelization protocols.","[""four"",""three"",""two"",""none of the above""]",1
"In the ______ method, all data exchanges must be made through the primary device even when the ultimate destination is a secondary device.","[""polling"",""token passing"",""reservation"",""none of the above""]",0
"We discussed ______ popular controlled-access methods.","[""four"",""three"",""two"",""none of the above""]",1
"In __________, each station is forced to send only at the beginning of the time slot.","[""pure ALOHA"",""slotted ALOHA"",""both (a) and (b)"",""neither (a) nor (b)""]",1
"In _______ methods, the stations consult one another to find which station has the right to send.","[""channelization"",""random access"",""controlled access"",""none of the above""]",2
"In ________ each station sends a frame whenever it has a frame to send.","[""slotted ALOHA"",""pure ALOHA"",""both (a) and (b)"",""neither (a) nor (b)""]",1
"In ______, the stations use different codes to achieve multiple access.","[""CDMA"",""TDMA"",""FDMA"",""none of the above""]",0
"In _______, collisions are avoided through the use of three strategies: the interframe space, the contention window, and acknowledgments.","[""CSMA\/CD"",""CSMA\/CA"",""either (a) or (b)"",""both (a) and (b)""]",1
"In the ________ method, a station needs to make a reservation before sending data. Time is divided into intervals.","[""token passing"",""polling"",""reservation"",""none of the above""]",2
"In pure ALOHA, the vulnerable time is ______ the frame transmission time.","[""two times"",""three times"",""the same as"",""none of the above""]",0
"The maximum throughput for slotted ALOHA is ________ per cent.","[""36.8"",""18.4"",""12.2"",""none of the above""]",0
"_________ is a multiple-access method in which the available bandwidth of a link is shared in time, frequency, or through code, between different stations.","[""Controlled access"",""Channelization"",""Random access"",""none of the above""]",1
"________ requires that each station first listen to the medium before sending.","[""FDMA"",""CDMA"",""MA"",""CSMA""]",3
"We have categorized access methods into _______ groups.","[""five"",""three"",""four"",""two""]",1
"In _______ methods, a station cannot send unless it has been authorized by other stations.","[""controlled access"",""channelization"",""random access"",""none of the above""]",0
"In slotted ALOHA, the vulnerable time is ______ the frame transmission time.","[""two times"",""three times"",""the same as"",""none of the above""]",2
"In ________, a station monitors the medium after it sends a frame to see if the transmission was successful. If so, the station is finished. If, however, there is a collision, the frame is sent again.","[""CSMA\/CD"",""CSMA\/CA"",""either (a) or (b)"",""both (a) and (b)""]",0
"_______ is based on coding theory and uses sequences of numbers called chips.","[""TDMA"",""CDMA"",""FDMA"",""none of the above""]",1
"IGMP is _______ protocol.","[""an error reporting"",""a group management"",""a transmission"",""none of the above""]",1
"If the sender is a host and wants to send a packet to another host on the same network, the logical address that must be mapped to a physical address is ______.","[""the destination IP address in the datagram header"",""the IP address of the router found in the routing table"",""either a or b"",""none of the above""]",0
"The target hardware address on an Ethernet is _______ in an ARP request.","[""0x000000000000"",""0.0.0.0"",""variable"",""class dependent""]",0
"If four hosts on a network belong to the same group, a total of _______ sent in response to a general query message.","[""one membership report is"",""two membership reports are"",""three membership reports are"",""none of the above""]",1
"The _______ is used by a router in response to a received leave report.","[""general query message"",""special query message"",""membership report"",""none of the above""]",1
"Which of the following is true about ICMP messages?","[""An ICMP error message may be generated for an ICMP error message."",""An ICMP error message may be generated only for the first fragment."",""An ICMP error message may be generated for a multicast datagram."",""none is true""]",1
"An IGMP packet is carried in an __________ packet.","[""UDP"",""IP"",""Ethernet frame"",""none of the above""]",1
"An IGMP query is sent from a _______ to a _______.","[""host; host"",""host; router"",""router; host or router"",""none of the above""]",2
"In _______, a table associating a logical address with a physical address is updated manually.","[""static mapping"",""dynamic mapping"",""physical mapping"",""none of the above""]",0
"A multicast message is sent from _______ to _______.","[""one source; one destination"",""one source; multiple destinations"",""multiple sources; one destination"",""none of the above""]",1
"An ARP request is normally _______.","[""broadcast"",""multicast"",""unicast"",""none of the above""]",0
"If the sender is a host and wants to send a packet to another host on another network, the logical address that must be mapped to a physical address is ______.","[""the destination IP address in the datagram header"",""the IP address of the router found in the routing table"",""either a or b"",""none of the above""]",1
"The _______ field of the IGMP message is all zeros in a query message.","[""version"",""type"",""group address"",""none of the above""]",2
"A technique called ______ is used to create a subnetting effect.","[""ARP"",""RARP"",""proxy ARP"",""none of the above""]",2
"A ________ is a local address. Its jurisdiction is over a local network.","[""physical"",""logical"",""a and b"",""none of the above""]",0
"The sender is a router that has received a datagram destined for a host on another network. The logical address that must be mapped to a physical address is ______.","[""the destination IP address in the datagram header"",""the IP address of the router found in the routing table"",""either a or b"",""none of the above""]",1
"The sender is a router that has received a datagram destined for a host on the same network. The logical address that must be mapped to a physical address is ______.","[""the destination IP address in the datagram header"",""the IP address of the router found in the routing table"",""either a or b"",""none of the above""]",0
"IGMP operates __________.","[""locally"",""globally"",""both a and b"",""none of the above""]",0
"IGMP helps a ________ router create and update a list of loyal members related to each router interface.","[""broadcast"",""unicast"",""multicast"",""none of the above""]",2
"In IGMP, the general query message ___________________ group.","[""does not define a particular"",""explicitly defines a"",""can define more than one"",""none of the above""]",0
"A _______ is an ARP that acts on behalf of a set of hosts.","[""ARP"",""RARP"",""proxy ARP"",""none of the above""]",0
"IGMP is a companion to the ______ protocol.","[""UDP"",""TCP"",""ICM"",""none of the above""]",3
"ICMP is a _________ layer protocol.","[""data link"",""transport"",""network"",""none of the above""]",2
"An ARP reply is normally _______.","[""broadcast"",""multicast"",""unicast"",""none of the above""]",2
"_______ is a dynamic mapping protocol in which a physical address is found for a given logical address.","[""ARP"",""RARP"",""both a and b"",""none of the above""]",0
"ICMP messages are divided into two broad categories: _____________.","[""query and error reporting messages"",""request and response messages"",""request and reply messages"",""none of the above""]",0
"An ICMP message has _____ header and a variable-size data section.","[""a 16-byte"",""a 32-byte"",""an 8-byte"",""none of the above""]",0
"The logical addresses in the Internet are called _______ addresses.","[""port"",""IP"",""Email"",""none of the above""]",1
"Which of the following is true about ICMP messages?","[""An ICMP error message may be generated for an ICMP error message."",""An ICMP error message may be generated for each fragment."",""An ICMP error message may be generated for a multicast datagram."",""none is true""]",3
"In networks that do not support physical multicast addressing, multicasting can be accomplished through _______.","[""mapping"",""queries"",""tunneling"",""none of the above""]",2
"The least significant 23 bits in a 48-bit Ethernet address identify a ________.","[""multicast router"",""host"",""multicast group"",""none of the above""]",2
"A _______ address is an internetwork address with universal jurisdiction.","[""physical"",""logical"",""a and b"",""none of the above""]",1
"In IGMP, a membership report is sent _______.","[""once"",""twice"",""three times"",""none of the above""]",1
