question,choices,answer
"How many carrier frequencies are used in BPSK?","[""0"",""1"",""2"",""none of the above""]",1
"The constellation diagram of 16-QAM has ______ dots.","[""4"",""8"",""16"",""none of the above""]",2
"AM and FM are examples of ________ conversion.","[""analog-to-analog"",""digital-to-digital"",""analog-to-digital"",""digital-to-analog""]",0
"The Federal Communications Commission (FCC) allows ______ kHz for each FM station.","[""20"",""100"",""200"",""none of the above""]",1
"Analog-to-analog conversion is needed if the available bandwidth is _______.","[""band-pass"",""low-pass"",""either (a) or (b)"",""neither (a) nor (b)""]",0
"In _____ transmission, the frequency of the carrier signal is modulated to follow the changing voltage level (amplitude) of the modulating signal. The peak amplitude and phase of the carrier signal remain constant, but as the amplitude of the information signal changes, the frequency of the carrier changes correspondingly.","[""AM"",""FM"",""PM"",""none of the above""]",1
"How many carrier frequencies are used in QPSK?","[""0"",""2"",""1"",""none of the above""]",1
"Which of the following is not a digital-to-analog conversion?","[""FSK"",""ASK"",""AM"",""PSK""]",2
"_______ conversion is the process of changing one of the characteristics of an analog signal based on the information in the digital data.","[""Analog-to-analog"",""Digital-to-digital"",""Digital-to-analog"",""Analog-to-digital""]",2
"If the baud rate is 400 for a QPSK signal, the bit rate is ________ bps.","[""100"",""400"",""800"",""1600""]",2
"In ________, the phase of the carrier is varied to represent two or more different signal elements. Both peak amplitude and frequency remain constant.","[""PSK"",""FSK"",""ASK"",""QAM""]",0
"Which of the following is not an analog-to-analog conversion?","[""QAM"",""AM"",""PM"",""FM""]",0
"How many carrier frequencies are used in BASK?","[""0"",""1"",""2"",""none of the above""]",1
"Quadrature amplitude modulation (QAM) is a combination of ___________.","[""PSK and FSK"",""ASK and FSK"",""ASK and PSK"",""none of the above""]",2
"In _________, the frequency of the carrier signal is varied to represent data. Both peak amplitude and phase remain constant.","[""ASK"",""FSK"",""PSK"",""QAM""]",1
"If the bit rate for an ASK signal is 1200 bps, the baud rate is ________.","[""1200"",""600"",""400"",""300""]",0
"The constellation diagram of BPSK has ______ dots.","[""0"",""1"",""2"",""none of the above""]",2
"The constellation diagram of QPSK has ______ dots.","[""4"",""2"",""1"",""none of the above""]",0
"In _______, the peak amplitude of one signal level is 0; the other is the same as the amplitude of the carrier frequency.","[""OOK"",""PSK"",""FSK"",""none of the above""]",0
"If the bit rate for a 16-QAM signal is 4000 bps, what is the baud rate?","[""1200"",""1000"",""400"",""300""]",1
"ASK, PSK, FSK, and QAM are examples of ________ conversion.","[""analog-to-analog"",""digital-to-digital"",""analog-to-digital"",""digital-to-analog""]",3
"If the bit rate for an FSK signal is 1200 bps, the baud rate is ________.","[""1200"",""600"",""400"",""300""]",0
"The constellation diagram of BASK has ______ dots.","[""0"",""1"",""2"",""none of the above""]",2
"The Federal Communications Commission (FCC) allows ______kHz for each AM station.","[""20"",""10"",""5"",""none of the above""]",1
"How many carrier frequencies are used in BFSK?","[""2"",""1"",""0"",""none of the above""]",0
"In _____ transmission, the phase of the carrier signal is modulated to follow the changing voltage level (amplitude) of the modulating signal.","[""AM"",""FM"",""PM"",""none of the above""]",2
"_________ conversion is the representation of analog information by an analog signal.","[""Analog-to-analog"",""Digital-to-digital"",""Analog-to-digital"",""Digital-to-analog""]",0
"In _____ transmission, the carrier signal is modulated so that its amplitude varies with the changing amplitudes of the modulating signal.","[""PM"",""FM"",""AM"",""none of the above""]",2
"In QAM, both ________ of a carrier frequency are varied.","[""phase and frequency"",""amplitude and phase"",""frequency and amplitude"",""none of the above""]",1
"________ uses two carriers, one in-phase and the other quadrature.","[""QAM"",""ASK"",""FSK"",""PSK""]",0
"Given an AM radio signal with a bandwidth of 10 KHz and the highest-frequency component at 705 KHz, what is the frequency of the carrier signal?","[""710 KHz"",""705 KHz"",""700 KHz"",""Cannot be determined from given information""]",2
"A constellation diagram shows us the __________ of a signal element, particularly when we are using two carriers (one in-phase and one quadrature).","[""amplitude and frequency"",""amplitude and phase"",""frequency and phase"",""none of the above""]",1
"If the baud rate for a 64-QAM signal is 2000, what is the bit rate?","[""12000"",""1000"",""400"",""300""]",0
"In synchronous TDM, for n signal sources of the same data rate, each frame contains _______ slots.","[""n + 1"",""n \u2013 1"",""0 to n"",""n""]",3
"Which multiplexing technique transmits digital signals?","[""WDM"",""FDM"",""TDM"",""None of the above""]",2
"The sharing of a medium and its link by two or more devices is called _______.","[""modulation"",""multiplexing"",""encoding"",""line discipline""]",1
"_______ is designed to be used in wireless applications in which stations must be able to share the medium without interception by an eavesdropper and without being subject to jamming from a malicious intruder.","[""Multiplexing"",""Spread spectrum"",""Modulation"",""None of the above.""]",1
"______ is an analog multiplexing technique to combine optical signals.","[""WDM"",""FDM"",""TDM"",""None of the above""]",0
"FDM is an _________technique.","[""digital"",""analog"",""either (a) or (b)"",""none of the above""]",1
"______ can be applied when the bandwidth of a link (in hertz) is greater than the combined bandwidths of the signals to be transmitted.","[""TDM"",""FDM"",""Both (a) or (b)"",""Neither (a) or (b)""]",1
"In TDM, the transmission rate of the multiplexed path is usually _______ the sum of the transmission rates of the signal sources.","[""equal to"",""less than"",""greater than"",""not related to""]",2
"In a multiplexed system, ____ lines share the bandwidth of _____ link.","[""1; n"",""n; 1"",""1; 1"",""n; n""]",1
"_________ utilization is the use of available bandwidth to achieve specific goals.","[""Amplitude"",""Frequency"",""Bandwidth"",""None of the above""]",2
"____ is designed to use the high bandwidth capability of fiber-optic cable.","[""WDM"",""FDM"",""TDM"",""None of the above""]",0
"We can divide ____ into two different schemes: synchronous or statistical.","[""WDM"",""TDM"",""FDM"",""none of the above""]",1
"In ________ TDM, each input connection has an allotment in the output even if it is not sending data.","[""isochronous"",""statistical"",""synchronous"",""none of the above""]",2
"In ________ TDM, slots are dynamically allocated to improve bandwidth efficiency.","[""isochronous"",""synchronous"",""statistical"",""none of the above""]",2
"The word ______ refers to the portion of a _______ that carries a transmission.","[""line; channel"",""channel; link"",""link; channel"",""line; link""]",1
"Which multiplexing technique shifts each signal to a different carrier frequency?","[""FDM"",""TDM"",""Both (a) and (b)"",""None of the above""]",0
"Which multiplexing technique transmits analog signals?","[""WDM"",""TDM"",""FDM"",""(a) and (c)""]",3
"________ is the set of techniques that allows the simultaneous transmission of multiple signals across a single data link.","[""Demodulating"",""Multiplexing"",""Compressing"",""None of the above""]",1
"________ can be achieved by using multiplexing; ______ can be achieved by using spreading.","[""Privacy and antijamming; efficiency"",""Privacy and efficiency; antijamming"",""Efficiency; privacy and antijamming"",""Efficiency and antijamming; privacy""]",2
"The ______ technique expands the bandwidth of a signal by replacing each data bit with n bits.","[""DSSS"",""FHSS"",""FDM"",""TDM""]",0
"________ is a digital process that allows several connections to share the high bandwidth of a link.","[""WDM"",""TDM"",""FDM"",""None of the above""]",1
"_______ is a digital multiplexing technique for combining several low-rate channels into one high-rate one.","[""WDM"",""TDM"",""FDM"",""None of the above""]",1
"In ________, we combine signals from different sources to fit into a larger bandwidth.","[""line coding"",""block coding"",""spread spectrum"",""none of the above""]",2
"Which multiplexing technique involves signals composed of light beams?","[""WDM"",""FDM"",""TDM"",""none of the above""]",0
"The _______ defines the maximum data rate of the traffic.","[""peak data rate"",""maximum burst size"",""effective bandwidth"",""none of the above""]",0
"In Frame Relay, the _____________ defines an average rate in bits per second.","[""access rate"",""committed burst size"",""committed information rate"",""excess burst size""]",2
"In ________ congestion control, policies are applied to prevent congestion before it happens.","[""open-loop"",""closed-loop"",""either (a) or (b)"",""neither (a) nor (b)""]",0
"In ________ we try to avoid traffic congestion.","[""congestion control"",""quality of service"",""either (a) or (b)"",""both (a) and (b)""]",0
"_________ is a characteristic that a flow needs. Lack of it means losing a packet or acknowledgment, which entails retransmission.","[""Reliability"",""Delay"",""Jitter"",""Bandwidth""]",0
"In a network, after the load reaches the capacity, throughput _______.","[""increases sharply"",""increases proportionally with the load"",""declines sharply"",""declines proportionally with the load""]",2
"In _________ queuing, the packets are assigned to different classes and admitted to different queues. The queues, however, are weighted based on the priority of the queues; higher priority means a higher weight. The system processes packets in each queue in a round-robin fashion with the number of packets selected from each queue based on the corresponding weight.","[""FIFO"",""priority"",""weighted fair"",""none of the above""]",2
"In ATM, the _________ class is a best-effort delivery service that does not guarantee anything.","[""CBR"",""VBR"",""ABR"",""UBR""]",3
"The________ normally refers to the maximum length of time the traffic is generated at the peak rate.","[""peak data rate"",""maximum burst size"",""effective bandwidth"",""none of the above""]",1
"In _______ congestion control, mechanisms are used to alleviate congestion after it happens.","[""open-loop"",""closed-loop"",""either (a) or (b)"",""neither (a) nor (b)""]",1
"_______ happens in any system that involves waiting.","[""Congestion"",""Jamming"",""Error"",""none of the above""]",0
"In the ________ algorithm of TCP, the size of the congestion window increases exponentially until it reaches a threshold.","[""slow-start"",""congestion avoidance"",""congestion detection"",""none of the above""]",0
"In Frame Relay, the user can never exceed the_________.","[""access rate"",""committed burst size"",""committed information rate"",""excess burst size""]",0
"In the ___________ algorithm of TCP, the size of the threshold is dropped to one-half, a multiplicative decrease.","[""slow-start"",""congestion avoidance"",""congestion detection"",""none of the above""]",2
"In _________, when a source makes a reservation, it needs to define a flow specification.","[""Integrated Services"",""Differentiated Services"",""Connectionless"",""Connection-Oriented""]",0
"A _________ traffic model has a data rate that does not change.","[""constant bit rate"",""variable bit rate"",""bursty"",""none of the above""]",0
"________ is the variation in delay for packets belonging to the same flow.","[""Reliability"",""Delay"",""Jitter"",""Bandwidth""]",2
"A ___________ is a packet sent by a node to the source to inform it of congestion.","[""backpressure"",""choke packet"",""implicit signaling"",""explicit signaling""]",1
"In ATM, the _________ class delivers cells at a minimum rate. If more network capacity is available, this minimum rate can be exceeded.","[""CBR"",""VBR"",""ABR"",""UBR""]",2
"In the ________ traffic model, the rate of the data flow changes in time, with the changes smooth instead of sudden and sharp.","[""constant bit rate"",""variable bit rate"",""bursty"",""none of the above""]",1
"In __________, there is no communication between the congested node or nodes and the source. The source guesses that there is a congestion somewhere in the network from other symptoms.","[""backpressure"",""choke packet"",""implicit signaling"",""explicit signaling""]",2
"In a network, when the load reaches the network capacity, the delay _______.","[""increases sharply"",""decreases sharply"",""remains constant"",""cannot be predicted""]",0
"The technique of ________refers to a congestion control mechanism in which a congested node stops receiving data from the immediate upstream node or nodes.","[""backpressure"",""choke packet"",""implicit signaling"",""explicit signaling""]",0
"In ________ queuing, packets are first assigned to a priority class. Each class has its own queue.","[""FIFO"",""priority"",""weighted fair"",""none of the above""]",1
"In ________, queuing packets wait in a buffer (queue) until the node (router or switch) is ready to process them.","[""FIFO"",""priority"",""weighted fair"",""none of the above""]",0
"Traditionally, ________types of characteristics are attributed to a flow.","[""two"",""three"",""four"",""five""]",2
"In Frame Relay, the ___________ is the maximum number of bits in excess of Bc that a user can send during a predefined time.","[""access rate"",""committed burst size"",""committed information rate"",""excess burst size""]",3
"In a network, when the load is below the capacity of the network, the throughput ______________.","[""increases sharply"",""increases proportionally with the load"",""declines sharply"",""declines proportionally with the load""]",1
"In the __________ method, the signal is included in the packets that carry data.","[""backpressure"",""choke packet"",""implicit signaling"",""explicit signaling""]",3
"In a network, when the load is much less than the capacity of the network, the delay is _________.","[""at a maximum"",""at a minimum"",""constant"",""none of the above""]",1
"Congestion in a network or internetwork occurs because routers and switches have _______.","[""tables"",""queues"",""crosspoints"",""none of the above""]",1
"In _________, we try to create an appropriate environment for the traffic.","[""congestion control"",""quality of service"",""either (a) or (b)"",""both (a) and (b)""]",1
"In Frame Relay, the ________ bit warns the sender of congestion in the network.","[""BECN"",""FECN"",""either (a) or (b)"",""neither (a) nor (b)""]",0
"In Frame Relay, the ________ bit is used to warn the receiver of congestion in the network.","[""BECN"",""FECN"",""either (a) or (b)"",""neither (a) nor (b)""]",1
"The ________ is a function of three values: average data rate, peak data rate, and maximum burst size.","[""peak data rate"",""maximum burst size"",""effective bandwidth"",""none of the above""]",2
"In the _________ algorithm of TCP, the size of the congestion window increases additively until congestion is detected.","[""slow-start"",""congestion avoidance"",""congestion detection"",""none of the above""]",1
"In ATM, the _________ class is divided into two subclasses: real-time (VBR-RT) and non-real-time (VBR-NRT). VBR-RT is designed for those users who need real-time services (such as voice and video transmission) and use compression techniques to create a variable bit rate. VBR-NRT is designed for those users who do not need real-time services but use compression techniques to create a variable bit rate.","[""CBR"",""VBR"",""ABR"",""UBR""]",1
"Traffic ______ are qualitative values that represent a data flow.","[""controls"",""descriptors"",""values"",""none of the above""]",1
"_________ is a class-based QoS model designed for IP.","[""Integrated Services"",""Differentiated Services"",""Connectionless"",""Connection-Oriented""]",1
"In the ______ bucket algorithm, bursty chunks are stored in the bucket and sent out at an average rate.","[""leaky"",""token"",""either (a) or (b)"",""neither (a) nor (b)""]",0
"The _______ bucket algorithm allows idle hosts to accumulate credit for the future in the form of tokens.","[""leaky"",""token"",""either (a) or (b)"",""neither (a) nor (b)""]",1
"In ATM, the _________ class is designed for customers who need real-time audio or video services. The service is similar to that provided by a dedicated line such as a T line.","[""CBR"",""VBR"",""ABR"",""UBR""]",0
"In the ______ traffic model, the data rate changes suddenly in a very short time.","[""constant bit rate"",""variable bit rate"",""bursty"",""none of the above""]",2
"In Frame Relay, a ___________ is the maximum number of bits in a predefined time that the network is committed to transfer without discarding any frame or setting the DE bit.","[""access rate"",""committed burst size"",""committed information rate"",""excess burst size""]",1
"A _______ is a device that operates only in the physical layer.","[""bridge"",""router"",""passive hub"",""repeater""]",3
"A ______ switch is a faster and more sophisticated router.","[""two-layer"",""four-layer"",""three-layer"",""none of the above""]",2
"_________ is just a connector.","[""A passive hub"",""An active hub"",""either (a) or (b)"",""neither (a) nor (b)""]",0
"A ______ normally connects LANs and WANs in the Internet and has a table that is used for making decisions about the route.","[""router"",""bridge"",""repeater"",""none of the above""]",0
"A _______ regenerates a signal, connects segments of a LAN, and has no filtering capability.","[""router"",""repeater"",""bridge"",""none of the above""]",1
"In a(n) _______ configuration, the administrator types the port numbers, the IP addresses, or other characteristics, using the VLAN software.","[""automatic"",""manual"",""semiautomatic"",""none of the above""]",1
"A _______ LAN allows several LANs to be connected.","[""wired"",""wireless"",""backbone"",""none of the above""]",2
"A backbone is usually a ______.","[""star"",""bus"",""either (a) or (b)"",""neither (a) nor (b)""]",2
"A bridge can use the _________ algorithm to create a loopless topology.","[""multiway tree"",""binary tree"",""spanning tree"",""none of the above""]",2
"In a _____ backbone, the backbone is just one switch.","[""star"",""bus"",""ring"",""none of the above""]",0
"A spanning tree is a graph in which there is no _____.","[""arc"",""loop"",""node"",""branch""]",1
"A ________ bridge can forward and filter frames and automatically build its forwarding table.","[""dual"",""transparent"",""simple"",""none of the above""]",1
"A virtual local area network (VLAN) is configured by _________.","[""hardware"",""physical wiring"",""software"",""none of the above""]",2
"A ________ is normally a computer that operates in all five layers of the Internet model or seven layers of OSI model.","[""gateway"",""router"",""bridge"",""repeater""]",0
"A ________ is a device in which the stations are completely unaware of its existence.","[""simple bridge"",""transparent bridge"",""passive hub"",""repeater""]",1
"A ______ has a table used in filtering decisions.","[""bridge"",""passive hub"",""repeater"",""none of the above""]",0
"In a star-topology Ethernet LAN, _______ is just a point where the signals coming from different stations collide; it is the collision point.","[""A passive hub"",""An active hub"",""either (a) or (b)"",""neither (a) nor (b)""]",0
"VLANs can_________.","[""provide an extra measure of security"",""reduce network traffic"",""either (a) or (b)"",""both (a) and (b)""]",3
"A ________ link acts as a LAN in a remote backbone connected by remote bridges.","[""multidrop"",""point-to-point"",""multipoint"",""none of the above""]",1
"A _______ is a connecting device that operates in the physical and data link layers of the Internet model.","[""router"",""repeater"",""bridge"",""none of the above""]",2
"A _______ can check the MAC addresses contained in the frame.","[""repeater"",""bridge"",""router"",""passive hub""]",1
"________ is part of the media; its location in the Internet model is below the physical layer.","[""A passive hub"",""An active hub"",""either (a) or (b)"",""neither (a) nor (b)""]",0
"In a(n) _____ configuration, the stations are automatically connected or disconnected from a VLAN using criteria defined by the administrator.","[""automatic"",""semiautomatic"",""manual"",""none of the above""]",0
"IEEE 802.1d specification, defines _________ criteria for a transparent bridges.","[""two"",""four"",""three"",""none of the above""]",2
"A two-layer switch is a ______.","[""router"",""repeater"",""bridge"",""none of the above""]",2
"In a bridged LAN, the _______ algorithm creates a topology in which each LAN can be reached from any other LAN through one path only.","[""binary tree"",""spanning tree"",""unary tree"",""none of the above""]",1
"A _____ can be used as a connecting device between two internetworks that use different models.","[""gateway"",""router"",""bridge"",""repeater""]",0
"Membership in a VLAN can be based on _________.","[""MAC addresses"",""IP addresses"",""port numbers"",""all of the above""]",3
"A ________receives a signal and, before it becomes too weak or corrupted, regenerates the original bit pattern. It then sends the refreshed signal.","[""router"",""bridge"",""repeater"",""passive hub""]",2
"In a(n) ______ configuration, the initializing is done manually, with migrations done automatically.","[""automatic"",""semiautomatic"",""manual"",""none of the above""]",1
"A _______ is a three-layer device that handles packets based on their logical addresses.","[""router"",""repeater"",""bridge"",""none of the above""]",0
"A three-layer switch is a kind of ________.","[""bridge"",""router"",""repeater"",""none of the above""]",1
"Some new two-layer switches, called _______ switches, have been designed to forward the frame as soon as they check the MAC addresses in the header of the frame.","[""come-through"",""go-through"",""cut-through"",""none of the above""]",2
"A(n) ______ algorithm transforms ciphertext to plaintext.","[""encryption"",""decryption"",""either (a) or (b)"",""neither (a) nor (b)""]",1
"The ________ is the message after transformation.","[""ciphertext"",""plaintext"",""secret-text"",""none of the above""]",0
"A(n) _______ algorithm transforms plaintext to ciphertext.","[""encryption"",""decryption"",""either (a) or (b)"",""neither (a) nor (b)""]",0
"The ________ method provides a one-time session key for two parties.","[""Diffie-Hellman"",""RSA"",""DES"",""AES""]",0
"A(n) ______ is a keyless substitution cipher with N inputs and M outputs that uses a formula to define the relationship between the input stream and the output stream.","[""S-box"",""P-box"",""T-box"",""none of the above""]",0
"A ________ cipher replaces one character with another character.","[""substitution"",""transposition"",""either (a) or (b)"",""neither (a) nor (b)""]",0
"The ________ cipher reorders the plaintext characters to create a ciphertext.","[""substitution"",""transposition"",""either (a) or (b)"",""neither (a) nor (b)""]",1
"_______ is a round cipher based on the Rijndael algorithm that uses a 128-bit block of data.","[""AEE"",""AED"",""AER"",""AES""]",3
"The ________is the original message before transformation.","[""ciphertext"",""plaintext"",""secret-text"",""none of the above""]",1
"A modern cipher is usually a complex _____cipher made of a combination of different simple ciphers.","[""round"",""circle"",""square"",""none of the above""]",0
"The _________ attack can endanger the security of the Diffie-Hellman method if two parties are not authenticated to each other.","[""man-in-the-middle"",""ciphertext attack"",""plaintext attack"",""none of the above""]",0
"A combination of an encryption algorithm and a decryption algorithm is called a ________.","[""cipher"",""secret"",""key"",""none of the above""]",0
"In an asymmetric-key cipher, the receiver uses the ______ key.","[""private"",""public"",""either a or b"",""neither (a) nor (b)""]",0
"AES has _____ different configurations.","[""two"",""three"",""four"",""five""]",1
"DES is a(n) ________ method adopted by the U.S. government.","[""symmetric-key"",""asymmetric-key"",""either (a) or (b)"",""neither (a) nor (b)""]",0
"DES uses a key generator to generate sixteen _______ round keys.","[""32-bit"",""48-bit"",""54-bit"",""42-bit""]",1
"The Caesar cipher is a _______cipher that has a key of 3.","[""transposition"",""additive"",""shift"",""none of the above""]",2
"ECB and CBC are ________ ciphers.","[""block"",""stream"",""field"",""none of the above""]",0
"A(n) _______is a keyless transposition cipher with N inputs and M outputs that uses a table to define the relationship between the input stream and the output stream.","[""S-box"",""P-box"",""T-box"",""none of the above""]",1
"________ DES was designed to increase the size of the DES key.","[""Double"",""Triple"",""Quadruple"",""none of the above""]",1
"________ is the science and art of transforming messages to make them secure and immune to attacks.","[""Cryptography"",""Cryptoanalysis"",""either (a) or (b)"",""neither (a) nor (b)""]",0
"DES has an initial and final permutation block and _________ rounds.","[""14"",""15"",""16"",""none of the above""]",2
"The DES function has _______ components.","[""2"",""3"",""4"",""5""]",2
"In a(n) ________ cipher, the same key is used by both the sender and receiver.","[""symmetric-key"",""asymmetric-key"",""either (a) or (b)"",""neither (a) nor (b)""]",0
